name	title	slot_uri	comments	description	examples	in_subset	keywords	multivalued	pattern	range	recommended	required	string_serialization	structured_pattern	Expected_value	Preferred_unit
adapters	adapters	MIXS:0000048		Adapters provide priming sequences for both amplification and sequencing of the sample-library fragments. Both adapters should be reported; in uppercase letters	{'value': 'AATGATACGGCGACCACCGAGATCTACACGCT;CAAGCAGAAGACGGCATACGAGAT'}	sequencing				string	True		{dna};{dna}		adapter A and B sequence	
air_temp_regm	air temperature regimen	MIXS:0000551		Information about treatment involving an exposure to varying temperatures; should include the temperature, treatment regimen including how many times the treatment was repeated, how long each treatment lasted, and the start and end time of the entire treatment; can include different temperature regimens	{'value': '25 degree Celsius;R2/2018-05-11T14:30/2018-05-11T19:30/P1H30M'}		air|regimen|temperature	True		string			{float} {unit};{Rn/start_time/end_time/duration}		temperature value;treatment interval and duration	meter
alt	altitude	MIXS:0000094		Heights of objects such as airplanes, space shuttles, rockets, atmospheric balloons and heights of places such as atmospheric layers and clouds. It is used to measure the height of an object which is above the earth's surface. In this context, the altitude measurement is the vertical distance between the earth's surface above sea level and the sampled position in the air	{'value': '100 meter'}	environment			^[-+]?[0-9]*\.?[0-9]+(?:[eE][-+]?[0-9]+)?( *- *[-+]?[0-9]*\.?[0-9]+(?:[eE][-+]?[0-9]+)?)? *([^\s-]{1,2}|[^\s-]+.+[^\s-]+)$	string	True			{'syntax': '^{scientific_float}( *- *{scientific_float})? *{text}$', 'interpolated': True, 'partial_match': True}		meter
ances_data	ancestral data	MIXS:0000247		Information about either pedigree or other ancestral information description (e.g. parental variety in case of mutant or selection), e.g. A/3*B (meaning [(A x B) x B] x B)	{'value': 'A/3*B'}					string						
antibiotic_regm	antibiotic regimen	MIXS:0000553		Information about treatment involving antibiotic administration; should include the name of antibiotic, amount administered, treatment regimen including how many times the treatment was repeated, how long each treatment lasted, and the start and end time of the entire treatment; can include multiple antibiotic regimens	{'value': 'penicillin;5 milligram;R2/2018-05-11T14:30/2018-05-11T19:30/P1H30M'}		regimen	True		string			{text};{float} {unit};{Rn/start_time/end_time/duration}		antibiotic name;antibiotic amount;treatment interval and duration	milligram
assembly_software	assembly software	MIXS:0000058		Tool(s) used for assembly, including version number and parameters	{'value': 'metaSPAdes;3.11.0;kmer set 21,33,55,77,99,121, default parameters otherwise'}	sequencing	software		^([^\s-]{1,2}|[^\s-]+.+[^\s-]+);([^\s-]{1,2}|[^\s-]+.+[^\s-]+);([^\s-]{1,2}|[^\s-]+.+[^\s-]+)$	string	True			{'syntax': '^{software};{version};{parameters}$', 'interpolated': True, 'partial_match': True}		
associated_resource	relevant electronic resources	MIXS:0000091		A related resource that is referenced, cited, or otherwise associated to the sequence	{'value': 'http://www.earthmicrobiome.org/'}	sequencing	resource	True		string	True		{PMID}|{DOI}|{URL}		reference to resource	
biol_stat	biological status	MIXS:0000858		The level of genome modification	{'value': 'natural'}		status			string			[wild|natural|semi-natural|inbred line|breeder's line|hybrid|clonal selection|mutant]		enumeration	
biotic_regm	biotic regimen	MIXS:0001038		Information about treatment(s) involving use of biotic factors, such as bacteria, viruses or fungi	{'value': 'sample inoculated with Rhizobium spp. Culture'}		regimen	True		string						
chem_administration	chemical administration	MIXS:0000751		List of chemical compounds administered to the host or site where sampling occurred, and when (e.g. Antibiotics, n fertilizer, air filter); can include multiple compounds. For chemical entities of biological interest ontology (chebi) (v 163), http://purl.bioontology.org/ontology/chebi	{'value': 'agar [CHEBI:2509];2018-05-11T20:00Z'}		administration	True		string			{termLabel} [{termID}];{timestamp}		CHEBI;timestamp	
chem_mutagen	chemical mutagen	MIXS:0000555		Treatment involving use of mutagens; should include the name of mutagen, amount administered, treatment regimen including how many times the treatment was repeated, how long each treatment lasted, and the start and end time of the entire treatment; can include multiple mutagen regimens	{'value': 'nitrous acid;0.5 milligram per liter;R2/2018-05-11T14:30/2018-05-11T19:30/P1H30M'}			True		string			{text};{float} {unit};{Rn/start_time/end_time/duration}		mutagen name;mutagen amount;treatment interval and duration	milligram per liter
chimera_check	chimera check software	MIXS:0000052		Tool(s) used for chimera checking, including version number and parameters, to discover and remove chimeric sequences. A chimeric sequence is comprised of two or more phylogenetically distinct parent sequences	{'value': 'uchime;v4.1;default parameters'}	sequencing	software		^([^\s-]{1,2}|[^\s-]+.+[^\s-]+);([^\s-]{1,2}|[^\s-]+.+[^\s-]+);([^\s-]{1,2}|[^\s-]+.+[^\s-]+)$	string	True			{'syntax': '^{software};{version};{parameters}$', 'interpolated': True, 'partial_match': True}		
climate_environment	climate environment	MIXS:0001040		Treatment involving an exposure to a particular climate; treatment regimen including how many times the treatment was repeated, how long each treatment lasted, and the start and end time of the entire treatment; can include multiple climates	{'value': 'tropical climate;R2/2018-05-11T14:30/2018-05-11T19:30/P1H30M'}		environment	True		string			{text};{Rn/start_time/end_time/duration}			
collection_date	collection date	MIXS:0000011		The time of sampling, either as an instance (single point in time) or interval. In case no exact time is available, the date/time can be right truncated i.e. all of these are valid times: 2008-01-23T19:23:10+00:00; 2008-01-23T19:23:10; 2008-01-23; 2008-01; 2008; Except: 2008-01; 2008 all are ISO8601 compliant	{'value': '2013-03-25T12:42:31+01:00'}	environment	date			datetime		True				
cult_root_med	culture rooting medium	MIXS:0001041		Name or reference for the hydroponic or in vitro culture rooting medium; can be the name of a commonly used medium or reference to a specific medium, e.g. Murashige and Skoog medium. If the medium has not been formally published, use the rooting medium descriptors	{'value': 'http://himedialabs.com/TD/PT158.pdf'}		culture			string			{text}|{PMID}|{DOI}|{URL}		name, PMID,DOI or url	
depth	depth	MIXS:0000018		The vertical distance below local surface. For sediment or soil samples depth is measured from sediment or soil surface, respectively. Depth can be reported as an interval for subsurface samples	{'value': '10 meter'}	environment	depth		^[-+]?[0-9]*\.?[0-9]+(?:[eE][-+]?[0-9]+)?( *- *[-+]?[0-9]*\.?[0-9]+(?:[eE][-+]?[0-9]+)?)? *([^\s-]{1,2}|[^\s-]+.+[^\s-]+)$	string	True			{'syntax': '^{scientific_float}( *- *{scientific_float})? *{text}$', 'interpolated': True, 'partial_match': True}		meter
elev	elevation	MIXS:0000093		Elevation of the sampling site is its height above a fixed reference point, most commonly the mean sea level. Elevation is mainly used when referring to points on the earth's surface, while altitude is used for points above the surface, such as an aircraft in flight or a spacecraft in orbit	{'value': '100 meter'}	environment	elevation		^[-+]?[0-9]*\.?[0-9]+(?:[eE][-+]?[0-9]+)?( *- *[-+]?[0-9]*\.?[0-9]+(?:[eE][-+]?[0-9]+)?)? *([^\s-]{1,2}|[^\s-]+.+[^\s-]+)$	string	True			{'syntax': '^{scientific_float}( *- *{scientific_float})? *{text}$', 'interpolated': True, 'partial_match': True}		meter
env_broad_scale	broad-scale environmental context	MIXS:0000012		Report the major environmental system the sample or specimen came from. The system(s) identified should have a coarse spatial grain, to provide the general environmental context of where the sampling was done (e.g. in the desert or a rainforest). We recommend using subclasses of EnvO s biome class:  http://purl.obolibrary.org/obo/ENVO_00000428. EnvO documentation about how to use the field: https://github.com/EnvironmentOntology/envo/wiki/Using-ENVO-with-MIxS	{'value': 'rangeland biome [ENVO:01000247]'}	environment	context|environmental		^([^\s-]{1,2}|[^\s-]+.+[^\s-]+) \[[a-zA-Z]{2,}:[a-zA-Z0-9]\d+\]$	string		True		{'syntax': '^{termLabel} \\[{termID}\\]$', 'interpolated': True, 'partial_match': True}		
env_local_scale	local environmental context	MIXS:0000013		Report the entity or entities which are in the sample or specimen s local vicinity and which you believe have significant causal influences on your sample or specimen. We recommend using EnvO terms which are of smaller spatial grain than your entry for env_broad_scale. Terms, such as anatomical sites, from other OBO Library ontologies which interoperate with EnvO (e.g. UBERON) are accepted in this field. EnvO documentation about how to use the field: https://github.com/EnvironmentOntology/envo/wiki/Using-ENVO-with-MIxS	{'value': 'hillside [ENVO:01000333]'}	environment	context|environmental			string		True	{termLabel} [{termID}]		Environmental entities having causal influences upon the entity at time of sampling	
env_medium	environmental medium	MIXS:0000014		Report the environmental material(s) immediately surrounding the sample or specimen at the time of sampling. We recommend using subclasses of 'environmental material' (http://purl.obolibrary.org/obo/ENVO_00010483). EnvO documentation about how to use the field: https://github.com/EnvironmentOntology/envo/wiki/Using-ENVO-with-MIxS . Terms from other OBO ontologies are permissible as long as they reference mass/volume nouns (e.g. air, water, blood) and not discrete, countable entities (e.g. a tree, a leaf, a table top)	{'value': 'bluegrass field soil [ENVO:00005789]'}	environment	environmental		^([^\s-]{1,2}|[^\s-]+.+[^\s-]+) \[[a-zA-Z]{2,}:[a-zA-Z0-9]\d+\]$	string		True		{'syntax': '^{termLabel} \\[{termID}\\]$', 'interpolated': True, 'partial_match': True}		
experimental_factor	experimental factor	MIXS:0000008		Variable aspects of an experiment design that can be used to describe an experiment, or set of experiments, in an increasingly detailed manner. This field accepts ontology terms from Experimental Factor Ontology (EFO) and/or Ontology for Biomedical Investigations (OBI)	{'value': 'time series design [EFO:0001779]'}	investigation	experimental|factor	True	^\S+.*\S+ \[[a-zA-Z]{2,}:\d+\]$	string	True		{termLabel} [{termID}]|{text}		text or EFO and/or OBI	
fertilizer_regm	fertilizer regimen	MIXS:0000556		Information about treatment involving the use of fertilizers; should include the name of fertilizer, amount administered, treatment regimen including how many times the treatment was repeated, how long each treatment lasted, and the start and end time of the entire treatment; can include multiple fertilizer regimens	{'value': 'urea;0.6 milligram per liter;R2/2018-05-11:T14:30/2018-05-11T19:30/P1H30M'}		regimen	True		string			{text};{float} {unit};{Rn/start_time/end_time/duration}		fertilizer name;fertilizer amount;treatment interval and duration	gram, mole per liter, milligram per liter
fungicide_regm	fungicide regimen	MIXS:0000557		Information about treatment involving use of fungicides; should include the name of fungicide, amount administered, treatment regimen including how many times the treatment was repeated, how long each treatment lasted, and the start and end time of the entire treatment; can include multiple fungicide regimens	{'value': 'bifonazole;1 mole per liter;R2/2018-05-11T14:30/2018-05-11T19:30/P1H30M'}		regimen	True		string			{text};{float} {unit};{Rn/start_time/end_time/duration}			gram, mole per liter, milligram per liter
gaseous_environment	gaseous environment	MIXS:0000558		Use of conditions with differing gaseous environments; should include the name of gaseous compound, amount administered, treatment duration, interval and total experimental duration; can include multiple gaseous environment regimens	{'value': 'nitric oxide;0.5 micromole per liter;R2/2018-05-11T14:30/2018-05-11T19:30/P1H30M'}		environment	True		string			{text};{float} {unit};{Rn/start_time/end_time/duration}			micromole per liter
genetic_mod	genetic modification	MIXS:0000859		Genetic modifications of the genome of an organism, which may occur naturally by spontaneous mutation, or be introduced by some experimental means, e.g. specification of a transgene or the gene knocked-out or details of transient transfection	{'value': 'aox1A transgenic'}					string			{PMID}|{DOI}|{URL}		PMID, DOI, URL or text	
geo_loc_name	geographic location (country and/or sea,region)	MIXS:0000010		The geographical origin of the sample as defined by the country or sea name followed by specific region name. Country or sea names should be chosen from the INSDC country list (http://insdc.org/country.html), or the GAZ ontology (http://purl.bioontology.org/ontology/GAZ)	{'value': 'USA: Maryland, Bethesda'}	environment	geographic|location		^([^\s-]{1,2}|[^\s-]+.+[^\s-]+): ([^\s-]{1,2}|[^\s-]+.+[^\s-]+), ([^\s-]{1,2}|[^\s-]+.+[^\s-]+)$	string		True		{'syntax': '^{text}: {text}, {text}$', 'interpolated': True, 'partial_match': True}		
gravity	gravity	MIXS:0000559		Information about treatment involving use of gravity factor to study various types of responses in presence, absence or modified levels of gravity; treatment regimen including how many times the treatment was repeated, how long each treatment lasted, and the start and end time of the entire treatment; can include multiple treatments	{'value': '12 g;R2/2018-05-11T14:30/2018-05-11T19:30/P1H30M'}			True		string			{float} {unit};{Rn/start_time/end_time/duration}		gravity factor value;treatment interval and duration	meter per square second, g
growth_facil	growth facility	MIXS:0001043		Type of facility where the sampled plant was grown; controlled vocabulary: growth chamber, open top chamber, glasshouse, experimental garden, field. Alternatively use Crop Ontology (CO) terms, see http://www.cropontology.org/ontology/CO_715/Crop%20Research	{'value': 'Growth chamber [CO_715:0000189]'}		facility|growth			string			{text}|{termLabel} [{termID}]		free text or CO	
growth_habit	growth habit	MIXS:0001044		Characteristic shape, appearance or growth form of a plant species	{'value': 'spreading'}		growth			GrowthHabitEnum						
growth_hormone_regm	growth hormone regimen	MIXS:0000560		Information about treatment involving use of growth hormones; should include the name of growth hormone, amount administered, treatment regimen including how many times the treatment was repeated, how long each treatment lasted, and the start and end time of the entire treatment; can include multiple growth hormone regimens	{'value': 'abscisic acid;0.5 milligram per liter;R2/2018-05-11T14:30/2018-05-11T19:30/P1H30M'}		growth|regimen	True		string			{text};{float} {unit};{Rn/start_time/end_time/duration}		growth hormone name;growth hormone amount;treatment interval and duration	gram, mole per liter, milligram per liter
herbicide_regm	herbicide regimen	MIXS:0000561		Information about treatment involving use of herbicides; information about treatment involving use of growth hormones; should include the name of herbicide, amount administered, treatment regimen including how many times the treatment was repeated, how long each treatment lasted, and the start and end time of the entire treatment; can include multiple regimens	{'value': 'atrazine;10 milligram per liter;R2/2018-05-11T14:30/2018-05-11T19:30/P1H30M'}		regimen	True		string			{text};{float} {unit};{Rn/start_time/end_time/duration}			gram, mole per liter, milligram per liter
host_age	host age	MIXS:0000255		Age of host at the time of sampling; relevant scale depends on species and study, e.g. Could be seconds for amoebae or centuries for trees	{'value': '10 days'}		age|host|host.		^[-+]?[0-9]*\.?[0-9]+(?:[eE][-+]?[0-9]+)?( *- *[-+]?[0-9]*\.?[0-9]+(?:[eE][-+]?[0-9]+)?)? *([^\s-]{1,2}|[^\s-]+.+[^\s-]+)$	string				{'syntax': '^{scientific_float}( *- *{scientific_float})? *{text}$', 'interpolated': True, 'partial_match': True}		year, day, hour
host_common_name	host common name	MIXS:0000248		Common name of the host	{'value': 'rice'}		host|host.			string						
host_disease_stat	host disease status	MIXS:0000031		List of diseases with which the host has been diagnosed; can include multiple diagnoses. The value of the field depends on host; for humans the terms should be chosen from the DO (Human Disease Ontology) at https://www.disease-ontology.org, non-human host diseases are free text	{'value': 'downy mildew'}	nucleic acid sequence source	disease|host|host.|status			string			{termLabel} [{termID}]|{text}		disease name or Disease Ontology term	
host_dry_mass	host dry mass	MIXS:0000257		Measurement of dry mass	{'value': '500 gram'}		dry|host|host.|mass		^[-+]?[0-9]*\.?[0-9]+(?:[eE][-+]?[0-9]+)?( *- *[-+]?[0-9]*\.?[0-9]+(?:[eE][-+]?[0-9]+)?)? *([^\s-]{1,2}|[^\s-]+.+[^\s-]+)$	string				{'syntax': '^{scientific_float}( *- *{scientific_float})? *{text}$', 'interpolated': True, 'partial_match': True}		kilogram, gram
host_genotype	host genotype	MIXS:0000365		Observed genotype	{'value': 'Ts'}		host|host.			string						
host_height	host height	MIXS:0000264		The height of subject	{'value': '1 meter'}		height|host|host.		^[-+]?[0-9]*\.?[0-9]+(?:[eE][-+]?[0-9]+)?( *- *[-+]?[0-9]*\.?[0-9]+(?:[eE][-+]?[0-9]+)?)? *([^\s-]{1,2}|[^\s-]+.+[^\s-]+)$	string				{'syntax': '^{scientific_float}( *- *{scientific_float})? *{text}$', 'interpolated': True, 'partial_match': True}		centimeter, millimeter, meter
host_length	host length	MIXS:0000256		The length of subject	{'value': '1 meter'}		host|host.|length		^[-+]?[0-9]*\.?[0-9]+(?:[eE][-+]?[0-9]+)?( *- *[-+]?[0-9]*\.?[0-9]+(?:[eE][-+]?[0-9]+)?)? *([^\s-]{1,2}|[^\s-]+.+[^\s-]+)$	string				{'syntax': '^{scientific_float}( *- *{scientific_float})? *{text}$', 'interpolated': True, 'partial_match': True}		centimeter, millimeter, meter
host_life_stage	host life stage	MIXS:0000251		Description of life stage of host	{'value': 'adult'}		host|host.|life			string			{text}		stage	
host_phenotype	host phenotype	MIXS:0000874		Phenotype of human or other host. Use terms from the phenotypic quality ontology (pato) or the Human Phenotype Ontology (HP)	{'value': 'seed pod; green [PATO:0000320]'}		host|host.			string			{termLabel} [{termID}]		PATO or HP	
host_subspecf_genlin	host subspecific genetic lineage	MIXS:0001318		Information about the genetic distinctness of the host organism below the subspecies level e.g., serovar, serotype, biotype, ecotype, variety, cultivar, or any relevant genetic typing schemes like Group I plasmid. Subspecies should not be recorded in this term, but in the NCBI taxonomy. Supply both the lineage name and the lineage rank separated by a colon, e.g., biovar:abc123	{'value': 'serovar:Newport, variety:glabrum, cultivar: Red Delicious'}		host|host.|lineage	True		string			{rank name}:{text}		Genetic lineage below lowest rank of NCBI taxonomy, which is subspecies, e.g. serovar, biotype, ecotype, variety, cultivar	
host_symbiont	observed host symbionts	MIXS:0001298		The taxonomic name of the organism(s) found living in mutualistic, commensalistic, or parasitic symbiosis with the specific host. The sampled symbiont can have its own symbionts. For example, parasites may have hyperparasites (=parasites of the parasite)	{'value': 'flukeworms'}		host|host.|observed|symbiosis	True		string			{text}		species name or common name	
host_taxid	host taxid	MIXS:0000250		NCBI taxon id of the host, e.g. 9606	{'value': '4530'}		host|host.|taxon			string			{NCBI taxid}		NCBI taxon identifier	
host_tot_mass	host total mass	MIXS:0000263		Total mass of the host at collection, the unit depends on host	{'value': '2500 gram'}		host|host.|mass|total		^[-+]?[0-9]*\.?[0-9]+(?:[eE][-+]?[0-9]+)?( *- *[-+]?[0-9]*\.?[0-9]+(?:[eE][-+]?[0-9]+)?)? *([^\s-]{1,2}|[^\s-]+.+[^\s-]+)$	string				{'syntax': '^{scientific_float}( *- *{scientific_float})? *{text}$', 'interpolated': True, 'partial_match': True}		kilogram, gram
host_wet_mass	host wet mass	MIXS:0000567		Measurement of wet mass	{'value': '1500 gram'}		host|host.|mass|wet		^[-+]?[0-9]*\.?[0-9]+(?:[eE][-+]?[0-9]+)?( *- *[-+]?[0-9]*\.?[0-9]+(?:[eE][-+]?[0-9]+)?)? *([^\s-]{1,2}|[^\s-]+.+[^\s-]+)$	string				{'syntax': '^{scientific_float}( *- *{scientific_float})? *{text}$', 'interpolated': True, 'partial_match': True}		kilogram, gram
humidity_regm	humidity regimen	MIXS:0000568		Information about treatment involving an exposure to varying degree of humidity; information about treatment involving use of growth hormones; should include amount of humidity administered, treatment regimen including how many times the treatment was repeated, how long each treatment lasted, and the start and end time of the entire treatment; can include multiple regimens	{'value': '25 gram per cubic meter;R2/2018-05-11T14:30/2018-05-11T19:30/P1H30M'}		humidity|regimen	True		string			{float} {unit};{Rn/start_time/end_time/duration}		humidity value;treatment interval and duration	gram per cubic meter
lat_lon	geographic location (latitude and longitude)	MIXS:0000009		The geographical origin of the sample as defined by latitude and longitude. The values should be reported in decimal degrees and in WGS84 system	{'value': '50.586825 6.408977'}	environment	geographic|location		^(-?((?:[0-8]?[0-9](?:\.\d{0,8})?)|90)) -?[0-9]+(?:\.[0-9]{0,8})?$|^-?(1[0-7]{1,2})$	string		True	{float} {float}	{'syntax': '^{lat} {lon}$', 'interpolated': True, 'partial_match': True}	decimal degrees,  limit to 8 decimal points	
lib_layout	library layout	MIXS:0000041		Specify whether to expect single, paired, or other configuration of reads	{'value': 'paired'}	sequencing	library			LibLayoutEnum	True					
lib_reads_seqd	library reads sequenced	MIXS:0000040		Total number of clones sequenced from the library	{'value': '20'}	sequencing	library			integer	True					
lib_screen	library screening strategy	MIXS:0000043		Specific enrichment or screening methods applied before and/or after creating libraries	{'value': 'enriched, screened, normalized'}	sequencing	library			string	True		{text}		screening strategy name	
lib_size	library size	MIXS:0000039		Total number of clones in the library prepared for the project	{'value': '50'}	sequencing	library|size			integer	True					
lib_vector	library vector	MIXS:0000042		Cloning vector type(s) used in construction of libraries	{'value': 'Bacteriophage P1'}	sequencing	library			string	True		{text}		vector	
light_regm	light regimen	MIXS:0000569		Information about treatment(s) involving exposure to light, including both light intensity and quality	{'value': 'incandescant light;10 lux;450 nanometer'}		light|regimen			string			{text};{float} {unit};{float} {unit}		exposure type;light intensity;light quality	lux; micrometer, nanometer, angstrom
mechanical_damage	mechanical damage	MIXS:0001052		Information about any mechanical damage exerted on the plant; can include multiple damages and sites	{'value': 'pruning;bark'}			True		string			{text};{text}		damage type;body site	
mid	multiplex identifiers	MIXS:0000047		Molecular barcodes, called Multiplex Identifiers (MIDs), that are used to specifically tag unique samples in a sequencing run. Sequence should be reported in uppercase letters	{'value': 'GTGAATAT'}	sequencing	identifier		^[ACGTRKSYMWBHDVN]+$	string	True			{'syntax': '^{ambiguous_nucleotides}$', 'interpolated': True, 'partial_match': True}		
mineral_nutr_regm	mineral nutrient regimen	MIXS:0000570		Information about treatment involving the use of mineral supplements; should include the name of mineral nutrient, amount administered, treatment regimen including how many times the treatment was repeated, how long each treatment lasted, and the start and end time of the entire treatment; can include multiple mineral nutrient regimens	{'value': 'potassium;15 gram;R2/2018-05-11T14:30/2018-05-11T19:30/P1H30M'}		mineral|nutrient|regimen	True		string			{text};{float} {unit};{Rn/start_time/end_time/duration}		mineral nutrient name;mineral nutrient amount;treatment interval and duration	gram, mole per liter, milligram per liter
misc_param	miscellaneous parameter	MIXS:0000752		Any other measurement performed or parameter collected, that is not listed here	{'value': 'Bicarbonate ion concentration;2075 micromole per kilogram'}		parameter	True		string			{text};{float} {unit}		parameter name;measurement value	
neg_cont_type	negative control type	MIXS:0001321		The substance or equipment used as a negative control in an investigation		investigation	type			NegContTypeEnum	True				enumeration or text	
non_min_nutr_regm	non-mineral nutrient regimen	MIXS:0000571		Information about treatment involving the exposure of plant to non-mineral nutrient such as oxygen, hydrogen or carbon; should include the name of non-mineral nutrient, amount administered, treatment regimen including how many times the treatment was repeated, how long each treatment lasted, and the start and end time of the entire treatment; can include multiple non-mineral nutrient regimens	{'value': 'https://phylogenomics.me/protocols/16s-pcr-protocol/'}		non-mineral|nutrient|regimen	True		string			{text};{float} {unit};{Rn/start_time/end_time/duration}			gram, mole per liter, milligram per liter
