name	title	slot_uri	comments	description	examples	in_subset	keywords	multivalued	pattern	range	recommended	required	string_serialization	structured_pattern	Expected_value	Preferred_unit
nucl_acid_amp	nucleic acid amplification	MIXS:0000038		A link to a literature reference, electronic resource or a standard operating procedure (SOP), that describes the enzymatic amplification (PCR, TMA, NASBA) of specific nucleic acids	{'value': 'https://phylogenomics.me/protocols/16s-pcr-protocol/'}	sequencing			^^PMID:\d+$|^doi:10.\d{2,9}/.*$|^https?:\/\/(?:www\.)?[-a-zA-Z0-9@:%._\+~#=]{1,256}\.[a-zA-Z0-9()]{1,6}\b(?:[-a-zA-Z0-9()@:%_\+.~#?&\/=]*)$$	string	True			{'syntax': '^{PMID}|{DOI}|{URL}$', 'interpolated': True, 'partial_match': True}		
nucl_acid_ext	nucleic acid extraction	MIXS:0000037		A link to a literature reference, electronic resource or a standard operating procedure (SOP), that describes the material separation to recover the nucleic acid fraction from a sample	{'value': 'https://mobio.com/media/wysiwyg/pdfs/protocols/12888.pdf'}	sequencing			^^PMID:\d+$|^doi:10.\d{2,9}/.*$|^https?:\/\/(?:www\.)?[-a-zA-Z0-9@:%._\+~#=]{1,256}\.[a-zA-Z0-9()]{1,6}\b(?:[-a-zA-Z0-9()@:%_\+.~#?&\/=]*)$$	string	True			{'syntax': '^{PMID}|{DOI}|{URL}$', 'interpolated': True, 'partial_match': True}		
organism_count	organism count	MIXS:0000103		Total cell count of any organism (or group of organisms) per gram, volume or area of sample, should include name of organism followed by count. The method that was used for the enumeration (e.g. qPCR, atp, mpn, etc.) Should also be provided. (example: total prokaryotes; 3.5e7 cells per ml; qpcr)	{'value': 'total prokaryotes;3.5e7 cells per milliliter;qPCR'}		count|organism	True		string			{text};{float} {unit};[ATP|MPN|qPCR|other]		organism name;measurement value;enumeration	
oxy_stat_samp	oxygenation status of sample	MIXS:0000753		Oxygenation status of sample	{'value': 'aerobic'}		oxygen|sample|status			OxyStatSampEnum						
pcr_cond	pcr conditions	MIXS:0000049		Description of reaction conditions and components of polymerase chain reaction performed during library preparation.	{'value': 'initial denaturation:94degC_1.5min'}	sequencing	condition|pcr			string	True		initial denaturation:degrees_minutes;annealing:degrees_minutes;elongation:degrees_minutes;final elongation:degrees_minutes;total cycles		initial denaturation:degrees_minutes;annealing:degrees_minutes;elongation:degrees_minutes;final elongation:degrees_minutes;total cycles	
pcr_primers	pcr primers	MIXS:0000046		PCR primers that were used to amplify the sequence of the targeted gene, locus or subfragment. This field should contain all the primers used for a single PCR reaction if multiple forward or reverse primers are present in a single PCR reaction. The primer sequence should be reported in uppercase letters	{'value': 'FWD:GTGCCAGCMGCCGCGGTAA;REV:GGACTACHVGGGTWTCTAAT'}	sequencing	pcr			string	True		FWD:{dna};REV:{dna}		FWD: forward primer sequence;REV:reverse primer sequence	
perturbation	perturbation	MIXS:0000754		Type of perturbation, e.g. chemical administration, physical disturbance, etc., coupled with perturbation regimen including how many times the perturbation was repeated, how long each perturbation lasted, and the start and end time of the entire perturbation period; can include multiple perturbation types	{'value': 'antibiotic addition;R2/2018-05-11T14:30Z/2018-05-11T19:30Z/P1H30M'}		perturbation	True		string			{text};{Rn/start_time/end_time/duration}		perturbation type name;perturbation interval and duration	
pesticide_regm	pesticide regimen	MIXS:0000573		Information about treatment involving use of insecticides; should include the name of pesticide, amount administered, treatment regimen including how many times the treatment was repeated, how long each treatment lasted, and the start and end time of the entire treatment; can include multiple pesticide regimens	{'value': 'pyrethrum;0.6 milligram per liter;R2/2018-05-11T14:30/2018-05-11T19:30/P1H30M'}		regimen	True		string			{text};{float} {unit};{Rn/start_time/end_time/duration}			gram, mole per liter, milligram per liter
ph_regm	pH regimen	MIXS:0001056		Information about treatment involving exposure of plants to varying levels of ph of the growth media, treatment regimen including how many times the treatment was repeated, how long each treatment lasted, and the start and end time of the entire treatment; can include multiple regimen	{'value': '7.6;R2/2018-05-11:T14:30/2018-05-11T19:30/P1H30M'}		ph|regimen	True		string			{float};{Rn/start_time/end_time/duration}			
plant_growth_med	plant growth medium	MIXS:0001057		Specification of the media for growing the plants or tissue cultured samples, e.g. soil, aeroponic, hydroponic, in vitro solid culture medium, in vitro liquid culture medium. Recommended value is a specific value from EO:plant growth medium (follow this link for terms http://purl.obolibrary.org/obo/EO_0007147) or other controlled vocabulary	{'value': 'hydroponic plant culture media [EO:0007067]'}		growth|plant			string			{termLabel} [{termID}] or [husk|other artificial liquid medium|other artificial solid medium|peat moss|perlite|pumice|sand|soil|vermiculite|water]		EO or enumeration	
plant_product	plant product	MIXS:0001058		Substance produced by the plant, where the sample was obtained from	{'value': 'xylem sap [PO:0025539]'}		plant|product			string			{text}		product name	
plant_sex	plant sex	MIXS:0001059		Sex of the reproductive parts on the whole plant, e.g. pistillate, staminate, monoecieous, hermaphrodite	{'value': 'Hermaphroditic'}		plant			PlantSexEnum						
plant_struc	plant structure	MIXS:0001060		Name of plant structure the sample was obtained from; for Plant Ontology (PO) (v releases/2017-12-14) terms, see http://purl.bioontology.org/ontology/PO, e.g. petiole epidermis (PO_0000051). If an individual flower is sampled, the sex of it can be recorded here	{'value': 'epidermis [PO:0005679]'}		plant		^([^\s-]{1,2}|[^\s-]+.+[^\s-]+) \[[a-zA-Z]{2,}:[a-zA-Z0-9]\d+\]$	string				{'syntax': '^{termLabel} \\[{termID}\\]$', 'interpolated': True, 'partial_match': True}		
pos_cont_type	positive control type	MIXS:0001322		The substance, mixture, product, or apparatus used to verify that a process which is part of an investigation delivers a true positive		investigation	type			string	True		{term} or {text}			
project_name	project name	MIXS:0000092		Name of the project within which the sequencing was organized	{'value': 'Forest soil metagenome'}	investigation	project			string		True				
radiation_regm	radiation regimen	MIXS:0000575		Information about treatment involving exposure of plant or a plant part to a particular radiation regimen; should include the radiation type, amount or intensity administered, treatment regimen including how many times the treatment was repeated, how long each treatment lasted, and the start and end time of the entire treatment; can include multiple radiation regimens	{'value': 'gamma radiation;60 gray;R2/2018-05-11T14:30/2018-05-11T19:30/P1H30M'}		regimen	True		string			{text};{float} {unit};{Rn/start_time/end_time/duration}		radiation type name;radiation amount;treatment interval and duration	rad, gray
rainfall_regm	rainfall regimen	MIXS:0000576		Information about treatment involving an exposure to a given amount of rainfall, treatment regimen including how many times the treatment was repeated, how long each treatment lasted, and the start and end time of the entire treatment; can include multiple regimens	{'value': '15 millimeter;R2/2018-05-11T14:30/2018-05-11T19:30/P1H30M'}		rain|regimen	True		string			{float} {unit};{Rn/start_time/end_time/duration}		measurement value;treatment interval and duration	millimeter
rel_to_oxygen	relationship to oxygen	MIXS:0000015		Is this organism an aerobe, anaerobe? Please note that aerobic and anaerobic are valid descriptors for microbial environments	{'value': 'aerobe'}	nucleic acid sequence source	oxygen|relationship			RelToOxygenEnum						
root_cond	rooting conditions	MIXS:0001061		Relevant rooting conditions such as field plot size, sowing density, container dimensions, number of plants per container	{'value': 'http://himedialabs.com/TD/PT158.pdf'}		condition		^^PMID:\d+$|^doi:10.\d{2,9}/.*$|^https?:\/\/(?:www\.)?[-a-zA-Z0-9@:%._\+~#=]{1,256}\.[a-zA-Z0-9()]{1,6}\b(?:[-a-zA-Z0-9()@:%_\+.~#?&\/=]*)$|([^\s-]{1,2}|[^\s-]+.+[^\s-]+)$	string				{'syntax': '^{PMID}|{DOI}|{URL}|{text}$', 'interpolated': True, 'partial_match': True}		
root_med_carbon	rooting medium carbon	MIXS:0000577		Source of organic carbon in the culture rooting medium; e.g. sucrose	{'value': 'sucrose'}		carbon			string			{text};{float} {unit}		carbon source name;measurement value	milligram per liter
root_med_macronutr	rooting medium macronutrients	MIXS:0000578		Measurement of the culture rooting medium macronutrients (N,P, K, Ca, Mg, S); e.g. KH2PO4 (170 mg/L)	{'value': 'KH2PO4;170  milligram per liter'}		macronutrients			string			{text};{float} {unit}		macronutrient name;measurement value	milligram per liter
root_med_micronutr	rooting medium micronutrients	MIXS:0000579		Measurement of the culture rooting medium micronutrients (Fe, Mn, Zn, B, Cu, Mo); e.g. H3BO3 (6.2 mg/L)	{'value': 'H3BO3;6.2  milligram per liter'}		micronutrients			string			{text};{float} {unit}		micronutrient name;measurement value	milligram per liter
root_med_ph	rooting medium pH	MIXS:0001062		pH measurement of the culture rooting medium; e.g. 5.5	{'value': '7.5'}		ph			float						
root_med_regl	rooting medium regulators	MIXS:0000581		Growth regulators in the culture rooting medium such as cytokinins, auxins, gybberellins, abscisic acid; e.g. 0.5  mg/L NAA	{'value': 'abscisic acid;0.75 milligram per liter'}					string			{text};{float} {unit}		regulator name;measurement value	milligram per liter
root_med_solid	rooting medium solidifier	MIXS:0001063		Specification of the solidifying agent in the culture rooting medium; e.g. agar	{'value': 'agar'}					string						
root_med_suppl	rooting medium organic supplements	MIXS:0000580		Organic supplements of the culture rooting medium, such as vitamins, amino acids, organic acids, antibiotics activated charcoal; e.g. nicotinic acid (0.5  mg/L)	{'value': 'nicotinic acid;0.5 milligram per liter'}		organic			string			{text};{float} {unit}		supplement name;measurement value	milligram per liter
salinity	salinity	MIXS:0000183		The total concentration of all dissolved salts in a liquid or solid sample. While salinity can be measured by a complete chemical analysis, this method is difficult and time consuming. More often, it is instead derived from the conductivity measurement. This is known as practical salinity. These derivations compare the specific conductance of the sample to a salinity standard such as seawater	{'value': '25 practical salinity unit'}		salinity		^[-+]?[0-9]*\.?[0-9]+(?:[eE][-+]?[0-9]+)?( *- *[-+]?[0-9]*\.?[0-9]+(?:[eE][-+]?[0-9]+)?)? *([^\s-]{1,2}|[^\s-]+.+[^\s-]+)$	string				{'syntax': '^{scientific_float}( *- *{scientific_float})? *{text}$', 'interpolated': True, 'partial_match': True}		practical salinity unit, percentage
salt_regm	salt regimen	MIXS:0000582		Information about treatment involving use of salts as supplement to liquid and soil growth media; should include the name of salt, amount administered, treatment regimen including how many times the treatment was repeated, how long each treatment lasted, and the start and end time of the entire treatment; can include multiple salt regimens	{'value': 'NaCl;5 gram per liter;R2/2018-05-11T14:30/2018-05-11T19:30/P1H30M'}		regimen|salt	True		string			{text};{float} {unit};{Rn/start_time/end_time/duration}			gram, microgram, mole per liter, gram per liter
samp_capt_status	sample capture status	MIXS:0000860		Reason for the sample	{'value': 'farm sample'}		sample|status			SampCaptStatusEnum						
samp_collect_device	sample collection device	MIXS:0000002		The device used to collect an environmental sample. This field accepts terms listed under environmental sampling device (http://purl.obolibrary.org/obo/ENVO). This field also accepts terms listed under specimen collection device (http://purl.obolibrary.org/obo/GENEPIO_0002094)	{'value': 'swab, biopsy, niskin bottle, push core, drag swab [GENEPIO:0002713]'}	nucleic acid sequence source	device|sample			string	True		{termLabel} [{termID}]|{text}		device name	
samp_collect_method	sample collection method	MIXS:0001225		The method employed for collecting the sample	{'value': 'swabbing'}	nucleic acid sequence source	method|sample		^^PMID:\d+$|^doi:10.\d{2,9}/.*$|^https?:\/\/(?:www\.)?[-a-zA-Z0-9@:%._\+~#=]{1,256}\.[a-zA-Z0-9()]{1,6}\b(?:[-a-zA-Z0-9()@:%_\+.~#?&\/=]*)$|([^\s-]{1,2}|[^\s-]+.+[^\s-]+)$	string	True			{'syntax': '^{PMID}|{DOI}|{URL}|{text}$', 'interpolated': True, 'partial_match': True}		
samp_dis_stage	sample disease stage	MIXS:0000249		Stage of the disease at the time of sample collection, e.g. inoculation, penetration, infection, growth and reproduction, dissemination of pathogen	{'value': 'infection'}		disease|sample			SampDisStageEnum						
samp_mat_process	sample material processing	MIXS:0000016		A brief description of any processing applied to the sample during or after retrieving the sample from environment, or a link to the relevant protocol(s) performed	{'value': 'filtering of seawater, storing samples in ethanol'}	nucleic acid sequence source	material|process|sample			string	True					
samp_name	sample name	MIXS:0001107		A local identifier or name that for the material sample used for extracting nucleic acids, and subsequent sequencing. It can refer either to the original material collected or to any derived sub-samples. It can have any format, but we suggest that you make it concise, unique and consistent within your lab, and as informative as possible. INSDC requires every sample name from a single Submitter to be unique. Use of a globally unique identifier for the field source_mat_id is recommended in addition to sample_name	{'value': 'ISDsoil1'}	investigation	sample			string		True				
samp_size	amount or size of sample collected	MIXS:0000001		The total amount or size (volume (ml), mass (g) or area (m2) ) of sample collected	{'value': '5 liter'}	nucleic acid sequence source	sample|size		^[-+]?[0-9]*\.?[0-9]+(?:[eE][-+]?[0-9]+)?( *- *[-+]?[0-9]*\.?[0-9]+(?:[eE][-+]?[0-9]+)?)? *([^\s-]{1,2}|[^\s-]+.+[^\s-]+)$	string	True			{'syntax': '^{scientific_float}( *- *{scientific_float})? *{text}$', 'interpolated': True, 'partial_match': True}		
samp_store_dur	sample storage duration	MIXS:0000116		Duration for which the sample was stored. Indicate the duration for which the sample was stored written in ISO 8601 format	{'value': 'P1Y6M'}		duration|period|sample|storage		^P(?:(?:\d+D|\d+M(?:\d+D)?|\d+Y(?:\d+M(?:\d+D)?)?)(?:T(?:\d+H(?:\d+M(?:\d+S)?)?|\d+M(?:\d+S)?|\d+S))?|T(?:\d+H(?:\d+M(?:\d+S)?)?|\d+M(?:\d+S)?|\d+S)|\d+W)$	string				{'syntax': '^{duration}$', 'interpolated': True, 'partial_match': True}		
samp_store_loc	sample storage location	MIXS:0000755		Location at which sample was stored, usually name of a specific freezer/room	{'value': 'Freezer no:5'}		location|sample|storage			string			{text}		location name	
samp_store_temp	sample storage temperature	MIXS:0000110		Temperature at which sample was stored, e.g. -80 degree Celsius	{'value': '-80 degree Celsius'}		sample|storage|temperature		^[-+]?[0-9]*\.?[0-9]+(?:[eE][-+]?[0-9]+)?( *- *[-+]?[0-9]*\.?[0-9]+(?:[eE][-+]?[0-9]+)?)? *([^\s-]{1,2}|[^\s-]+.+[^\s-]+)$	string				{'syntax': '^{scientific_float}( *- *{scientific_float})? *{text}$', 'interpolated': True, 'partial_match': True}		degree Celsius
samp_taxon_id	taxonomy ID of DNA sample	MIXS:0001320		NCBI taxon id of the sample.  Maybe be a single taxon or mixed taxa sample. Use 'synthetic metagenome  for mock community/positive controls, or 'blank sample' for negative controls	{'value': 'Gut Metagenome [NCBITaxon:749906]'}	investigation	dna|identifier|sample|taxon		^([^\s-]{1,2}|[^\s-]+.+[^\s-]+) \[NCBITaxon:\d+\]$	string		True		{'syntax': '^{text} \\[{NCBItaxon_id}\\]$', 'interpolated': True, 'partial_match': True}		
samp_vol_we_dna_ext	sample volume or weight for DNA extraction	MIXS:0000111		Volume (ml) or mass (g) of total collected sample processed for DNA extraction. Note: total sample collected should be entered under the term Sample Size (MIXS:0000001)	{'value': '1500 milliliter'}	nucleic acid sequence source	dna|sample|volume|weight		^[-+]?[0-9]*\.?[0-9]+(?:[eE][-+]?[0-9]+)?( *- *[-+]?[0-9]*\.?[0-9]+(?:[eE][-+]?[0-9]+)?)? *([^\s-]{1,2}|[^\s-]+.+[^\s-]+)$	string				{'syntax': '^{scientific_float}( *- *{scientific_float})? *{text}$', 'interpolated': True, 'partial_match': True}		milliliter, gram, milligram, square centimeter
season_environment	seasonal environment	MIXS:0001068		Treatment involving an exposure to a particular season (e.g. Winter, summer, rabi, rainy etc.), treatment regimen including how many times the treatment was repeated, how long each treatment lasted, and the start and end time of the entire treatment	{'value': 'rainy;R2/2018-05-11T14:30/2018-05-11T19:30/P1H30M'}		environment|season	True		string			{text};{Rn/start_time/end_time/duration}			
seq_meth	sequencing method	MIXS:0000050		Sequencing machine used. Where possible the term should be taken from the OBI list of DNA sequencers (http://purl.obolibrary.org/obo/OBI_0400103)	{'value': '454 Genome Sequencer FLX [OBI:0000702]'}	sequencing	method		^([^\s-]{1,2}|[^\s-]+.+[^\s-]+)|(([^\s-]{1,2}|[^\s-]+.+[^\s-]+) \[[a-zA-Z]{2,}:[a-zA-Z0-9]\d+\])$	string		True		{'syntax': '^{text}|({termLabel} \\[{termID}\\])$', 'interpolated': True, 'partial_match': True}		
seq_quality_check	sequence quality check	MIXS:0000051		Indicate if the sequence has been called by automatic systems (none) or undergone a manual editing procedure (e.g. by inspecting the raw data or chromatograms). Applied only for sequences that are not submitted to SRA,ENA or DRA	{'value': 'none'}	sequencing	quality			SeqQualityCheckEnum	True				none or manually edited	
size_frac	size fraction selected	MIXS:0000017		Filtering pore size used in sample preparation	{'value': '0-0.22 micrometer'}	nucleic acid sequence source	fraction|size			string			{float}-{float} {unit}		filter size value range	
sop	relevant standard operating procedures	MIXS:0000090		Standard operating procedures used in assembly and/or annotation of genomes, metagenomes or environmental sequences	{'value': 'http://press.igsb.anl.gov/earthmicrobiome/protocols-and-standards/its/'}	sequencing	procedures	True		string	True		{PMID}|{DOI}|{URL}		reference to SOP	
source_mat_id	source material identifiers	MIXS:0000026		A unique identifier assigned to a material sample (as defined by http://rs.tdwg.org/dwc/terms/materialSampleID, and as opposed to a particular digital record of a material sample) used for extracting nucleic acids, and subsequent sequencing. The identifier can refer either to the original material collected or to any derived sub-samples. The INSDC qualifiers /specimen_voucher, /bio_material, or /culture_collection may or may not share the same value as the source_mat_id field. For instance, the /specimen_voucher qualifier and source_mat_id may both contain 'UAM:Herps:14' , referring to both the specimen voucher and sampled tissue with the same identifier. However, the /culture_collection qualifier may refer to a value from an initial culture (e.g. ATCC:11775) while source_mat_id would refer to an identifier from some derived culture from which the nucleic acids were extracted (e.g. xatc123 or ark:/2154/R2)	{'value': 'MPI012345'}	nucleic acid sequence source	identifier|material|source	True		string	True		{text}		for cultures of microorganisms: identifiers for two culture collections; for other material a unique arbitrary identifer	
standing_water_regm	standing water regimen	MIXS:0001069		Treatment involving an exposure to standing water during a plant's life span, types can be flood water or standing water, treatment regimen including how many times the treatment was repeated, how long each treatment lasted, and the start and end time of the entire treatment; can include multiple regimens	{'value': 'standing water;R2/2018-05-11T14:30/2018-05-11T19:30/P1H30M'}		regimen|water	True		string			{text};{Rn/start_time/end_time/duration}			
target_gene	target gene	MIXS:0000044		Targeted gene or locus name for marker gene studies	{'value': '16S rRNA, 18S rRNA, nif, amoA, rpo'}	sequencing	target			string		True				
target_subfragment	target subfragment	MIXS:0000045		Name of subfragment of a gene or locus. Important to e.g. identify special regions on marker genes like V6 on 16S rRNA	{'value': 'V6, V9, ITS'}	sequencing	target			string	True					
temp	temperature	MIXS:0000113		Temperature of the sample at the time of sampling	{'value': '25 degree Celsius'}	environment	temperature		^[-+]?[0-9]*\.?[0-9]+(?:[eE][-+]?[0-9]+)?( *- *[-+]?[0-9]*\.?[0-9]+(?:[eE][-+]?[0-9]+)?)? *([^\s-]{1,2}|[^\s-]+.+[^\s-]+)$	string	True			{'syntax': '^{scientific_float}( *- *{scientific_float})? *{text}$', 'interpolated': True, 'partial_match': True}		degree Celsius
tiss_cult_growth_med	tissue culture growth media	MIXS:0001070		Description of plant tissue culture growth media used	{'value': 'https://link.springer.com/content/pdf/10.1007/BF02796489.pdf'}		culture|growth		^^PMID:\d+$|^doi:10.\d{2,9}/.*$|^https?:\/\/(?:www\.)?[-a-zA-Z0-9@:%._\+~#=]{1,256}\.[a-zA-Z0-9()]{1,6}\b(?:[-a-zA-Z0-9()@:%_\+.~#?&\/=]*)$|([^\s-]{1,2}|[^\s-]+.+[^\s-]+)$	string				{'syntax': '^{PMID}|{DOI}|{URL}|{text}$', 'interpolated': True, 'partial_match': True}		
water_temp_regm	water temperature regimen	MIXS:0000590		Information about treatment involving an exposure to water with varying degree of temperature, treatment regimen including how many times the treatment was repeated, how long each treatment lasted, and the start and end time of the entire treatment; can include multiple regimens	{'value': '15 degree Celsius;R2/2018-05-11T14:30/2018-05-11T19:30/P1H30M'}		regimen|temperature|water	True		string			{float} {unit};{Rn/start_time/end_time/duration}			degree Celsius
watering_regm	watering regimen	MIXS:0000591		Information about treatment involving an exposure to watering frequencies, treatment regimen including how many times the treatment was repeated, how long each treatment lasted, and the start and end time of the entire treatment; can include multiple regimens	{'value': '1 liter;R2/2018-05-11T14:30/2018-05-11T19:30/P1H30M'}		regimen|water	True		string			{float} {unit};{Rn/start_time/end_time/duration}			milliliter, liter
