name	title	slot_uri	comments	description	examples	in_subset	keywords	multivalued	pattern	range	recommended	required	string_serialization	structured_pattern	Expected_value	Preferred_unit
adapters	adapters	MIXS:0000048		Adapters provide priming sequences for both amplification and sequencing of the sample-library fragments. Both adapters should be reported; in uppercase letters	{'value': 'AATGATACGGCGACCACCGAGATCTACACGCT;CAAGCAGAAGACGGCATACGAGAT'}	sequencing				string	True			{'syntax': '^{dna_bases};{dna_bases}$', 'interpolated': True, 'partial_match': True}		
additional_info	additional info	MIXS:0000300		Information that doesn't fit anywhere else. Can also be used to propose new entries for fields with controlled vocabulary			information			string						
alkalinity	alkalinity	MIXS:0000421		Alkalinity, the ability of a solution to neutralize acids to the equivalence point of carbonate or bicarbonate	{'value': '50 milligram per liter'}		alkalinity			string				{'syntax': '^{scientific_float}( *- *{scientific_float})? *{text}$', 'interpolated': True, 'partial_match': True}		milliequivalent per liter, milligram per liter
alkalinity_method	alkalinity method	MIXS:0000298		Method used for alkalinity measurement	{'value': 'titration'}		alkalinity|method			string						
alt	altitude	MIXS:0000094		Heights of objects such as airplanes, space shuttles, rockets, atmospheric balloons and heights of places such as atmospheric layers and clouds. It is used to measure the height of an object which is above the earth's surface. In this context, the altitude measurement is the vertical distance between the earth's surface above sea level and the sampled position in the air	{'value': '100 meter'}	environment				string	True			{'syntax': '^{scientific_float}( *- *{scientific_float})? *{text}$', 'interpolated': True, 'partial_match': True}		meter
ammonium	ammonium	MIXS:0000427		Concentration of ammonium in the sample	{'value': '1.5 milligram per liter'}					string	True			{'syntax': '^{scientific_float}( *- *{scientific_float})? *{text}$', 'interpolated': True, 'partial_match': True}		micromole per liter, milligram per liter, parts per million
annot	annotation	MIXS:0000059		Tool used for annotation, or for cases where annotation was provided by a community jamboree or model organism database rather than by a specific submitter	{'value': 'prokka'}	sequencing				string	True				name of tool or pipeline used, or annotation source description	
api	API gravity	MIXS:0000157		API gravity is a measure of how heavy or light a petroleum liquid is compared to water (source: https://en.wikipedia.org/wiki/API_gravity) (e.g. 31.1   API)	{'value': '31.1 API'}					string		True		{'syntax': '^{scientific_float}( *- *{scientific_float})? *{text}$', 'interpolated': True, 'partial_match': True}		degrees API
aromatics_pc	aromatics wt%	MIXS:0000133		Saturate, Aromatic, Resin and Asphaltene (SARA) is an analysis method that divides crude oil components according to their polarizability and polarity. There are three main methods to obtain SARA results. The most popular one is known as the Iatroscan TLC-FID and is referred to as IP-143 (source: https://en.wikipedia.org/wiki/Saturate,_aromatic,_resin_and_asphaltene)						string	True			{'syntax': '^{name};{float} {unit}$', 'interpolated': True, 'partial_match': True}		percent
asphaltenes_pc	asphaltenes wt%	MIXS:0000135		Saturate, Aromatic, Resin and Asphaltene (SARA) is an analysis method that divides crude oil components according to their polarizability and polarity. There are three main methods to obtain SARA results. The most popular one is known as the Iatroscan TLC-FID and is referred to as IP-143 (source: https://en.wikipedia.org/wiki/Saturate,_aromatic,_resin_and_asphaltene)						string	True			{'syntax': '^{name};{float} {unit}$', 'interpolated': True, 'partial_match': True}		percent
assembly_name	assembly name	MIXS:0000057		Name/version of the assembly provided by the submitter that is used in the genome browsers and in the community	{'value': 'HuRef, JCVI_ISG_i3_1.0'}	sequencing				string	True		{text} {text}		name and version of assembly	
assembly_qual	assembly quality	MIXS:0000056		The assembly quality category is based on sets of criteria outlined for each assembly quality category. For MISAG/MIMAG; Finished: Single, validated, contiguous sequence per replicon without gaps or ambiguities with a consensus error rate equivalent to Q50 or better. High Quality Draft:Multiple fragments where gaps span repetitive regions. Presence of the large subunit (LSU) RNA, small subunit (SSU) and the presence of 5.8S rRNA or 5S rRNA depending on whether it is a eukaryotic or prokaryotic genome, respectively. Medium Quality Draft:Many fragments with little to no review of assembly other than reporting of standard assembly statistics. Low Quality Draft:Many fragments with little to no review of assembly other than reporting of standard assembly statistics. Assembly statistics include, but are not limited to total assembly size, number of contigs, contig N50/L50, and maximum contig length. For MIUVIG; Finished: Single, validated, contiguous sequence per replicon without gaps or ambiguities, with extensive manual review and editing to annotate putative gene functions and transcriptional units. High-quality draft genome: One or multiple fragments, totaling   90% of the expected genome or replicon sequence or predicted complete. Genome fragment(s): One or multiple fragments, totalling < 90% of the expected genome or replicon sequence, or for which no genome size could be estimated	{'value': 'High-quality draft genome'}	sequencing	quality			AssemblyQualEnum	True					
assembly_software	assembly software	MIXS:0000058		Tool(s) used for assembly, including version number and parameters	{'value': 'metaSPAdes;3.11.0;kmer set 21,33,55,77,99,121, default parameters otherwise'}	sequencing	software			string	True			{'syntax': '^{software};{version};{parameters}$', 'interpolated': True, 'partial_match': True}		
associated_resource	relevant electronic resources	MIXS:0000091		A related resource that is referenced, cited, or otherwise associated to the sequence	{'value': 'http://www.earthmicrobiome.org/'}	sequencing	resource	True		string	True			{'syntax': '^({PMID}|{DOI}|{URL})$', 'interpolated': True, 'partial_match': False}	reference to resource	
basin	basin name	MIXS:0000290		Name of the basin (e.g. Campos)	{'value': 'Campos'}					string		True				
benzene	benzene	MIXS:0000153		Concentration of benzene in the sample						string	True			{'syntax': '^{scientific_float}( *- *{scientific_float})? *{text}$', 'interpolated': True, 'partial_match': True}		milligram per liter, parts per million
calcium	calcium	MIXS:0000432		Concentration of calcium in the sample	{'value': '0.2 micromole per liter'}					string				{'syntax': '^{scientific_float}( *- *{scientific_float})? *{text}$', 'interpolated': True, 'partial_match': True}		milligram per liter, micromole per liter, parts per million
chloride	chloride	MIXS:0000429		Concentration of chloride in the sample	{'value': '5000 milligram per liter'}					string				{'syntax': '^{scientific_float}( *- *{scientific_float})? *{text}$', 'interpolated': True, 'partial_match': True}		milligram per liter, parts per million
collection_date	collection date	MIXS:0000011		The time of sampling, either as an instance (single point in time) or interval. In case no exact time is available, the date/time can be right truncated i.e. all of these are valid times: 2008-01-23T19:23:10+00:00; 2008-01-23T19:23:10; 2008-01-23; 2008-01; 2008; Except: 2008-01; 2008 all are ISO8601 compliant	{'value': '2013-03-25T12:42:31+01:00'}	environment	date			datetime		True				
density	density	MIXS:0000435		Density of the sample, which is its mass per unit volume (aka volumetric mass density)	{'value': '1000 kilogram per cubic meter'}		density			string				{'syntax': '^{scientific_float}( *- *{scientific_float})? *{text}$', 'interpolated': True, 'partial_match': True}		gram per cubic meter, gram per cubic centimeter
depos_env	depositional environment	MIXS:0000992		"Main depositional environment (https://en.wikipedia.org/wiki/Depositional_environment). If ""other"" is specified, please propose entry in ""additional info"" field"	{'value': 'Continental - Alluvial'}		environment			DeposEnvEnum	True					
depth	depth	MIXS:0000018		The vertical distance below local surface. For sediment or soil samples depth is measured from sediment or soil surface, respectively. Depth can be reported as an interval for subsurface samples	{'value': '10 meter'}	environment	depth			string	True			{'syntax': '^{scientific_float}( *- *{scientific_float})? *{text}$', 'interpolated': True, 'partial_match': True}		meter
diss_carb_dioxide	dissolved carbon dioxide	MIXS:0000436		Concentration of dissolved carbon dioxide in the sample or liquid portion of the sample	{'value': '5 milligram per liter'}		carbon|dissolved			string				{'syntax': '^{scientific_float}( *- *{scientific_float})? *{text}$', 'interpolated': True, 'partial_match': True}		micromole per liter, milligram per liter
diss_inorg_carb	dissolved inorganic carbon	MIXS:0000434		Dissolved inorganic carbon concentration in the sample, typically measured after filtering the sample using a 0.45 micrometer filter	{'value': '2059 micromole per kilogram'}		carbon|dissolved|inorganic			string				{'syntax': '^{scientific_float}( *- *{scientific_float})? *{text}$', 'interpolated': True, 'partial_match': True}		microgram per liter, milligram per liter, parts per million
diss_inorg_phosp	dissolved inorganic phosphorus	MIXS:0000106		Concentration of dissolved inorganic phosphorus in the sample	{'value': '56.5 micromole per liter'}		dissolved|inorganic|phosphorus			string	True			{'syntax': '^{scientific_float}( *- *{scientific_float})? *{text}$', 'interpolated': True, 'partial_match': True}		
diss_iron	dissolved iron	MIXS:0000139		Concentration of dissolved iron in the sample			dissolved			string	True			{'syntax': '^{scientific_float}( *- *{scientific_float})? *{text}$', 'interpolated': True, 'partial_match': True}		milligram per liter
diss_org_carb	dissolved organic carbon	MIXS:0000433		Concentration of dissolved organic carbon in the sample, liquid portion of the sample, or aqueous phase of the fluid	{'value': '197 micromole per liter'}		carbon|dissolved|organic			string				{'syntax': '^{scientific_float}( *- *{scientific_float})? *{text}$', 'interpolated': True, 'partial_match': True}		micromole per liter, milligram per liter
diss_oxygen_fluid	dissolved oxygen in fluids	MIXS:0000438		Concentration of dissolved oxygen in the oil field produced fluids as it contributes to oxygen-corrosion and microbial activity (e.g. Mic)			dissolved|oxygen			string				{'syntax': '^{scientific_float}( *- *{scientific_float})? *{text}$', 'interpolated': True, 'partial_match': True}		micromole per kilogram, milligram per liter
elev	elevation	MIXS:0000093		Elevation of the sampling site is its height above a fixed reference point, most commonly the mean sea level. Elevation is mainly used when referring to points on the earth's surface, while altitude is used for points above the surface, such as an aircraft in flight or a spacecraft in orbit	{'value': '100 meter'}	environment	elevation			string	True			{'syntax': '^{scientific_float}( *- *{scientific_float})? *{text}$', 'interpolated': True, 'partial_match': True}		meter
env_broad_scale	broad-scale environmental context	MIXS:0000012		Report the major environmental system the sample or specimen came from. The system(s) identified should have a coarse spatial grain, to provide the general environmental context of where the sampling was done (e.g. in the desert or a rainforest). We recommend using subclasses of EnvO s biome class:  http://purl.obolibrary.org/obo/ENVO_00000428. EnvO documentation about how to use the field: https://github.com/EnvironmentOntology/envo/wiki/Using-ENVO-with-MIxS	{'value': 'rangeland biome [ENVO:01000247]'}	environment	context|environmental			string		True		{'syntax': '^{termLabel} \\[{termID}\\]$', 'interpolated': True, 'partial_match': True}		
env_local_scale	local environmental context	MIXS:0000013		Report the entity or entities which are in the sample or specimen s local vicinity and which you believe have significant causal influences on your sample or specimen. We recommend using EnvO terms which are of smaller spatial grain than your entry for env_broad_scale. Terms, such as anatomical sites, from other OBO Library ontologies which interoperate with EnvO (e.g. UBERON) are accepted in this field. EnvO documentation about how to use the field: https://github.com/EnvironmentOntology/envo/wiki/Using-ENVO-with-MIxS	{'value': 'hillside [ENVO:01000333]'}	environment	context|environmental			string		True		{'syntax': '^{termLabel} \\[{termID}\\]$', 'interpolated': True, 'partial_match': True}	Environmental entities having causal influences upon the entity at time of sampling	
env_medium	environmental medium	MIXS:0000014		Report the environmental material(s) immediately surrounding the sample or specimen at the time of sampling. We recommend using subclasses of 'environmental material' (http://purl.obolibrary.org/obo/ENVO_00010483). EnvO documentation about how to use the field: https://github.com/EnvironmentOntology/envo/wiki/Using-ENVO-with-MIxS . Terms from other OBO ontologies are permissible as long as they reference mass/volume nouns (e.g. air, water, blood) and not discrete, countable entities (e.g. a tree, a leaf, a table top)	{'value': 'bluegrass field soil [ENVO:00005789]'}	environment	environmental			string		True		{'syntax': '^{termLabel} \\[{termID}\\]$', 'interpolated': True, 'partial_match': True}		
ethylbenzene	ethylbenzene	MIXS:0000155		Concentration of ethylbenzene in the sample						string	True			{'syntax': '^{scientific_float}( *- *{scientific_float})? *{text}$', 'interpolated': True, 'partial_match': True}		milligram per liter, parts per million
experimental_factor	experimental factor	MIXS:0000008		Variable aspects of an experiment design that can be used to describe an experiment, or set of experiments, in an increasingly detailed manner. This field accepts ontology terms from Experimental Factor Ontology (EFO) and/or Ontology for Biomedical Investigations (OBI)	{'value': 'time series design [EFO:0001779]'}	investigation	experimental|factor	True	^\S+.*\S+ \[[a-zA-Z]{2,}:\d+\]$	string	True		{termLabel} [{termID}]|{text}		text or EFO and/or OBI	
feat_pred	feature prediction	MIXS:0000061		Method used to predict UViGs features such as ORFs, integration site, etc	{'value': 'Prodigal;2.6.3;default parameters'}	sequencing	feature|predict			string				{'syntax': '^{software};{version};{parameters}$', 'interpolated': True, 'partial_match': True}		
field	field name	MIXS:0000291		Name of the hydrocarbon field (e.g. Albacora)						string	True					
geo_loc_name	geographic location (country and/or sea,region)	MIXS:0000010		The geographical origin of the sample as defined by the country or sea name followed by specific region name. Country or sea names should be chosen from the INSDC country list (http://insdc.org/country.html), or the GAZ ontology (http://purl.bioontology.org/ontology/GAZ)	{'value': 'USA: Maryland, Bethesda'}	environment	geographic|location			string		True		{'syntax': '^{country}: {region}, {specific_location}$', 'interpolated': True, 'partial_match': True}		
hc_produced	hydrocarbon type produced	MIXS:0000989		"Main hydrocarbon type produced from resource (i.e. Oil, gas, condensate, etc). If ""other"" is specified, please propose entry in ""additional info"" field"	{'value': 'Gas'}		hydrocarbon|type			HcProducedEnum		True				
hcr	hydrocarbon resource type	MIXS:0000988		"Main Hydrocarbon Resource type. The term ""Hydrocarbon Resource"" HCR defined as a natural environmental feature containing large amounts of hydrocarbons at high concentrations potentially suitable for commercial exploitation. This term should not be confused with the Hydrocarbon Occurrence term which also includes hydrocarbon-rich environments with currently limited commercial interest such as seeps, outcrops, gas hydrates etc. If ""other"" is specified, please propose entry in ""additional info"" field"	{'value': 'Oil Sand'}		hydrocarbon|resource|type			HcrEnum		True				
hcr_fw_salinity	formation water salinity	MIXS:0000406		Original formation water salinity (prior to secondary recovery e.g. Waterflooding) expressed as TDS			salinity|water			string	True			{'syntax': '^{scientific_float}( *- *{scientific_float})? *{text}$', 'interpolated': True, 'partial_match': True}		milligram per liter
hcr_geol_age	hydrocarbon resource geological age	MIXS:0000993		"Geological age of hydrocarbon resource (Additional info: https://en.wikipedia.org/wiki/Period_(geology)). If ""other"" is specified, please propose entry in ""additional info"" field"	{'value': 'Silurian'}		age|hydrocarbon|resource			GeolAgeEnum	True					
hcr_pressure	hydrocarbon resource original pressure	MIXS:0000395		Original pressure of the hydrocarbon resource			hydrocarbon|pressure|resource			string				{'syntax': '^{float} *- *{float} {unit}$', 'interpolated': True, 'partial_match': True}		atmosphere, kilopascal
hcr_temp	hydrocarbon resource original temperature	MIXS:0000393		Original temperature of the hydrocarbon resource	{'value': '150-295 degree Celsius'}		hydrocarbon|resource|temperature			string		True		{'syntax': '^{float} *- *{float} {unit}$', 'interpolated': True, 'partial_match': True}		degree Celsius
lat_lon	geographic location (latitude and longitude)	MIXS:0000009		The geographical origin of the sample as defined by latitude and longitude. The values should be reported in decimal degrees, limited to 8 decimal points, and in WGS84 system	{'value': '50.586825 6.408977'}	environment	geographic|location			string		True		{'syntax': '^{lat} {lon}$', 'interpolated': True, 'partial_match': True}		
lib_layout	library layout	MIXS:0000041		Specify whether to expect single, paired, or other configuration of reads	{'value': 'paired'}	sequencing	library			LibLayoutEnum	True					
lib_reads_seqd	library reads sequenced	MIXS:0000040		Total number of clones sequenced from the library	{'value': '20'}	sequencing	library			integer	True					
lib_screen	library screening strategy	MIXS:0000043		Specific enrichment or screening methods applied before and/or after creating libraries	{'value': 'enriched, screened, normalized'}	sequencing	library			string	True				screening strategy name	
lib_size	library size	MIXS:0000039		Total number of clones in the library prepared for the project	{'value': '50'}	sequencing	library|size			integer	True					
lib_vector	library vector	MIXS:0000042		Cloning vector type(s) used in construction of libraries	{'value': 'Bacteriophage P1'}	sequencing	library			string	True				vector	
lithology	lithology	MIXS:0000990		"Hydrocarbon resource main lithology (Additional information: http://petrowiki.org/Lithology_and_rock_type_determination). If ""other"" is specified, please propose entry in ""additional info"" field"	{'value': 'Volcanic'}		lithology			LithologyEnum	True					
magnesium	magnesium	MIXS:0000431		Concentration of magnesium in the sample	{'value': '52.8 micromole per kilogram'}					string				{'syntax': '^{scientific_float}( *- *{scientific_float})? *{text}$', 'interpolated': True, 'partial_match': True}		mole per liter, milligram per liter, parts per million, micromole per kilogram
mid	multiplex identifiers	MIXS:0000047		Molecular barcodes, called Multiplex Identifiers (MIDs), that are used to specifically tag unique samples in a sequencing run. Sequence should be reported in uppercase letters	{'value': 'GTGAATAT'}	sequencing	identifier			string	True			{'syntax': '^{dna_bases}$', 'interpolated': True, 'partial_match': True}		
misc_param	miscellaneous parameter	MIXS:0000752		Any other measurement performed or parameter collected, that is not listed here	{'value': 'Bicarbonate ion concentration;2075 micromole per kilogram'}		parameter	True		string			{text};{float} {unit}		parameter name;measurement value	
neg_cont_type	negative control type	MIXS:0001321		The substance or equipment used as a negative control in an investigation		investigation	type			NegContTypeEnum	True				enumeration or text	
nitrate	nitrate	MIXS:0000425		Concentration of nitrate in the sample	{'value': '65 micromole per liter'}		nitrate			string	True			{'syntax': '^{scientific_float}( *- *{scientific_float})? *{text}$', 'interpolated': True, 'partial_match': True}		micromole per liter, milligram per liter, parts per million
nitrite	nitrite	MIXS:0000426		Concentration of nitrite in the sample	{'value': '0.5 micromole per liter'}		nitrite			string	True			{'syntax': '^{scientific_float}( *- *{scientific_float})? *{text}$', 'interpolated': True, 'partial_match': True}		micromole per liter, milligram per liter, parts per million
nucl_acid_amp	nucleic acid amplification	MIXS:0000038		A link to a literature reference, electronic resource or a standard operating procedure (SOP), that describes the enzymatic amplification (PCR, TMA, NASBA) of specific nucleic acids	{'value': 'https://phylogenomics.me/protocols/16s-pcr-protocol/'}	sequencing				string	True			{'syntax': '^({PMID}|{DOI}|{URL})$', 'interpolated': True, 'partial_match': True}		
nucl_acid_ext	nucleic acid extraction	MIXS:0000037		A link to a literature reference, electronic resource or a standard operating procedure (SOP), that describes the material separation to recover the nucleic acid fraction from a sample	{'value': 'https://mobio.com/media/wysiwyg/pdfs/protocols/12888.pdf'}	sequencing				string	True			{'syntax': '^({PMID}|{DOI}|{URL})$', 'interpolated': True, 'partial_match': True}		
number_contig	number of contigs	MIXS:0000060		Total number of contigs in the cleaned/submitted assembly that makes up a given genome, SAG, MAG, or UViG	{'value': '40'}	sequencing	number			integer	True					
org_count_qpcr_info	organism count qPCR information	MIXS:0000099		If qpcr was used for the cell count, the target gene name, the primer sequence and the cycling conditions should also be provided. (Example: 16S rrna; FWD:ACGTAGCTATGACGT REV:GTGCTAGTCGAGTAC; initial denaturation:90C_5min; denaturation:90C_2min; annealing:52C_30 sec; elongation:72C_30 sec; 90 C for 1 min; final elongation:72C_5min; 30 cycles)			count|information|organism			string			{text};FWD:{dna};REV:{dna};initial denaturation:degrees_minutes;denaturation:degrees_minutes;annealing:degrees_minutes;elongation:degrees_minutes;final elongation:degrees_minutes; total cycles		gene name;FWD:forward primer sequence;REV:reverse primer sequence;initial denaturation:degrees_minutes;denaturation:degrees_minutes;annealing:degrees_minutes;elongation:degrees_minutes;final elongation:degrees_minutes; total cycles	number of cells per gram (or ml or cm^2)
organism_count	organism count	MIXS:0000103		Total cell count of any organism (or group of organisms) per gram, volume or area of sample, should include name of organism followed by count. The method that was used for the enumeration (e.g. qPCR, atp, mpn, etc.) Should also be provided. (example: total prokaryotes; 3.5e7 cells per ml; qpcr)	{'value': 'total prokaryotes;3.5e7 cells per milliliter;qPCR'}		count|organism	True		string	True		{text};{float} {unit};[ATP|MPN|qPCR|other]		organism name;measurement value;enumeration	
owc_tvdss	oil water contact depth	MIXS:0000405		Depth of the original oil water contact (OWC) zone (average) (m TVDSS)			depth|oil|water			string				{'syntax': '^{scientific_float}( *- *{scientific_float})? *{text}$', 'interpolated': True, 'partial_match': True}		meter
oxy_stat_samp	oxygenation status of sample	MIXS:0000753		Oxygenation status of sample	{'value': 'aerobic'}		oxygen|sample|status			OxyStatSampEnum						
permeability	permeability	MIXS:0000404		Measure of the ability of a hydrocarbon resource to allow fluids to pass through it. (Additional information: https://en.wikipedia.org/wiki/Permeability_(earth_sciences))						string			{integer} - {integer} {unit}		measurement value range	mD
ph	pH	MIXS:0001001		pH measurement of the sample, or liquid portion of sample, or aqueous phase of the fluid	{'value': '7.2'}		ph			float	True					
porosity	porosity	MIXS:0000211		Porosity of deposited sediment is volume of voids divided by the total volume of sample			porosity			string			{float} - {float} {unit}		measurement value or range	percentage
pos_cont_type	positive control type	MIXS:0001322		The substance, mixture, product, or apparatus used to verify that a process which is part of an investigation delivers a true positive		investigation	type			string	True		{term} or {text}			
potassium	potassium	MIXS:0000430		Concentration of potassium in the sample	{'value': '463 milligram per liter'}					string				{'syntax': '^{scientific_float}( *- *{scientific_float})? *{text}$', 'interpolated': True, 'partial_match': True}		milligram per liter, parts per million
pour_point	pour point	MIXS:0000127		Temperature at which a liquid becomes semi solid and loses its flow characteristics. In crude oil a high pour point is generally associated with a high paraffin content, typically found in crude deriving from a larger proportion of plant material. (source: https://en.wikipedia.org/wiki/pour_point)						string				{'syntax': '^{scientific_float}( *- *{scientific_float})? *{text}$', 'interpolated': True, 'partial_match': True}		degree Celsius
pressure	pressure	MIXS:0000412		Pressure to which the sample is subject to, in atmospheres	{'value': '50 atmosphere'}		pressure			string				{'syntax': '^{scientific_float}( *- *{scientific_float})? *{text}$', 'interpolated': True, 'partial_match': True}		atmosphere
project_name	project name	MIXS:0000092		Name of the project within which the sequencing was organized	{'value': 'Forest soil metagenome'}	investigation	project			string		True				
