name	title	slot_uri	comments	description	examples	in_subset	keywords	multivalued	pattern	range	recommended	required	string_serialization	structured_pattern	Expected_value	Preferred_unit
ref_biomaterial	reference for biomaterial	MIXS:0000025		Primary publication if isolated before genome publication; otherwise, primary genome report	{'value': 'doi:10.1016/j.syapm.2018.01.009'}	nucleic acid sequence source				string				{'syntax': '^({PMID}|{DOI}|{URL})$', 'interpolated': True, 'partial_match': True}		
ref_db	reference database(s)	MIXS:0000062		List of database(s) used for ORF annotation, along with version number and reference to website or publication	{'value': 'pVOGs;5;http://dmk-brain.ecn.uiowa.edu/pVOGs/ Grazziotin et al. 2017 doi:10.1093/nar/gkw975'}	sequencing	database			string			{database};{version};{reference}		names, versions, and references of databases	
rel_to_oxygen	relationship to oxygen	MIXS:0000015		Is this organism an aerobe, anaerobe? Please note that aerobic and anaerobic are valid descriptors for microbial environments	{'value': 'aerobe'}	nucleic acid sequence source	oxygen|relationship			RelToOxygenEnum						
reservoir	reservoir name	MIXS:0000303		Name of the reservoir (e.g. Carapebus)						string	True					
resins_pc	resins wt%	MIXS:0000134		Saturate, Aromatic, Resin and Asphaltene (SARA) is an analysis method that divides crude oil components according to their polarizability and polarity. There are three main methods to obtain SARA results. The most popular one is known as the Iatroscan TLC-FID and is referred to as IP-143 (source: https://en.wikipedia.org/wiki/Saturate,_aromatic,_resin_and_asphaltene)						string	True			{'syntax': '^{name};{float} {unit}$', 'interpolated': True, 'partial_match': True}		percent
salinity	salinity	MIXS:0000183		The total concentration of all dissolved salts in a liquid or solid sample. While salinity can be measured by a complete chemical analysis, this method is difficult and time consuming. More often, it is instead derived from the conductivity measurement. This is known as practical salinity. These derivations compare the specific conductance of the sample to a salinity standard such as seawater	{'value': '25 practical salinity unit'}		salinity			string				{'syntax': '^{scientific_float}( *- *{scientific_float})? *{text}$', 'interpolated': True, 'partial_match': True}		practical salinity unit, percentage
samp_collect_device	sample collection device	MIXS:0000002		The device used to collect an environmental sample. This field accepts terms listed under environmental sampling device (http://purl.obolibrary.org/obo/ENVO). This field also accepts terms listed under specimen collection device (http://purl.obolibrary.org/obo/GENEPIO_0002094)	{'value': 'swab, biopsy, niskin bottle, push core, drag swab [GENEPIO:0002713]'}	nucleic acid sequence source	device|sample			string	True		{termLabel} [{termID}]|{text}		device name	
samp_collect_method	sample collection method	MIXS:0001225		The method employed for collecting the sample	{'value': 'swabbing'}	nucleic acid sequence source	method|sample			string	True			{'syntax': '^({PMID}|{DOI}|{URL}|{text})$', 'interpolated': True, 'partial_match': True}		
samp_mat_process	sample material processing	MIXS:0000016		A brief description of any processing applied to the sample during or after retrieving the sample from environment, or a link to the relevant protocol(s) performed	{'value': 'filtering of seawater, storing samples in ethanol'}	nucleic acid sequence source	material|process|sample			string	True					
samp_md	sample measured depth	MIXS:0000413		"In non deviated well, measured depth is equal to the true vertical depth, TVD (TVD=TVDSS plus the reference or datum it refers to). In deviated wells, the MD is the length of trajectory of the borehole measured from the same reference or datum. Common datums used are ground level (GL), drilling rig floor (DF), rotary table (RT), kelly bushing (KB) and mean sea level (MSL). If ""other"" is specified, please propose entry in ""additional info"" field"	{'value': '1534 meter;MSL'}		depth|measurement|sample			string			{float} {unit};[GL|DF|RT|KB|MSL|other]		measurement value;enumeration	meter
samp_name	sample name	MIXS:0001107		A local identifier or name that for the material sample used for extracting nucleic acids, and subsequent sequencing. It can refer either to the original material collected or to any derived sub-samples. It can have any format, but we suggest that you make it concise, unique and consistent within your lab, and as informative as possible. INSDC requires every sample name from a single Submitter to be unique. Use of a globally unique identifier for the field source_mat_id is recommended in addition to sample_name	{'value': 'ISDsoil1'}	investigation	sample			string		True				
samp_size	amount or size of sample collected	MIXS:0000001		The total amount or size (volume (ml), mass (g) or area (m2) ) of sample collected	{'value': '5 liter'}	nucleic acid sequence source	sample|size			string	True			{'syntax': '^{scientific_float}( *- *{scientific_float})? *{text}$', 'interpolated': True, 'partial_match': True}		
samp_store_dur	sample storage duration	MIXS:0000116		Duration for which the sample was stored. Indicate the duration for which the sample was stored written in ISO 8601 format	{'value': 'P1Y6M'}		duration|period|sample|storage			string				{'syntax': '^{duration}$', 'interpolated': True, 'partial_match': True}		
samp_store_loc	sample storage location	MIXS:0000755		Location at which sample was stored, usually name of a specific freezer/room	{'value': 'Freezer no:5'}		location|sample|storage			string					location name	
samp_store_temp	sample storage temperature	MIXS:0000110		Temperature at which sample was stored, e.g. -80 degree Celsius	{'value': '-80 degree Celsius'}		sample|storage|temperature			string				{'syntax': '^{scientific_float}( *- *{scientific_float})? *{text}$', 'interpolated': True, 'partial_match': True}		degree Celsius
samp_subtype	sample subtype	MIXS:0000999		"Name of sample sub-type. For example if ""sample type"" is ""Produced Water"" then subtype could be ""Oil Phase"" or ""Water Phase"". If ""other"" is specified, please propose entry in ""additional info"" field"	{'value': 'biofilm'}		sample			SampSubtypeEnum	True					
samp_taxon_id	taxonomy ID of DNA sample	MIXS:0001320		NCBI taxon id of the sample.  Maybe be a single taxon or mixed taxa sample. Use 'synthetic metagenome  for mock community/positive controls, or 'blank sample' for negative controls	{'value': 'Gut Metagenome [NCBITaxon:749906]'}	investigation	dna|identifier|sample|taxon			string		True		{'syntax': '^{text} \\[{NCBItaxon_id}\\]$', 'interpolated': True, 'partial_match': True}		
samp_transport_cond	sample transport conditions	MIXS:0000410		Sample transport duration (in days or hrs) and temperature the sample was exposed to (e.g. 5.5 days; 20   C)	{'value': '5 days;-20 degree Celsius'}		condition|sample|transport			string			{float} {unit};{float} {unit}		measurement value;measurement value	days;degree Celsius
samp_tvdss	sample true vertical depth subsea	MIXS:0000409		Depth of the sample i.e. The vertical distance between the sea level and the sampled position in the subsurface. Depth can be reported as an interval for subsurface samples e.g. 1325.75-1362.25 m			depth|sample			string	True		{float}-{float} {unit}		measurement value or measurement value range	meter
samp_type	sample type	MIXS:0000998		The type of material from which the sample was obtained. For the Hydrocarbon package, samples include types like core, rock trimmings, drill cuttings, piping section, coupon, pigging debris, solid deposit, produced fluid, produced water, injected water, swabs, etc. For the Food Package, samples are usually categorized as food, body products or tissues, or environmental material. This field accepts terms listed under environmental specimen (http://purl.obolibrary.org/obo/GENEPIO_0001246)	{'value': 'built environment sample [GENEPIO:0001248]'}		sample|type			string		True		{'syntax': '^{termLabel} \\[{termID}\\]$', 'interpolated': True, 'partial_match': True}		
samp_vol_we_dna_ext	sample volume or weight for DNA extraction	MIXS:0000111		Volume (ml) or mass (g) of total collected sample processed for DNA extraction. Note: total sample collected should be entered under the term Sample Size (MIXS:0000001)	{'value': '1500 milliliter'}	nucleic acid sequence source	dna|sample|volume|weight			string	True			{'syntax': '^{scientific_float}( *- *{scientific_float})? *{text}$', 'interpolated': True, 'partial_match': True}		milliliter, gram, milligram, square centimeter
samp_well_name	sample well name	MIXS:0000296		Name of the well (e.g. BXA1123) where sample was taken			sample			string	True					
saturates_pc	saturates wt%	MIXS:0000131		Saturate, Aromatic, Resin and Asphaltene (SARA) is an analysis method that divides crude oil components according to their polarizability and polarity. There are three main methods to obtain SARA results. The most popular one is known as the Iatroscan TLC-FID and is referred to as IP-143 (source: https://en.wikipedia.org/wiki/Saturate,_aromatic,_resin_and_asphaltene)						string	True			{'syntax': '^{name};{float} {unit}$', 'interpolated': True, 'partial_match': True}		percent
seq_meth	sequencing method	MIXS:0000050		Sequencing machine used. Where possible the term should be taken from the OBI list of DNA sequencers (http://purl.obolibrary.org/obo/OBI_0400103)	{'value': '454 Genome Sequencer FLX [OBI:0000702]'}	sequencing	method			string		True		{'syntax': '^{text}|({termLabel} \\[{termID}\\])$', 'interpolated': True, 'partial_match': True}		
sim_search_meth	similarity search method	MIXS:0000063		Tool used to compare ORFs with database, along with version and cutoffs used	{'value': 'HMMER3;3.1b2;hmmsearch, cutoff of 50 on score'}	sequencing	method			string				{'syntax': '^{software};{version};{parameters}$', 'interpolated': True, 'partial_match': True}		
size_frac	size fraction selected	MIXS:0000017		Filtering pore size used in sample preparation	{'value': '0-0.22 micrometer'}	nucleic acid sequence source	fraction|size			string			{float}-{float} {unit}		filter size value range	
sodium	sodium	MIXS:0000428		Sodium concentration in the sample	{'value': '10.5 milligram per liter'}					string				{'syntax': '^{scientific_float}( *- *{scientific_float})? *{text}$', 'interpolated': True, 'partial_match': True}		milligram per liter, parts per million
sop	relevant standard operating procedures	MIXS:0000090		Standard operating procedures used in assembly and/or annotation of genomes, metagenomes or environmental sequences	{'value': 'http://press.igsb.anl.gov/earthmicrobiome/protocols-and-standards/its/'}	sequencing	procedures	True		string	True			{'syntax': '^({PMID}|{DOI}|{URL})$', 'interpolated': True, 'partial_match': False}	reference to SOP	
source_mat_id	source material identifiers	MIXS:0000026		A unique identifier assigned to a material sample (as defined by http://rs.tdwg.org/dwc/terms/materialSampleID, and as opposed to a particular digital record of a material sample) used for extracting nucleic acids, and subsequent sequencing. The identifier can refer either to the original material collected or to any derived sub-samples. The INSDC qualifiers /specimen_voucher, /bio_material, or /culture_collection may or may not share the same value as the source_mat_id field. For instance, the /specimen_voucher qualifier and source_mat_id may both contain 'UAM:Herps:14' , referring to both the specimen voucher and sampled tissue with the same identifier. However, the /culture_collection qualifier may refer to a value from an initial culture (e.g. ATCC:11775) while source_mat_id would refer to an identifier from some derived culture from which the nucleic acids were extracted (e.g. xatc123 or ark:/2154/R2)	{'value': 'MPI012345'}	nucleic acid sequence source	identifier|material|source	True		string	True				for cultures of microorganisms: identifiers for two culture collections; for other material a unique arbitrary identifer	
sr_dep_env	source rock depositional environment	MIXS:0000996		"Source rock depositional environment (https://en.wikipedia.org/wiki/Source_rock). If ""other"" is specified, please propose entry in ""additional info"" field"	{'value': 'Marine'}		environment|source			SrDepEnvEnum						
sr_geol_age	source rock geological age	MIXS:0000997		"Geological age of source rock (Additional info: https://en.wikipedia.org/wiki/Period_(geology)). If ""other"" is specified, please propose entry in ""additional info"" field"	{'value': 'Silurian'}		age|source			GeolAgeEnum						
sr_kerog_type	source rock kerogen type	MIXS:0000994		"Origin of kerogen. Type I: Algal (aquatic), Type II: planktonic and soft plant material (aquatic or terrestrial), Type III: terrestrial woody/ fibrous plant material (terrestrial), Type IV: oxidized recycled woody debris (terrestrial) (additional information: https://en.wikipedia.org/wiki/Kerogen). If ""other"" is specified, please propose entry in ""additional info"" field"	{'value': 'Type IV'}		source|type			SrKerogTypeEnum						
sr_lithology	source rock lithology	MIXS:0000995		"Lithology of source rock (https://en.wikipedia.org/wiki/Source_rock). If ""other"" is specified, please propose entry in ""additional info"" field"	{'value': 'Coal'}		lithology|source			SrLithologyEnum						
sulfate	sulfate	MIXS:0000423		Concentration of sulfate in the sample	{'value': '5 micromole per liter'}		sulfate			string	True			{'syntax': '^{scientific_float}( *- *{scientific_float})? *{text}$', 'interpolated': True, 'partial_match': True}		micromole per liter, milligram per liter, parts per million
sulfate_fw	sulfate in formation water	MIXS:0000407		Original sulfate concentration in the hydrocarbon resource			sulfate|water			string		True		{'syntax': '^{scientific_float}( *- *{scientific_float})? *{text}$', 'interpolated': True, 'partial_match': True}		milligram per liter
sulfide	sulfide	MIXS:0000424		Concentration of sulfide in the sample	{'value': '2 micromole per liter'}		sulfide			string	True			{'syntax': '^{scientific_float}( *- *{scientific_float})? *{text}$', 'interpolated': True, 'partial_match': True}		micromole per liter, milligram per liter, parts per million
suspend_solids	suspended solids	MIXS:0000150		Concentration of substances including a wide variety of material, such as silt, decaying plant and animal matter; can include multiple substances			solids|suspended	True		string			{text};{float} {unit}		suspended solid name;measurement value	gram, microgram, milligram per liter, mole per liter, gram per liter, part per million
tan	total acid number	MIXS:0000120		Total Acid Number (TAN) is a measurement of acidity that is determined by the amount of potassium hydroxide in milligrams that is needed to neutralize the acids in one gram of oil. It is an important quality measurement of crude oil. (source: https://en.wikipedia.org/wiki/Total_acid_number)			number|total			string	True			{'syntax': '^{scientific_float}( *- *{scientific_float})? *{text}$', 'interpolated': True, 'partial_match': True}		milligram per liter
tax_class	taxonomic classification	MIXS:0000064		Method used for taxonomic classification, along with reference database used, classification rank, and thresholds used to classify new genomes	{'value': 'vConTACT vContact2 (references from NCBI RefSeq v83, genus rank classification, default parameters)'}	sequencing	classification|taxon			string						
temp	temperature	MIXS:0000113		Temperature of the sample at the time of sampling	{'value': '25 degree Celsius'}	environment	temperature			string	True	True		{'syntax': '^{scientific_float}( *- *{scientific_float})? *{text}$', 'interpolated': True, 'partial_match': True}		degree Celsius
toluene	toluene	MIXS:0000154		Concentration of toluene in the sample						string	True			{'syntax': '^{scientific_float}( *- *{scientific_float})? *{text}$', 'interpolated': True, 'partial_match': True}		milligram per liter, parts per million
tot_iron	total iron	MIXS:0000105		Concentration of total iron in the sample			total			string	True			{'syntax': '^{scientific_float}( *- *{scientific_float})? *{text}$', 'interpolated': True, 'partial_match': True}		milligram per liter, milligram per kilogram
tot_nitro	total nitrogen concentration	MIXS:0000102		Total nitrogen concentration of water samples, calculated by: total nitrogen = total dissolved nitrogen + particulate nitrogen. Can also be measured without filtering, reported as nitrogen	{'value': '50 micromole per liter'}		concentration|nitrogen|total			string				{'syntax': '^{scientific_float}( *- *{scientific_float})? *{text}$', 'interpolated': True, 'partial_match': True}		microgram per liter, micromole per liter, milligram per liter
tot_phosp	total phosphorus	MIXS:0000117		Total phosphorus concentration in the sample, calculated by: total phosphorus = total dissolved phosphorus + particulate phosphorus	{'value': '0.03 milligram per liter'}		phosphorus|total			string				{'syntax': '^{scientific_float}( *- *{scientific_float})? *{text}$', 'interpolated': True, 'partial_match': True}		micromole per liter, milligram per liter, parts per million
tot_sulfur	total sulfur	MIXS:0000419		Concentration of total sulfur in the sample			sulfur|total			string	True			{'syntax': '^{scientific_float}( *- *{scientific_float})? *{text}$', 'interpolated': True, 'partial_match': True}		milligram per liter, parts per million
tvdss_of_hcr_press	depth (TVDSS) of hydrocarbon resource pressure	MIXS:0000397		True vertical depth subsea (TVDSS) of the hydrocarbon resource where the original pressure was measured (e.g. 1578 m)			depth|hydrocarbon|pressure|resource			string				{'syntax': '^{scientific_float}( *- *{scientific_float})? *{text}$', 'interpolated': True, 'partial_match': True}		meter
tvdss_of_hcr_temp	depth (TVDSS) of hydrocarbon resource temperature	MIXS:0000394		True vertical depth subsea (TVDSS) of the hydrocarbon resource where the original temperature was measured (e.g. 1345 m)			depth|hydrocarbon|resource|temperature			string				{'syntax': '^{scientific_float}( *- *{scientific_float})? *{text}$', 'interpolated': True, 'partial_match': True}		meter
vfa	volatile fatty acids	MIXS:0000152		Concentration of Volatile Fatty Acids in the sample						string	True			{'syntax': '^{scientific_float}( *- *{scientific_float})? *{text}$', 'interpolated': True, 'partial_match': True}		milligram per liter, parts per million
vfa_fw	vfa in formation water	MIXS:0000408		Original volatile fatty acid concentration in the hydrocarbon resource			water			string		True		{'syntax': '^{scientific_float}( *- *{scientific_float})? *{text}$', 'interpolated': True, 'partial_match': True}		milligram per liter
viscosity	viscosity	MIXS:0000126		A measure of oil's resistance to gradual deformation by shear stress or tensile stress (e.g. 3.5 cp; 100 °C)						string			{float} {unit};{float} {unit}		measurement value;measurement value	cP at degree Celsius
win	well identification number	MIXS:0000297		A unique identifier of a well or wellbore. This is part of the Global Framework for Well Identification initiative which is compiled by the Professional Petroleum Data Management Association (PPDM) in an effort to improve well identification systems. (Supporting information: https://ppdm.org/ and http://dl.ppdm.org/dl/690)			identifier|number			string	True					
xylene	xylene	MIXS:0000156		Concentration of xylene in the sample						string	True			{'syntax': '^{scientific_float}( *- *{scientific_float})? *{text}$', 'interpolated': True, 'partial_match': True}		milligram per liter, parts per million
