name	title	slot_uri	comments	description	examples	in_subset	keywords	multivalued	pattern	range	recommended	required	string_serialization	structured_pattern	Expected_value	Preferred_unit
abs_air_humidity	absolute air humidity	MIXS:0000122	Can be calculated via mass of water vapor divided by the volume of the air and water vapor mixture.	Actual mass of water vapor present in the air water vapor mixture.	{'value': '7 gram per cubic meter'}		absolute|air|humidity			string		True		{'syntax': '^{scientific_float}( *- *{scientific_float})? *{text}$', 'interpolated': True, 'partial_match': True}		gram per gram, kilogram per kilogram, kilogram, pound, gram per cubic meter, kilogram per cubic meter, percent
address	address	MIXS:0000218		The street name and building number where the sampling occurred						string				{'syntax': '^{integer} {text}$', 'interpolated': True, 'partial_match': True}		
adj_room	adjacent rooms	MIXS:0000219		List of rooms (room number, room name) immediately adjacent to the sampling room			adjacent|room			string				{'syntax': '^{room_name};{room_number}$', 'interpolated': True, 'partial_match': True}		
aero_struc	aerospace structure	MIXS:0000773		Aerospace structures typically consist of thin plates with stiffeners for the external surfaces, bulkheads and frames to support the shape and fasteners such as welds, rivets, screws and bolts to hold the components together	{'value': 'plane'}					AeroStrucEnum						
air_temp	air temperature	MIXS:0000124		Temperature of the air at the time of sampling	{'value': '20 degree Celsius'}		air|temperature			string		True		{'syntax': '^{scientific_float}( *- *{scientific_float})? *{text}$', 'interpolated': True, 'partial_match': True}		degree Celsius
amount_light	amount of light	MIXS:0000140		The unit of illuminance and luminous emittance, measuring luminous flux per unit area			light			string				{'syntax': '^{scientific_float}( *- *{scientific_float})? *{text}$', 'interpolated': True, 'partial_match': True}		lux, lumens per square meter
arch_struc	architectural structure	MIXS:0000774		An architectural structure is a human-made, free-standing, immobile outdoor construction	{'value': 'shed'}					ArchStrucEnum						
avg_dew_point	average dew point	MIXS:0000141		The average of dew point measures taken at the beginning of every hour over a 24 hour period on the sampling day	{'value': '25.5 degree Celsius'}		average			string				{'syntax': '^{scientific_float}( *- *{scientific_float})? *{text}$', 'interpolated': True, 'partial_match': True}		degree Celsius
avg_occup	average daily occupancy	MIXS:0000775		Daily average occupancy of room. Indicate the number of person(s) daily occupying the sampling room	{'value': '2'}		average			float						
avg_temp	average temperature	MIXS:0000142		The average of temperatures taken at the beginning of every hour over a 24 hour period on the sampling day	{'value': '12.5 degree Celsius'}		average|temperature			string				{'syntax': '^{scientific_float}( *- *{scientific_float})? *{text}$', 'interpolated': True, 'partial_match': True}		degree Celsius
bathroom_count	bathroom count	MIXS:0000776		The number of bathrooms in the building	{'value': '1'}		count			integer						
bedroom_count	bedroom count	MIXS:0000777		The number of bedrooms in the building	{'value': '2'}		count			integer						
build_docs	design, construction, and operation documents	MIXS:0000787		The building design, construction and operation documents	{'value': 'maintenance plans'}		documents			BuildDocsEnum						
build_occup_type	building occupancy type	MIXS:0000761		The primary function for which a building or discrete part of a building is intended to be used	{'value': 'market'}		type	True		BuildOccupTypeEnum		True				
building_setting	building setting	MIXS:0000768		A location (geography) where a building is set	{'value': 'rural'}					BuildingSettingEnum		True				
built_struc_age	built structure age	MIXS:0000145		The age of the built structure since construction	{'value': '15 years'}		age			string				{'syntax': '^{scientific_float}( *- *{scientific_float})? *{text}$', 'interpolated': True, 'partial_match': True}		year
built_struc_set	built structure setting	MIXS:0000778		The characterization of the location of the built structure as high or low human density	{'value': 'rural'}					BuiltStrucSetEnum						
built_struc_type	built structure type	MIXS:0000721		A physical structure that is a body or assemblage of bodies in space to form a system capable of supporting loads			type			string						
carb_dioxide	carbon dioxide	MIXS:0000097		Carbon dioxide (gas) amount or concentration at the time of sampling	{'value': '410 parts per million'}		carbon			string		True		{'syntax': '^{scientific_float}( *- *{scientific_float})? *{text}$', 'interpolated': True, 'partial_match': True}		micromole per liter, parts per million
ceil_area	ceiling area	MIXS:0000148		The area of the ceiling space within the room	{'value': '25 square meter'}		area|ceiling			string				{'syntax': '^{scientific_float}( *- *{scientific_float})? *{text}$', 'interpolated': True, 'partial_match': True}		square meter
ceil_cond	ceiling condition	MIXS:0000779		The physical condition of the ceiling at the time of sampling; photos or video preferred; use drawings to indicate location of damaged areas	{'value': 'damaged'}		ceiling|condition			DamagedEnum						
ceil_finish_mat	ceiling finish material	MIXS:0000780		The type of material used to finish a ceiling	{'value': 'stucco'}		ceiling|material			CeilFinishMatEnum						
ceil_struc	ceiling structure	MIXS:0000782		The construction format of the ceiling	{'value': 'concrete'}		ceiling			CeilStrucEnum						
ceil_texture	ceiling texture	MIXS:0000783		The feel, appearance, or consistency of a ceiling surface	{'value': 'popcorn'}		ceiling|texture			CeilingWallTextureEnum						
ceil_thermal_mass	ceiling thermal mass	MIXS:0000143		The ability of the ceiling to provide inertia against temperature fluctuations. Generally this means concrete that is exposed. A metal deck that supports a concrete slab will act thermally as long as it is exposed to room air flow			ceiling|mass			string				{'syntax': '^{scientific_float}( *- *{scientific_float})? *{text}$', 'interpolated': True, 'partial_match': True}		joule per degree Celsius
ceil_type	ceiling type	MIXS:0000784		The type of ceiling according to the ceiling's appearance or construction	{'value': 'coffered'}		ceiling|type			CeilTypeEnum						
ceil_water_mold	ceiling signs of water/mold	MIXS:0000781		Signs of the presence of mold or mildew on the ceiling	{'value': 'presence of mold visible'}		ceiling			MoldVisibilityEnum						
cool_syst_id	cooling system identifier	MIXS:0000785		The cooling system identifier	{'value': '12345'}		identifier			integer						
date_last_rain	date last rain	MIXS:0000786		The date of the last time it rained	{'value': '2013-03-25T12:42:31+01:00'}		date|rain			datetime						
dew_point	dew point	MIXS:0000129		The temperature to which a given parcel of humid air must be cooled, at constant barometric pressure, for water vapor to condense into water	{'value': '22 degree Celsius'}					string				{'syntax': '^{scientific_float}( *- *{scientific_float})? *{text}$', 'interpolated': True, 'partial_match': True}		degree Celsius
door_comp_type	door type, composite	MIXS:0000795		The composite type of the door	{'value': 'revolving'}		door|type			DoorCompTypeEnum						
door_cond	door condition	MIXS:0000788		The physical condition of the door	{'value': 'new'}		condition|door			DamagedRupturedEnum						
door_direct	door direction of opening	MIXS:0000789		The direction the door opens	{'value': 'inward'}		direction|door			DoorDirectEnum						
door_loc	door location	MIXS:0000790		The relative location of the door in the room	{'value': 'north'}		door|location			CompassDirections8Enum						
door_mat	door material	MIXS:0000791		The material the door is composed of	{'value': 'wood'}		door|material			DoorMatEnum						
door_move	door movement	MIXS:0000792		The type of movement of the door	{'value': 'swinging'}		door			DoorMoveEnum						
door_size	door area or size	MIXS:0000158		The size of the door	{'value': '2.5 square meter'}		area|door|size			string				{'syntax': '^{scientific_float}( *- *{scientific_float})? *{text}$', 'interpolated': True, 'partial_match': True}		square meter
door_type	door type	MIXS:0000794		The type of door material	{'value': 'wooden'}		door|type			DoorTypeEnum						
door_type_metal	door type, metal	MIXS:0000796		The type of metal door	{'value': 'hollow'}		door|type			DoorTypeMetalEnum						
door_type_wood	door type, wood	MIXS:0000797		The type of wood door	{'value': 'battened'}		door|type			string			[bettened and ledged|battened|ledged and braced|battened|ledged and framed|battened|ledged, braced and frame|framed and paneled|glashed or sash|flush|louvered|wire gauged]		enumeration	
door_water_mold	door signs of water/mold	MIXS:0000793		Signs of the presence of mold or mildew on a door	{'value': 'presence of mold visible'}		door			MoldVisibilityEnum						
drawings	drawings	MIXS:0000798		The buildings architectural drawings; if design is chosen, indicate phase-conceptual, schematic, design development, and construction documents	{'value': 'sketch'}		drawings			DrawingsEnum						
elevator	elevator count	MIXS:0000799		The number of elevators within the built structure	{'value': '2'}		count			integer						
escalator	escalator count	MIXS:0000800		The number of escalators within the built structure	{'value': '4'}		count			integer						
exp_duct	exposed ductwork	MIXS:0000144		The amount of exposed ductwork in the room						string				{'syntax': '^{scientific_float}( *- *{scientific_float})? *{text}$', 'interpolated': True, 'partial_match': True}		square meter
exp_pipe	exposed pipes	MIXS:0000220		The number of exposed pipes in the room			pipes			string				{'syntax': '^{integer} {text}$', 'interpolated': True, 'partial_match': True}		
ext_door	exterior door count	MIXS:0000170		The number of exterior doors in the built structure			count|door|exterior			integer						
ext_wall_orient	orientations of exterior wall	MIXS:0000817		The orientation of the exterior wall	{'value': 'northwest'}		exterior|wall			CompassDirections8Enum						
ext_window_orient	orientations of exterior window	MIXS:0000818		The compass direction the exterior window of the room is facing	{'value': 'southwest'}		exterior|window			CompassDirections8Enum						
filter_type	filter type	MIXS:0000765		A device which removes solid particulates or airborne molecular contaminants	{'value': 'HEPA'}		filter|type	True		FilterTypeEnum		True				
fireplace_type	fireplace type	MIXS:0000802		A firebox with chimney	{'value': 'wood burning'}		type			FireplaceTypeEnum						
floor_age	floor age	MIXS:0000164		The time period since installment of the carpet or flooring			age|floor			string				{'syntax': '^{scientific_float}( *- *{scientific_float})? *{text}$', 'interpolated': True, 'partial_match': True}		years, weeks, days
floor_area	floor area	MIXS:0000165		The area of the floor space within the room			area|floor			string				{'syntax': '^{scientific_float}( *- *{scientific_float})? *{text}$', 'interpolated': True, 'partial_match': True}		square meter
floor_cond	floor condition	MIXS:0000803		The physical condition of the floor at the time of sampling; photos or video preferred; use drawings to indicate location of damaged areas	{'value': 'new'}		condition|floor			DamagedEnum						
floor_count	floor count	MIXS:0000225		The number of floors in the building, including basements and mechanical penthouse			count|floor			integer						
floor_finish_mat	floor finish material	MIXS:0000804		The floor covering type; the finished surface that is walked on	{'value': 'carpet'}		floor|material			string			[tile|wood strip or parquet|carpet|rug|laminate wood|lineoleum|vinyl composition tile|sheet vinyl|stone|bamboo|cork|terrazo|concrete|none;specify unfinished|sealed|clear finish|paint]		enumeration	
floor_struc	floor structure	MIXS:0000806		Refers to the structural elements and subfloor upon which the finish flooring is installed	{'value': 'concrete'}		floor			FloorStrucEnum						
floor_thermal_mass	floor thermal mass	MIXS:0000166		The ability of the floor to provide inertia against temperature fluctuations			floor|mass			string				{'syntax': '^{scientific_float}( *- *{scientific_float})? *{text}$', 'interpolated': True, 'partial_match': True}		joule per degree Celsius
floor_water_mold	floor signs of water/mold	MIXS:0000805		Signs of the presence of mold or mildew in a room	{'value': 'ceiling discoloration'}		floor			FloorWaterMoldEnum						
freq_clean	frequency of cleaning	MIXS:0000226		The number of times the sample location is cleaned. Frequency of cleaning might be on a Daily basis, Weekly, Monthly, Quarterly or Annually	{'value': 'Daily'}		frequency			FreqCleanEnum			[ Daily| Weekly| Monthly| Quarterly | Annually| other]			
freq_cook	frequency of cooking	MIXS:0000227		The number of times a meal is cooked per week			frequency			string				{'syntax': '^{integer} {text}$', 'interpolated': True, 'partial_match': True}		
furniture	furniture	MIXS:0000807		The types of furniture present in the sampled room	{'value': 'chair'}					FurnitureEnum						
gender_restroom	gender of restroom	MIXS:0000808		The gender type of the restroom	{'value': 'male'}					GenderRestroomEnum						
hall_count	hallway/corridor count	MIXS:0000228		The total count of hallways and corridors in the built structure			corridor|count|hallway			integer						
handidness	handidness	MIXS:0000809		The handidness of the individual sampled	{'value': 'right handedness'}					HandidnessEnum						
heat_cool_type	heating and cooling system type	MIXS:0000766		Methods of conditioning or heating a room or building	{'value': 'heat pump'}		type	True		HeatCoolTypeEnum		True				
heat_deliv_loc	heating delivery locations	MIXS:0000810		The location of heat delivery within the room	{'value': 'north'}		delivery|location|locations			CompassDirections8Enum						
heat_sys_deliv_meth	heating system delivery method	MIXS:0000812		The method by which the heat is delivered through the system	{'value': 'radiant'}		delivery|method			HeatSysDelivMethEnum						
heat_system_id	heating system identifier	MIXS:0000833		The heating system identifier			identifier			integer						
height_carper_fiber	height carpet fiber mat	MIXS:0000167		The average carpet fiber height in the indoor environment			height			string				{'syntax': '^{scientific_float}( *- *{scientific_float})? *{text}$', 'interpolated': True, 'partial_match': True}		centimeter
indoor_space	indoor space	MIXS:0000763		A distinguishable space within a structure, the purpose for which discrete areas of a building is used	{'value': 'foyer'}		indoor			IndoorSpaceEnum		True				
indoor_surf	indoor surface	MIXS:0000764		Type of indoor surface	{'value': 'wall'}		indoor|surface			IndoorSurfEnum	True	True				
inside_lux	inside lux light	MIXS:0000168		The recorded value at sampling time (power density)			inside|light			string				{'syntax': '^{scientific_float}( *- *{scientific_float})? *{text}$', 'interpolated': True, 'partial_match': True}		kilowatt per square metre
int_wall_cond	interior wall condition	MIXS:0000813		The physical condition of the wall at the time of sampling; photos or video preferred; use drawings to indicate location of damaged areas	{'value': 'damaged'}		condition|interior|wall			DamagedEnum						
last_clean	last time swept/mopped/vacuumed	MIXS:0000814		The last time the floor was cleaned (swept, mopped, vacuumed)	{'value': '2013-03-25T12:42:31+01:00'}		time			datetime						
light_type	light type	MIXS:0000769		Application of light to achieve some practical or aesthetic effect. Lighting includes the use of both artificial light sources such as lamps and light fixtures, as well as natural illumination by capturing daylight. Can also include absence of light	{'value': 'desk lamp'}		light|type	True		LightTypeEnum		True				
max_occup	maximum occupancy	MIXS:0000229		The maximum amount of people allowed in the indoor environment			maximum			string				{'syntax': '^{integer} {text}$', 'interpolated': True, 'partial_match': True}		
mech_struc	mechanical structure	MIXS:0000815		mechanical structure: a moving structure	{'value': 'elevator'}					MechStrucEnum						
number_pets	number of pets	MIXS:0000231		The number of pets residing in the sampled space			number			string				{'syntax': '^{integer} {text}$', 'interpolated': True, 'partial_match': True}		
number_plants	number of houseplants	MIXS:0000230		The number of plant(s) in the sampling space			number			string				{'syntax': '^{integer} {text}$', 'interpolated': True, 'partial_match': True}		
number_resident	number of residents	MIXS:0000232		The number of individuals currently occupying in the sampling location			number			string				{'syntax': '^{integer} {text}$', 'interpolated': True, 'partial_match': True}		
occup_density_samp	occupant density at sampling	MIXS:0000217		Average number of occupants at time of sampling per square footage	{'value': '0.1'}		density			float		True				
occup_document	occupancy documentation	MIXS:0000816		The type of documentation of occupancy	{'value': 'estimate'}		documentation			OccupDocumentEnum						
occup_samp	occupancy at sampling	MIXS:0000772		Number of occupants present at time of sample within the given space	{'value': '10'}					float		True		{'syntax': '^{integer} {text}$', 'interpolated': True, 'partial_match': True}		
organism_count	organism count	MIXS:0000103		Total cell count of any organism (or group of organisms) per gram, volume or area of sample, should include name of organism followed by count. The method that was used for the enumeration (e.g. qPCR, atp, mpn, etc.) Should also be provided. (example: total prokaryotes; 3.5e7 cells per ml; qpcr)	{'value': 'total prokaryotes;3.5e7 cells per milliliter;qPCR'}		count|organism	True		string		True	{text};{float} {unit};[ATP|MPN|qPCR|other]		organism name;measurement value;enumeration	
pres_animal_insect	presence of pets, animals, or insects	MIXS:0000819		The type and number of animals or insects present in the sampling space	{'value': 'cat;5'}		animal|presence			string			[cat|dog|rodent|snake|other];{integer}		enumeration;count	
project_name	project name	MIXS:0000092		Name of the project within which the sequencing was organized	{'value': 'Forest soil metagenome'}	investigation	project			string		True				
quad_pos	quadrant position	MIXS:0000820		The quadrant position of the sampling room within the building	{'value': 'West side'}					QuadPosEnum						
rel_air_humidity	relative air humidity	MIXS:0000121	percent or float?	Partial vapor and air pressure, density of the vapor and air, or by the actual mass of the vapor and air	{'value': '0.8'}		air|humidity|relative			float		True		{'syntax': '^{scientific_float}( *- *{scientific_float})? *{text}$', 'interpolated': True, 'partial_match': True}		percentage
rel_humidity_out	outside relative humidity	MIXS:0000188		The recorded outside relative humidity value at the time of sampling	{'value': '12 per kilogram of air'}		humidity|relative			string				{'syntax': '^{scientific_float}( *- *{scientific_float})? *{text}$', 'interpolated': True, 'partial_match': True}		gram of air, kilogram of air
rel_samp_loc	relative sampling location	MIXS:0000821		The sampling location within the train car	{'value': 'center of car'}		location|relative			RelSampLocEnum						
room_air_exch_rate	room air exchange rate	MIXS:0000169		The rate at which outside air replaces indoor air in a given space			air|rate|room			string				{'syntax': '^{scientific_float}( *- *{scientific_float})? *{text}$', 'interpolated': True, 'partial_match': True}		liter per hour
room_architec_elem	room architectural elements	MIXS:0000233		The unique details and component parts that, together, form the architecture of a distinguishable space within a built structure			room			string						
room_condt	room condition	MIXS:0000822		The condition of the room at the time of sampling	{'value': 'new'}		condition|room			RoomCondtEnum						
room_connected	rooms connected by a doorway	MIXS:0000826		List of rooms connected to the sampling room by a doorway	{'value': 'office'}		doorway|room			RoomConnectedEnum						
room_count	room count	MIXS:0000234		The total count of rooms in the built structure including all room types			count|room			integer						
room_dim	room dimensions	MIXS:0000192		The length, width and height of sampling room	{'value': '4 meter x 4 meter x 4 meter'}		dimensions|room			string			{integer} {unit} x {integer} {unit} x {integer} {unit}		measurement value	meter
room_door_dist	room door distance	MIXS:0000193		Distance between doors (meters) in the hallway between the sampling room and adjacent rooms			distance|door|room			string				{'syntax': '^{integer} {text}$', 'interpolated': True, 'partial_match': True}		meter
room_door_share	rooms that share a door with sampling room	MIXS:0000242		List of room(s) (room number, room name) sharing a door with the sampling room			door|room			string				{'syntax': '^{room_name};{room_number}$', 'interpolated': True, 'partial_match': True}		
room_hallway	rooms that are on the same hallway	MIXS:0000238		List of room(s) (room number, room name) located in the same hallway as sampling room			hallway|room			string				{'syntax': '^{room_name};{room_number}$', 'interpolated': True, 'partial_match': True}		
room_loc	room location in building	MIXS:0000823		The position of the room within the building	{'value': 'interior room'}		location|room			RoomLocEnum						
room_moist_dam_hist	room moisture damage or mold history	MIXS:0000235		The history of moisture damage or mold in the past 12 months. Number of events of moisture damage or mold observed			history|moisture|room			integer						
room_net_area	room net area	MIXS:0000194		The net floor area of sampling room. Net area excludes wall thicknesses			area|room			string				{'syntax': '^{integer} {text}$', 'interpolated': True, 'partial_match': True}		square feet, square meter
room_occup	room occupancy	MIXS:0000236		Count of room occupancy at time of sampling			room			string				{'syntax': '^{integer} {text}$', 'interpolated': True, 'partial_match': True}		
room_samp_pos	room sampling position	MIXS:0000824		The horizontal sampling position in the room relative to architectural elements	{'value': 'south corner'}		room			RoomSampPosEnum						
room_type	room type	MIXS:0000825		The main purpose or activity of the sampling room. A room is any distinguishable space within a structure	{'value': 'bathroom'}		room|type			string			[attic|bathroom|closet|conference room|elevator|examining room|hallway|kitchen|mail room|private office|open office|stairwell|,restroom|lobby|vestibule|mechanical or electrical room|data center|laboratory_wet|laboratory_dry|gymnasium|natatorium|auditorium|lockers|cafe|warehouse]		enumeration	
room_vol	room volume	MIXS:0000195		Volume of sampling room			room|volume			string				{'syntax': '^{integer} {text}$', 'interpolated': True, 'partial_match': True}		cubic feet, cubic meter
room_wall_share	rooms that share a wall with sampling room	MIXS:0000243		List of room(s) (room number, room name) sharing a wall with the sampling room			room|wall			string				{'syntax': '^{room_name};{room_number}$', 'interpolated': True, 'partial_match': True}		
room_window_count	room window count	MIXS:0000237		Number of windows in the room			count|room|window			integer						
samp_floor	sampling floor	MIXS:0000828		The floor of the building, where the sampling room is located	{'value': '4th floor'}		floor		^(?:(?:\d*1[1-3]th|\d*1st|\d*2nd|\d*3rd|\d*[04-9]th) floor|basement|lobby)$	string					enumeration	
samp_name	sample name	MIXS:0001107		A local identifier or name that for the material sample used for extracting nucleic acids, and subsequent sequencing. It can refer either to the original material collected or to any derived sub-samples. It can have any format, but we suggest that you make it concise, unique and consistent within your lab, and as informative as possible. INSDC requires every sample name from a single Submitter to be unique. Use of a globally unique identifier for the field source_mat_id is recommended in addition to sample_name	{'value': 'ISDsoil1'}	investigation	sample			string		True				
samp_room_id	sampling room ID or name	MIXS:0000244		Sampling room number. This ID should be consistent with the designations on the building floor plans			identifier|room			integer						
samp_sort_meth	sample size sorting method	MIXS:0000216		Method by which samples are sorted; open face filter collecting total suspended particles, prefilter to remove particles larger than X micrometers in diameter, where common values of X would be 10 and 2.5 full size sorting in a cascade impactor			method|sample|size	True		string						
samp_time_out	sampling time outside	MIXS:0000196		The recent and long term history of outside sampling			time			string			{float}		time	hour
samp_weather	sampling day weather	MIXS:0000827		The weather on the sampling day	{'value': 'foggy'}		day|weather			SampWeatherEnum						
season	season	MIXS:0000829		The season when sampling occurred. Any of the four periods into which the year is divided by the equinoxes and solstices. This field accepts terms listed under season (http://purl.obolibrary.org/obo/NCIT_C94729)	{'value': 'autumn [NCIT:C94733]'}		season			SeasonEnum						
season_use	seasonal use	MIXS:0000830		The seasons the space is occupied	{'value': 'Winter'}		season|use			SeasonUseEnum						
shad_dev_water_mold	shading device signs of water/mold	MIXS:0000834		Signs of the presence of mold or mildew on the shading device	{'value': 'no presence of mold visible'}		device			MoldVisibilityEnum						
shading_device_cond	shading device condition	MIXS:0000831		The physical condition of the shading device at the time of sampling	{'value': 'new'}		condition|device			DamagedRupturedEnum						
