name	title	slot_uri	comments	description	examples	in_subset	keywords	multivalued	pattern	range	recommended	required	string_serialization	structured_pattern	Expected_value	Preferred_unit
alkalinity	alkalinity	MIXS:0000421		Alkalinity, the ability of a solution to neutralize acids to the equivalence point of carbonate or bicarbonate	{'value': '50 milligram per liter'}		alkalinity		^[-+]?[0-9]*\.?[0-9]+(?:[eE][-+]?[0-9]+)?( *- *[-+]?[0-9]*\.?[0-9]+(?:[eE][-+]?[0-9]+)?)? *([^\s-]{1,2}|[^\s-]+.+[^\s-]+)$	string				{'syntax': '^{scientific_float}( *- *{scientific_float})? *{text}$', 'interpolated': True, 'partial_match': True}		milliequivalent per liter, milligram per liter
biochem_oxygen_dem	biochemical oxygen demand	MIXS:0000653		Amount of dissolved oxygen needed by aerobic biological organisms in a body of water to break down organic material present in a given water sample at certain temperature over a specific time period			oxygen		^[-+]?[0-9]*\.?[0-9]+(?:[eE][-+]?[0-9]+)?( *- *[-+]?[0-9]*\.?[0-9]+(?:[eE][-+]?[0-9]+)?)? *([^\s-]{1,2}|[^\s-]+.+[^\s-]+)$	string				{'syntax': '^{scientific_float}( *- *{scientific_float})? *{text}$', 'interpolated': True, 'partial_match': True}		milligram per liter
chem_administration	chemical administration	MIXS:0000751		List of chemical compounds administered to the host or site where sampling occurred, and when (e.g. Antibiotics, n fertilizer, air filter); can include multiple compounds. For chemical entities of biological interest ontology (chebi) (v 163), http://purl.bioontology.org/ontology/chebi	{'value': 'agar [CHEBI:2509];2018-05-11T20:00Z'}		administration	True		string			{termLabel} [{termID}];{timestamp}		CHEBI;timestamp	
chem_oxygen_dem	chemical oxygen demand	MIXS:0000656		A measure of the capacity of water to consume oxygen during the decomposition of organic matter and the oxidation of inorganic chemicals such as ammonia and nitrite			oxygen		^[-+]?[0-9]*\.?[0-9]+(?:[eE][-+]?[0-9]+)?( *- *[-+]?[0-9]*\.?[0-9]+(?:[eE][-+]?[0-9]+)?)? *([^\s-]{1,2}|[^\s-]+.+[^\s-]+)$	string				{'syntax': '^{scientific_float}( *- *{scientific_float})? *{text}$', 'interpolated': True, 'partial_match': True}		milligram per liter
depth	depth	MIXS:0000018		The vertical distance below local surface. For sediment or soil samples depth is measured from sediment or soil surface, respectively. Depth can be reported as an interval for subsurface samples	{'value': '10 meter'}	environment	depth		^[-+]?[0-9]*\.?[0-9]+(?:[eE][-+]?[0-9]+)?( *- *[-+]?[0-9]*\.?[0-9]+(?:[eE][-+]?[0-9]+)?)? *([^\s-]{1,2}|[^\s-]+.+[^\s-]+)$	string	True			{'syntax': '^{scientific_float}( *- *{scientific_float})? *{text}$', 'interpolated': True, 'partial_match': True}		meter
efficiency_percent	efficiency percent	MIXS:0000657		Percentage of volatile solids removed from the anaerobic digestor			percent		^[-+]?[0-9]*\.?[0-9]+(?:[eE][-+]?[0-9]+)?( *- *[-+]?[0-9]*\.?[0-9]+(?:[eE][-+]?[0-9]+)?)? *([^\s-]{1,2}|[^\s-]+.+[^\s-]+)$	string				{'syntax': '^{scientific_float}( *- *{scientific_float})? *{text}$', 'interpolated': True, 'partial_match': True}		micromole per liter
emulsions	emulsions	MIXS:0000660		Amount or concentration of substances such as paints, adhesives, mayonnaise, hair colorants, emulsified oils, etc.; can include multiple emulsion types				True		string			{text};{float} {unit}		emulsion name;measurement value	gram per liter
gaseous_substances	gaseous substances	MIXS:0000661		Amount or concentration of substances such as hydrogen sulfide, carbon dioxide, methane, etc.; can include multiple substances				True		string			{text};{float} {unit}		gaseous substance name;measurement value	micromole per liter
indust_eff_percent	industrial effluent percent	MIXS:0000662		Percentage of industrial effluents received by wastewater treatment plant			percent		^[-+]?[0-9]*\.?[0-9]+(?:[eE][-+]?[0-9]+)?( *- *[-+]?[0-9]*\.?[0-9]+(?:[eE][-+]?[0-9]+)?)? *([^\s-]{1,2}|[^\s-]+.+[^\s-]+)$	string				{'syntax': '^{scientific_float}( *- *{scientific_float})? *{text}$', 'interpolated': True, 'partial_match': True}		percentage
inorg_particles	inorganic particles	MIXS:0000664		Concentration of particles such as sand, grit, metal particles, ceramics, etc.; can include multiple particles			inorganic|particle	True		string			{text};{float} {unit}		inorganic particle name;measurement value	mole per liter, milligram per liter
misc_param	miscellaneous parameter	MIXS:0000752		Any other measurement performed or parameter collected, that is not listed here	{'value': 'Bicarbonate ion concentration;2075 micromole per kilogram'}		parameter	True		string			{text};{float} {unit}		parameter name;measurement value	
nitrate	nitrate	MIXS:0000425		Concentration of nitrate in the sample	{'value': '65 micromole per liter'}		nitrate		^[-+]?[0-9]*\.?[0-9]+(?:[eE][-+]?[0-9]+)?( *- *[-+]?[0-9]*\.?[0-9]+(?:[eE][-+]?[0-9]+)?)? *([^\s-]{1,2}|[^\s-]+.+[^\s-]+)$	string				{'syntax': '^{scientific_float}( *- *{scientific_float})? *{text}$', 'interpolated': True, 'partial_match': True}		micromole per liter, milligram per liter, parts per million
org_particles	organic particles	MIXS:0000665		Concentration of particles such as faeces, hairs, food, vomit, paper fibers, plant material, humus, etc			organic|particle	True		string			{text};{float} {unit}		particle name;measurement value	gram per liter
organism_count	organism count	MIXS:0000103		Total cell count of any organism (or group of organisms) per gram, volume or area of sample, should include name of organism followed by count. The method that was used for the enumeration (e.g. qPCR, atp, mpn, etc.) Should also be provided. (example: total prokaryotes; 3.5e7 cells per ml; qpcr)	{'value': 'total prokaryotes;3.5e7 cells per milliliter;qPCR'}		count|organism	True		string			{text};{float} {unit};[ATP|MPN|qPCR|other]		organism name;measurement value;enumeration	
oxy_stat_samp	oxygenation status of sample	MIXS:0000753		Oxygenation status of sample	{'value': 'aerobic'}		oxygen|sample|status			OxyStatSampEnum						
perturbation	perturbation	MIXS:0000754		Type of perturbation, e.g. chemical administration, physical disturbance, etc., coupled with perturbation regimen including how many times the perturbation was repeated, how long each perturbation lasted, and the start and end time of the entire perturbation period; can include multiple perturbation types	{'value': 'antibiotic addition;R2/2018-05-11T14:30Z/2018-05-11T19:30Z/P1H30M'}		perturbation	True		string			{text};{Rn/start_time/end_time/duration}		perturbation type name;perturbation interval and duration	
ph	pH	MIXS:0001001		Ph measurement of the sample, or liquid portion of sample, or aqueous phase of the fluid	{'value': '7.2'}		ph			float						
phosphate	phosphate	MIXS:0000505		Concentration of phosphate	{'value': '0.7 micromole per liter'}		phosphate		^[-+]?[0-9]*\.?[0-9]+(?:[eE][-+]?[0-9]+)?( *- *[-+]?[0-9]*\.?[0-9]+(?:[eE][-+]?[0-9]+)?)? *([^\s-]{1,2}|[^\s-]+.+[^\s-]+)$	string				{'syntax': '^{scientific_float}( *- *{scientific_float})? *{text}$', 'interpolated': True, 'partial_match': True}		micromole per liter
pre_treatment	pre-treatment	MIXS:0000348		The process of pre-treatment removes materials that can be easily collected from the raw wastewater						string			{text}		pre-treatment type	
primary_treatment	primary treatment	MIXS:0000349		The process to produce both a generally homogeneous liquid capable of being treated biologically and a sludge that can be separately treated or processed			primary|treatment			string			{text}		primary treatment type	
project_name	project name	MIXS:0000092		Name of the project within which the sequencing was organized	{'value': 'Forest soil metagenome'}	investigation	project			string		True				
reactor_type	reactor type	MIXS:0000350		Anaerobic digesters can be designed and engineered to operate using a number of different process configurations, as batch or continuous, mesophilic, high solid or low solid, and single stage or multistage			type			string			{text}		reactor type name	
salinity	salinity	MIXS:0000183		The total concentration of all dissolved salts in a liquid or solid sample. While salinity can be measured by a complete chemical analysis, this method is difficult and time consuming. More often, it is instead derived from the conductivity measurement. This is known as practical salinity. These derivations compare the specific conductance of the sample to a salinity standard such as seawater	{'value': '25 practical salinity unit'}		salinity		^[-+]?[0-9]*\.?[0-9]+(?:[eE][-+]?[0-9]+)?( *- *[-+]?[0-9]*\.?[0-9]+(?:[eE][-+]?[0-9]+)?)? *([^\s-]{1,2}|[^\s-]+.+[^\s-]+)$	string				{'syntax': '^{scientific_float}( *- *{scientific_float})? *{text}$', 'interpolated': True, 'partial_match': True}		practical salinity unit, percentage
samp_name	sample name	MIXS:0001107		A local identifier or name that for the material sample used for extracting nucleic acids, and subsequent sequencing. It can refer either to the original material collected or to any derived sub-samples. It can have any format, but we suggest that you make it concise, unique and consistent within your lab, and as informative as possible. INSDC requires every sample name from a single Submitter to be unique. Use of a globally unique identifier for the field source_mat_id is recommended in addition to sample_name	{'value': 'ISDsoil1'}	investigation	sample			string		True				
samp_store_dur	sample storage duration	MIXS:0000116		Duration for which the sample was stored. Indicate the duration for which the sample was stored written in ISO 8601 format	{'value': 'P1Y6M'}		duration|period|sample|storage		^P(?:(?:\d+D|\d+M(?:\d+D)?|\d+Y(?:\d+M(?:\d+D)?)?)(?:T(?:\d+H(?:\d+M(?:\d+S)?)?|\d+M(?:\d+S)?|\d+S))?|T(?:\d+H(?:\d+M(?:\d+S)?)?|\d+M(?:\d+S)?|\d+S)|\d+W)$	string				{'syntax': '^{duration}$', 'interpolated': True, 'partial_match': True}		
samp_store_loc	sample storage location	MIXS:0000755		Location at which sample was stored, usually name of a specific freezer/room	{'value': 'Freezer no:5'}		location|sample|storage			string			{text}		location name	
samp_store_temp	sample storage temperature	MIXS:0000110		Temperature at which sample was stored, e.g. -80 degree Celsius	{'value': '-80 degree Celsius'}		sample|storage|temperature		^[-+]?[0-9]*\.?[0-9]+(?:[eE][-+]?[0-9]+)?( *- *[-+]?[0-9]*\.?[0-9]+(?:[eE][-+]?[0-9]+)?)? *([^\s-]{1,2}|[^\s-]+.+[^\s-]+)$	string				{'syntax': '^{scientific_float}( *- *{scientific_float})? *{text}$', 'interpolated': True, 'partial_match': True}		degree Celsius
samp_vol_we_dna_ext	sample volume or weight for DNA extraction	MIXS:0000111		Volume (ml) or mass (g) of total collected sample processed for DNA extraction. Note: total sample collected should be entered under the term Sample Size (MIXS:0000001)	{'value': '1500 milliliter'}	nucleic acid sequence source	dna|sample|volume|weight		^[-+]?[0-9]*\.?[0-9]+(?:[eE][-+]?[0-9]+)?( *- *[-+]?[0-9]*\.?[0-9]+(?:[eE][-+]?[0-9]+)?)? *([^\s-]{1,2}|[^\s-]+.+[^\s-]+)$	string				{'syntax': '^{scientific_float}( *- *{scientific_float})? *{text}$', 'interpolated': True, 'partial_match': True}		milliliter, gram, milligram, square centimeter
secondary_treatment	secondary treatment	MIXS:0000351		The process for substantially degrading the biological content of the sewage			secondary|treatment			string			{text}		secondary treatment type	
sewage_type	sewage type	MIXS:0000215		Type of wastewater treatment plant as municipial or industrial			type			string			{text}		sewage type name	
sludge_retent_time	sludge retention time	MIXS:0000669		The time activated sludge remains in reactor			time		^[-+]?[0-9]*\.?[0-9]+(?:[eE][-+]?[0-9]+)?( *- *[-+]?[0-9]*\.?[0-9]+(?:[eE][-+]?[0-9]+)?)? *([^\s-]{1,2}|[^\s-]+.+[^\s-]+)$	string				{'syntax': '^{scientific_float}( *- *{scientific_float})? *{text}$', 'interpolated': True, 'partial_match': True}		hours
sodium	sodium	MIXS:0000428		Sodium concentration in the sample	{'value': '10.5 milligram per liter'}				^[-+]?[0-9]*\.?[0-9]+(?:[eE][-+]?[0-9]+)?( *- *[-+]?[0-9]*\.?[0-9]+(?:[eE][-+]?[0-9]+)?)? *([^\s-]{1,2}|[^\s-]+.+[^\s-]+)$	string				{'syntax': '^{scientific_float}( *- *{scientific_float})? *{text}$', 'interpolated': True, 'partial_match': True}		milligram per liter, parts per million
soluble_inorg_mat	soluble inorganic material	MIXS:0000672		Concentration of substances such as ammonia, road-salt, sea-salt, cyanide, hydrogen sulfide, thiocyanates, thiosulfates, etc			inorganic|material|soluble	True		string			{text};{float} {unit}		soluble inorganic material name;measurement value	gram, microgram, mole per liter, gram per liter, parts per million
soluble_org_mat	soluble organic material	MIXS:0000673		Concentration of substances such as urea, fruit sugars, soluble proteins, drugs, pharmaceuticals, etc			material|organic|soluble	True		string			{text};{float} {unit}		soluble organic material name;measurement value	gram, microgram, mole per liter, gram per liter, parts per million
suspend_solids	suspended solids	MIXS:0000150		Concentration of substances including a wide variety of material, such as silt, decaying plant and animal matter; can include multiple substances			solids|suspended	True		string			{text};{float} {unit}		suspended solid name;measurement value	gram, microgram, milligram per liter, mole per liter, gram per liter, part per million
temp	temperature	MIXS:0000113		Temperature of the sample at the time of sampling	{'value': '25 degree Celsius'}	environment	temperature		^[-+]?[0-9]*\.?[0-9]+(?:[eE][-+]?[0-9]+)?( *- *[-+]?[0-9]*\.?[0-9]+(?:[eE][-+]?[0-9]+)?)? *([^\s-]{1,2}|[^\s-]+.+[^\s-]+)$	string				{'syntax': '^{scientific_float}( *- *{scientific_float})? *{text}$', 'interpolated': True, 'partial_match': True}		degree Celsius
tertiary_treatment	tertiary treatment	MIXS:0000352		The process providing a final treatment stage to raise the effluent quality before it is discharged to the receiving environment			treatment			string			{text}		tertiary treatment type	
tot_nitro	total nitrogen concentration	MIXS:0000102		Total nitrogen concentration of water samples, calculated by: total nitrogen = total dissolved nitrogen + particulate nitrogen. Can also be measured without filtering, reported as nitrogen	{'value': '50 micromole per liter'}		concentration|nitrogen|total		^[-+]?[0-9]*\.?[0-9]+(?:[eE][-+]?[0-9]+)?( *- *[-+]?[0-9]*\.?[0-9]+(?:[eE][-+]?[0-9]+)?)? *([^\s-]{1,2}|[^\s-]+.+[^\s-]+)$	string				{'syntax': '^{scientific_float}( *- *{scientific_float})? *{text}$', 'interpolated': True, 'partial_match': True}		microgram per liter, micromole per liter, milligram per liter
tot_phosphate	total phosphate	MIXS:0000689		Total amount or concentration of phosphate			phosphate|total		^[-+]?[0-9]*\.?[0-9]+(?:[eE][-+]?[0-9]+)?( *- *[-+]?[0-9]*\.?[0-9]+(?:[eE][-+]?[0-9]+)?)? *([^\s-]{1,2}|[^\s-]+.+[^\s-]+)$	string				{'syntax': '^{scientific_float}( *- *{scientific_float})? *{text}$', 'interpolated': True, 'partial_match': True}		microgram per liter, micromole per liter
wastewater_type	wastewater type	MIXS:0000353		The origin of wastewater such as human waste, rainfall, storm drains, etc			type			string			{text}		wastewater type name	
