name	title	slot_uri	comments	description	examples	in_subset	keywords	multivalued	pattern	range	recommended	required	string_serialization	structured_pattern	Expected_value	Preferred_unit
route_transmission	route of transmission	MIXS:0001316		Description of path taken by the symbiotic host organism being sampled in order to establish a symbiotic relationship with the host (with which it was observed at the time of sampling) via a mode of transmission (specified in mode_transmission)			route			RouteTransmissionEnum						
salinity	salinity	MIXS:0000183		The total concentration of all dissolved salts in a liquid or solid sample. While salinity can be measured by a complete chemical analysis, this method is difficult and time consuming. More often, it is instead derived from the conductivity measurement. This is known as practical salinity. These derivations compare the specific conductance of the sample to a salinity standard such as seawater	{'value': '25 practical salinity unit'}		salinity		^[-+]?[0-9]*\.?[0-9]+(?:[eE][-+]?[0-9]+)?( *- *[-+]?[0-9]*\.?[0-9]+(?:[eE][-+]?[0-9]+)?)? *([^\s-]{1,2}|[^\s-]+.+[^\s-]+)$	string				{'syntax': '^{scientific_float}( *- *{scientific_float})? *{text}$', 'interpolated': True, 'partial_match': True}		practical salinity unit, percentage
samp_collect_device	sample collection device	MIXS:0000002		The device used to collect an environmental sample. This field accepts terms listed under environmental sampling device (http://purl.obolibrary.org/obo/ENVO). This field also accepts terms listed under specimen collection device (http://purl.obolibrary.org/obo/GENEPIO_0002094)	{'value': 'swab, biopsy, niskin bottle, push core, drag swab [GENEPIO:0002713]'}					string			{termLabel} [{termID}]|{text}			
samp_collect_method	sample collection method	MIXS:0001225		The method employed for collecting the sample	{'value': 'swabbing'}				^^PMID:\d+$|^doi:10.\d{2,9}/.*$|^https?:\/\/(?:www\.)?[-a-zA-Z0-9@:%._\+~#=]{1,256}\.[a-zA-Z0-9()]{1,6}\b(?:[-a-zA-Z0-9()@:%_\+.~#?&\/=]*)$|([^\s-]{1,2}|[^\s-]+.+[^\s-]+)$	string				{'syntax': '^{PMID}|{DOI}|{URL}|{text}$', 'interpolated': True, 'partial_match': True}		
samp_mat_process	sample material processing	MIXS:0000016		A brief description of any processing applied to the sample during or after retrieving the sample from environment, or a link to the relevant protocol(s) performed						string	True					
samp_name	sample name	MIXS:0001107		A local identifier or name that for the material sample used for extracting nucleic acids, and subsequent sequencing. It can refer either to the original material collected or to any derived sub-samples. It can have any format, but we suggest that you make it concise, unique and consistent within your lab, and as informative as possible. INSDC requires every sample name from a single Submitter to be unique. Use of a globally unique identifier for the field source_mat_id is recommended in addition to sample_name	{'value': 'ISDsoil1'}	investigation	sample			string		True				
samp_size	amount or size of sample collected	MIXS:0000001		The total amount or size (volume (ml), mass (g) or area (m2) ) of sample collected	{'value': '5 liter'}	nucleic acid sequence source	sample|size		^[-+]?[0-9]*\.?[0-9]+(?:[eE][-+]?[0-9]+)?( *- *[-+]?[0-9]*\.?[0-9]+(?:[eE][-+]?[0-9]+)?)? *([^\s-]{1,2}|[^\s-]+.+[^\s-]+)$	string				{'syntax': '^{scientific_float}( *- *{scientific_float})? *{text}$', 'interpolated': True, 'partial_match': True}		
samp_store_dur	sample storage duration	MIXS:0000116		Duration for which the sample was stored. Indicate the duration for which the sample was stored written in ISO 8601 format	{'value': 'P1Y6M'}		duration|period|sample|storage		^P(?:(?:\d+D|\d+M(?:\d+D)?|\d+Y(?:\d+M(?:\d+D)?)?)(?:T(?:\d+H(?:\d+M(?:\d+S)?)?|\d+M(?:\d+S)?|\d+S))?|T(?:\d+H(?:\d+M(?:\d+S)?)?|\d+M(?:\d+S)?|\d+S)|\d+W)$	string				{'syntax': '^{duration}$', 'interpolated': True, 'partial_match': True}		
samp_store_loc	sample storage location	MIXS:0000755		Location at which sample was stored, usually name of a specific freezer/room	{'value': 'Freezer no:5'}		location|sample|storage			string			{text}		location name	
samp_store_sol	sample storage solution	MIXS:0001317		Solution within which sample was stored, if any	{'value': '5% ethanol'}		sample|storage			string			{text}		solution name	
samp_store_temp	sample storage temperature	MIXS:0000110		Temperature at which sample was stored, e.g. -80 degree Celsius	{'value': '-80 degree Celsius'}		sample|storage|temperature		^[-+]?[0-9]*\.?[0-9]+(?:[eE][-+]?[0-9]+)?( *- *[-+]?[0-9]*\.?[0-9]+(?:[eE][-+]?[0-9]+)?)? *([^\s-]{1,2}|[^\s-]+.+[^\s-]+)$	string				{'syntax': '^{scientific_float}( *- *{scientific_float})? *{text}$', 'interpolated': True, 'partial_match': True}		degree Celsius
samp_taxon_id	taxonomy ID of DNA sample	MIXS:0001320		NCBI taxon id of the sample.  Maybe be a single taxon or mixed taxa sample. Use 'synthetic metagenome  for mock community/positive controls, or 'blank sample' for negative controls	{'value': 'Gut Metagenome [NCBITaxon:749906]'}	investigation	dna|identifier|sample|taxon		^([^\s-]{1,2}|[^\s-]+.+[^\s-]+) \[NCBITaxon:\d+\]$	string		True		{'syntax': '^{text} \\[{NCBItaxon_id}\\]$', 'interpolated': True, 'partial_match': True}		
samp_vol_we_dna_ext	sample volume or weight for DNA extraction	MIXS:0000111		Volume (ml) or mass (g) of total collected sample processed for DNA extraction. Note: total sample collected should be entered under the term Sample Size (MIXS:0000001)	{'value': '1500 milliliter'}	nucleic acid sequence source	dna|sample|volume|weight		^[-+]?[0-9]*\.?[0-9]+(?:[eE][-+]?[0-9]+)?( *- *[-+]?[0-9]*\.?[0-9]+(?:[eE][-+]?[0-9]+)?)? *([^\s-]{1,2}|[^\s-]+.+[^\s-]+)$	string				{'syntax': '^{scientific_float}( *- *{scientific_float})? *{text}$', 'interpolated': True, 'partial_match': True}		milliliter, gram, milligram, square centimeter
seq_meth	sequencing method	MIXS:0000050		Sequencing machine used. Where possible the term should be taken from the OBI list of DNA sequencers (http://purl.obolibrary.org/obo/OBI_0400103)	{'value': '454 Genome Sequencer FLX [OBI:0000702]'}	sequencing	method		^([^\s-]{1,2}|[^\s-]+.+[^\s-]+)|(([^\s-]{1,2}|[^\s-]+.+[^\s-]+) \[[a-zA-Z]{2,}:[a-zA-Z0-9]\d+\])$	string		True		{'syntax': '^{text}|({termLabel} \\[{termID}\\])$', 'interpolated': True, 'partial_match': True}		
seq_quality_check	sequence quality check	MIXS:0000051		Indicate if the sequence has been called by automatic systems (none) or undergone a manual editing procedure (e.g. by inspecting the raw data or chromatograms). Applied only for sequences that are not submitted to SRA,ENA or DRA						SeqQualityCheckEnum	True					
sop	relevant standard operating procedures	MIXS:0000090		Standard operating procedures used in assembly and/or annotation of genomes, metagenomes or environmental sequences				True		string	True		{PMID}|{DOI}|{URL}			
source_mat_id	source material identifiers	MIXS:0000026		A unique identifier assigned to a material sample (as defined by http://rs.tdwg.org/dwc/terms/materialSampleID, and as opposed to a particular digital record of a material sample) used for extracting nucleic acids, and subsequent sequencing. The identifier can refer either to the original material collected or to any derived sub-samples. The INSDC qualifiers /specimen_voucher, /bio_material, or /culture_collection may or may not share the same value as the source_mat_id field. For instance, the /specimen_voucher qualifier and source_mat_id may both contain 'UAM:Herps:14' , referring to both the specimen voucher and sampled tissue with the same identifier. However, the /culture_collection qualifier may refer to a value from an initial culture (e.g. ATCC:11775) while source_mat_id would refer to an identifier from some derived culture from which the nucleic acids were extracted (e.g. xatc123 or ark:/2154/R2)				True		string	True		{text}			
subspecf_gen_lin	subspecific genetic lineage	MIXS:0000020		Information about the genetic distinctness of the sequenced organism below the subspecies level, e.g., serovar, serotype, biotype, ecotype, or any relevant genetic typing schemes like Group I plasmid. Subspecies should not be recorded in this term, but in the NCBI taxonomy. Supply both the lineage name and the lineage rank separated by a colon, e.g., biovar:abc123						string	True		{rank name}:{text}			
sym_life_cycle_type	symbiotic host organism life cycle type	MIXS:0001300		Type of life cycle of the symbiotic host species (the thing being sampled). Simple life cycles occur within a single host, complex ones within multiple different hosts over the course of their normal life cycle	{'value': 'complex life cycle'}		host|host.|life|organism|symbiosis|type			SymLifeCycleTypeEnum		True			type of life cycle of the symbiotic organism (host of the samples)	
symbiont_host_role	host of the symbiont role	MIXS:0001303		Role of the host in the life cycle of the symbiotic organism	{'value': 'intermediate'}		host|host.|symbiosis			SymbiontHostRoleEnum	True					
target_gene	target gene	MIXS:0000044		Targeted gene or locus name for marker gene studies						string		True				
target_subfragment	target subfragment	MIXS:0000045		Name of subfragment of a gene or locus. Important to e.g. identify special regions on marker genes like V6 on 16S rRNA						string	True					
temp	temperature	MIXS:0000113		Temperature of the sample at the time of sampling					^[-+]?[0-9]*\.?[0-9]+(?:[eE][-+]?[0-9]+)?( *- *[-+]?[0-9]*\.?[0-9]+(?:[eE][-+]?[0-9]+)?)? *([^\s-]{1,2}|[^\s-]+.+[^\s-]+)$	string	True			{'syntax': '^{scientific_float}( *- *{scientific_float})? *{text}$', 'interpolated': True, 'partial_match': True}		
trophic_level	trophic level	MIXS:0000032		Trophic levels are the feeding position in a food chain. Microbes can be a range of producers (e.g. chemolithotroph)						TrophicLevelEnum	True					
type_of_symbiosis	type of symbiosis	MIXS:0001307		Type of biological interaction established between the symbiotic host organism being sampled and its respective host	{'value': 'parasitic'}		symbiosis|type			TypeOfSymbiosisEnum	True					
urobiom_sex	host sex	MIXS:0000862		Physical sex of the host			host|host.			UrobiomSexEnum					sex of the symbiotic organism (host of the samples); enumeration	
