name	title	slot_uri	comments	description	examples	in_subset	keywords	multivalued	pattern	range	recommended	required	string_serialization	structured_pattern	Expected_value	Preferred_unit
alt	altitude	MIXS:0000094		Heights of objects such as airplanes, space shuttles, rockets, atmospheric balloons and heights of places such as atmospheric layers and clouds. It is used to measure the height of an object which is above the earth's surface. In this context, the altitude measurement is the vertical distance between the earth's surface above sea level and the sampled position in the air	{'value': '100 meter'}	environment			^[-+]?[0-9]*\.?[0-9]+(?:[eE][-+]?[0-9]+)?( *- *[-+]?[0-9]*\.?[0-9]+(?:[eE][-+]?[0-9]+)?)? *([^\s-]{1,2}|[^\s-]+.+[^\s-]+)$	string	True			{'syntax': '^{scientific_float}( *- *{scientific_float})? *{text}$', 'interpolated': True, 'partial_match': True}		meter
associated_resource	relevant electronic resources	MIXS:0000091		A related resource that is referenced, cited, or otherwise associated to the sequence	{'value': 'http://www.earthmicrobiome.org/'}	sequencing	resource	True		string	True		{PMID}|{DOI}|{URL}		reference to resource	
biotic_relationship	observed biotic relationship	MIXS:0000028		Description of relationship(s) between the subject organism and other organism(s) it is associated with. E.g., parasite on species X; mutualist with species Y. The target organism is the subject of the relationship, and the other organism(s) is the object	{'value': 'free living'}	nucleic acid sequence source	observed|relationship			BioticRelationshipEnum	True					
chimera_check	chimera check software	MIXS:0000052		Tool(s) used for chimera checking, including version number and parameters, to discover and remove chimeric sequences. A chimeric sequence is comprised of two or more phylogenetically distinct parent sequences	{'value': 'uchime;v4.1;default parameters'}	sequencing	software		^([^\s-]{1,2}|[^\s-]+.+[^\s-]+);([^\s-]{1,2}|[^\s-]+.+[^\s-]+);([^\s-]{1,2}|[^\s-]+.+[^\s-]+)$	string	True			{'syntax': '^{software};{version};{parameters}$', 'interpolated': True, 'partial_match': True}		
collection_date	collection date	MIXS:0000011		The time of sampling, either as an instance (single point in time) or interval. In case no exact time is available, the date/time can be right truncated i.e. all of these are valid times: 2008-01-23T19:23:10+00:00; 2008-01-23T19:23:10; 2008-01-23; 2008-01; 2008; Except: 2008-01; 2008 all are ISO8601 compliant	{'value': '2013-03-25T12:42:31+01:00'}	environment	date			datetime		True				
depth	depth	MIXS:0000018		The vertical distance below local surface. For sediment or soil samples depth is measured from sediment or soil surface, respectively. Depth can be reported as an interval for subsurface samples	{'value': '10 meter'}	environment	depth		^[-+]?[0-9]*\.?[0-9]+(?:[eE][-+]?[0-9]+)?( *- *[-+]?[0-9]*\.?[0-9]+(?:[eE][-+]?[0-9]+)?)? *([^\s-]{1,2}|[^\s-]+.+[^\s-]+)$	string	True			{'syntax': '^{scientific_float}( *- *{scientific_float})? *{text}$', 'interpolated': True, 'partial_match': True}		meter
elev	elevation	MIXS:0000093		Elevation of the sampling site is its height above a fixed reference point, most commonly the mean sea level. Elevation is mainly used when referring to points on the earth's surface, while altitude is used for points above the surface, such as an aircraft in flight or a spacecraft in orbit	{'value': '100 meter'}	environment	elevation		^[-+]?[0-9]*\.?[0-9]+(?:[eE][-+]?[0-9]+)?( *- *[-+]?[0-9]*\.?[0-9]+(?:[eE][-+]?[0-9]+)?)? *([^\s-]{1,2}|[^\s-]+.+[^\s-]+)$	string	True			{'syntax': '^{scientific_float}( *- *{scientific_float})? *{text}$', 'interpolated': True, 'partial_match': True}		meter
env_broad_scale	broad-scale environmental context	MIXS:0000012		Report the major environmental system the sample or specimen came from. The system(s) identified should have a coarse spatial grain, to provide the general environmental context of where the sampling was done (e.g. in the desert or a rainforest). We recommend using subclasses of EnvO s biome class:  http://purl.obolibrary.org/obo/ENVO_00000428. EnvO documentation about how to use the field: https://github.com/EnvironmentOntology/envo/wiki/Using-ENVO-with-MIxS	{'value': 'rangeland biome [ENVO:01000247]'}	environment	context|environmental		^([^\s-]{1,2}|[^\s-]+.+[^\s-]+) \[[a-zA-Z]{2,}:[a-zA-Z0-9]\d+\]$	string		True		{'syntax': '^{termLabel} \\[{termID}\\]$', 'interpolated': True, 'partial_match': True}		
env_local_scale	local environmental context	MIXS:0000013		Report the entity or entities which are in the sample or specimen s local vicinity and which you believe have significant causal influences on your sample or specimen. We recommend using EnvO terms which are of smaller spatial grain than your entry for env_broad_scale. Terms, such as anatomical sites, from other OBO Library ontologies which interoperate with EnvO (e.g. UBERON) are accepted in this field. EnvO documentation about how to use the field: https://github.com/EnvironmentOntology/envo/wiki/Using-ENVO-with-MIxS	{'value': 'hillside [ENVO:01000333]'}	environment	context|environmental			string		True	{termLabel} [{termID}]		Environmental entities having causal influences upon the entity at time of sampling	
env_medium	environmental medium	MIXS:0000014		Report the environmental material(s) immediately surrounding the sample or specimen at the time of sampling. We recommend using subclasses of 'environmental material' (http://purl.obolibrary.org/obo/ENVO_00010483). EnvO documentation about how to use the field: https://github.com/EnvironmentOntology/envo/wiki/Using-ENVO-with-MIxS . Terms from other OBO ontologies are permissible as long as they reference mass/volume nouns (e.g. air, water, blood) and not discrete, countable entities (e.g. a tree, a leaf, a table top)	{'value': 'bluegrass field soil [ENVO:00005789]'}	environment	environmental		^([^\s-]{1,2}|[^\s-]+.+[^\s-]+) \[[a-zA-Z]{2,}:[a-zA-Z0-9]\d+\]$	string		True		{'syntax': '^{termLabel} \\[{termID}\\]$', 'interpolated': True, 'partial_match': True}		
experimental_factor	experimental factor	MIXS:0000008		Variable aspects of an experiment design that can be used to describe an experiment, or set of experiments, in an increasingly detailed manner. This field accepts ontology terms from Experimental Factor Ontology (EFO) and/or Ontology for Biomedical Investigations (OBI)	{'value': 'time series design [EFO:0001779]'}	investigation	experimental|factor	True	^\S+.*\S+ \[[a-zA-Z]{2,}:\d+\]$	string			{termLabel} [{termID}]|{text}		text or EFO and/or OBI	
extrachrom_elements	extrachromosomal elements	MIXS:0000023		Do plasmids exist of significant phenotypic consequence (e.g. ones that determine virulence or antibiotic resistance). Megaplasmids? Other plasmids (borrelia has 15+ plasmids)	{'value': '5'}	nucleic acid sequence source				integer						
geo_loc_name	geographic location (country and/or sea,region)	MIXS:0000010		The geographical origin of the sample as defined by the country or sea name followed by specific region name. Country or sea names should be chosen from the INSDC country list (http://insdc.org/country.html), or the GAZ ontology (http://purl.bioontology.org/ontology/GAZ)	{'value': 'USA: Maryland, Bethesda'}	environment	geographic|location		^([^\s-]{1,2}|[^\s-]+.+[^\s-]+): ([^\s-]{1,2}|[^\s-]+.+[^\s-]+), ([^\s-]{1,2}|[^\s-]+.+[^\s-]+)$	string		True		{'syntax': '^{text}: {text}, {text}$', 'interpolated': True, 'partial_match': True}		
isol_growth_condt	isolation and growth condition	MIXS:0000003		Publication reference in the form of pubmed ID (pmid), digital object identifier (doi) or url for isolation and growth condition specifications of the organism/material	{'value': 'doi:10.1016/j.syapm.2018.01.009'}	nucleic acid sequence source	condition|growth|isolation		^^PMID:\d+$|^doi:10.\d{2,9}/.*$|^https?:\/\/(?:www\.)?[-a-zA-Z0-9@:%._\+~#=]{1,256}\.[a-zA-Z0-9()]{1,6}\b(?:[-a-zA-Z0-9()@:%_\+.~#?&\/=]*)$$	string		True		{'syntax': '^{PMID}|{DOI}|{URL}$', 'interpolated': True, 'partial_match': True}		
lat_lon	geographic location (latitude and longitude)	MIXS:0000009		The geographical origin of the sample as defined by latitude and longitude. The values should be reported in decimal degrees and in WGS84 system	{'value': '50.586825 6.408977'}	environment	geographic|location		^(-?((?:[0-8]?[0-9](?:\.\d{0,8})?)|90)) -?[0-9]+(?:\.[0-9]{0,8})?$|^-?(1[0-7]{1,2})$	string		True	{float} {float}	{'syntax': '^{lat} {lon}$', 'interpolated': True, 'partial_match': True}	decimal degrees,  limit to 8 decimal points	
neg_cont_type	negative control type	MIXS:0001321		The substance or equipment used as a negative control in an investigation		investigation	type			NegContTypeEnum	True				enumeration or text	
nucl_acid_amp	nucleic acid amplification	MIXS:0000038		A link to a literature reference, electronic resource or a standard operating procedure (SOP), that describes the enzymatic amplification (PCR, TMA, NASBA) of specific nucleic acids	{'value': 'https://phylogenomics.me/protocols/16s-pcr-protocol/'}	sequencing			^^PMID:\d+$|^doi:10.\d{2,9}/.*$|^https?:\/\/(?:www\.)?[-a-zA-Z0-9@:%._\+~#=]{1,256}\.[a-zA-Z0-9()]{1,6}\b(?:[-a-zA-Z0-9()@:%_\+.~#?&\/=]*)$$	string	True			{'syntax': '^{PMID}|{DOI}|{URL}$', 'interpolated': True, 'partial_match': True}		
nucl_acid_ext	nucleic acid extraction	MIXS:0000037		A link to a literature reference, electronic resource or a standard operating procedure (SOP), that describes the material separation to recover the nucleic acid fraction from a sample	{'value': 'https://mobio.com/media/wysiwyg/pdfs/protocols/12888.pdf'}	sequencing			^^PMID:\d+$|^doi:10.\d{2,9}/.*$|^https?:\/\/(?:www\.)?[-a-zA-Z0-9@:%._\+~#=]{1,256}\.[a-zA-Z0-9()]{1,6}\b(?:[-a-zA-Z0-9()@:%_\+.~#?&\/=]*)$$	string	True			{'syntax': '^{PMID}|{DOI}|{URL}$', 'interpolated': True, 'partial_match': True}		
pcr_cond	pcr conditions	MIXS:0000049		Description of reaction conditions and components of polymerase chain reaction performed during library preparation.	{'value': 'initial denaturation:94degC_1.5min'}	sequencing	condition|pcr			string	True		initial denaturation:degrees_minutes;annealing:degrees_minutes;elongation:degrees_minutes;final elongation:degrees_minutes;total cycles		initial denaturation:degrees_minutes;annealing:degrees_minutes;elongation:degrees_minutes;final elongation:degrees_minutes;total cycles	
pcr_primers	pcr primers	MIXS:0000046		PCR primers that were used to amplify the sequence of the targeted gene, locus or subfragment. This field should contain all the primers used for a single PCR reaction if multiple forward or reverse primers are present in a single PCR reaction. The primer sequence should be reported in uppercase letters	{'value': 'FWD:GTGCCAGCMGCCGCGGTAA;REV:GGACTACHVGGGTWTCTAAT'}	sequencing	pcr			string	True		FWD:{dna};REV:{dna}		FWD: forward primer sequence;REV:reverse primer sequence	
pos_cont_type	positive control type	MIXS:0001322		The substance, mixture, product, or apparatus used to verify that a process which is part of an investigation delivers a true positive		investigation	type			string	True		{term} or {text}			
project_name	project name	MIXS:0000092		Name of the project within which the sequencing was organized	{'value': 'Forest soil metagenome'}	investigation	project			string		True				
rel_to_oxygen	relationship to oxygen	MIXS:0000015		Is this organism an aerobe, anaerobe? Please note that aerobic and anaerobic are valid descriptors for microbial environments	{'value': 'aerobe'}	nucleic acid sequence source	oxygen|relationship			RelToOxygenEnum	True					
samp_collect_device	sample collection device	MIXS:0000002		The device used to collect an environmental sample. This field accepts terms listed under environmental sampling device (http://purl.obolibrary.org/obo/ENVO). This field also accepts terms listed under specimen collection device (http://purl.obolibrary.org/obo/GENEPIO_0002094)	{'value': 'swab, biopsy, niskin bottle, push core, drag swab [GENEPIO:0002713]'}	nucleic acid sequence source	device|sample			string			{termLabel} [{termID}]|{text}		device name	
samp_collect_method	sample collection method	MIXS:0001225		The method employed for collecting the sample	{'value': 'swabbing'}	nucleic acid sequence source	method|sample		^^PMID:\d+$|^doi:10.\d{2,9}/.*$|^https?:\/\/(?:www\.)?[-a-zA-Z0-9@:%._\+~#=]{1,256}\.[a-zA-Z0-9()]{1,6}\b(?:[-a-zA-Z0-9()@:%_\+.~#?&\/=]*)$|([^\s-]{1,2}|[^\s-]+.+[^\s-]+)$	string				{'syntax': '^{PMID}|{DOI}|{URL}|{text}$', 'interpolated': True, 'partial_match': True}		
samp_mat_process	sample material processing	MIXS:0000016		A brief description of any processing applied to the sample during or after retrieving the sample from environment, or a link to the relevant protocol(s) performed	{'value': 'filtering of seawater, storing samples in ethanol'}	nucleic acid sequence source	material|process|sample			string	True					
samp_name	sample name	MIXS:0001107		A local identifier or name that for the material sample used for extracting nucleic acids, and subsequent sequencing. It can refer either to the original material collected or to any derived sub-samples. It can have any format, but we suggest that you make it concise, unique and consistent within your lab, and as informative as possible. INSDC requires every sample name from a single Submitter to be unique. Use of a globally unique identifier for the field source_mat_id is recommended in addition to sample_name	{'value': 'ISDsoil1'}	investigation	sample			string		True				
samp_size	amount or size of sample collected	MIXS:0000001		The total amount or size (volume (ml), mass (g) or area (m2) ) of sample collected	{'value': '5 liter'}	nucleic acid sequence source	sample|size		^[-+]?[0-9]*\.?[0-9]+(?:[eE][-+]?[0-9]+)?( *- *[-+]?[0-9]*\.?[0-9]+(?:[eE][-+]?[0-9]+)?)? *([^\s-]{1,2}|[^\s-]+.+[^\s-]+)$	string				{'syntax': '^{scientific_float}( *- *{scientific_float})? *{text}$', 'interpolated': True, 'partial_match': True}		
samp_taxon_id	taxonomy ID of DNA sample	MIXS:0001320		NCBI taxon id of the sample.  Maybe be a single taxon or mixed taxa sample. Use 'synthetic metagenome  for mock community/positive controls, or 'blank sample' for negative controls	{'value': 'Gut Metagenome [NCBITaxon:749906]'}	investigation	dna|identifier|sample|taxon		^([^\s-]{1,2}|[^\s-]+.+[^\s-]+) \[NCBITaxon:\d+\]$	string		True		{'syntax': '^{text} \\[{NCBItaxon_id}\\]$', 'interpolated': True, 'partial_match': True}		
samp_vol_we_dna_ext	sample volume or weight for DNA extraction	MIXS:0000111		Volume (ml) or mass (g) of total collected sample processed for DNA extraction. Note: total sample collected should be entered under the term Sample Size (MIXS:0000001)	{'value': '1500 milliliter'}	nucleic acid sequence source	dna|sample|volume|weight		^[-+]?[0-9]*\.?[0-9]+(?:[eE][-+]?[0-9]+)?( *- *[-+]?[0-9]*\.?[0-9]+(?:[eE][-+]?[0-9]+)?)? *([^\s-]{1,2}|[^\s-]+.+[^\s-]+)$	string				{'syntax': '^{scientific_float}( *- *{scientific_float})? *{text}$', 'interpolated': True, 'partial_match': True}		milliliter, gram, milligram, square centimeter
seq_meth	sequencing method	MIXS:0000050		Sequencing machine used. Where possible the term should be taken from the OBI list of DNA sequencers (http://purl.obolibrary.org/obo/OBI_0400103)	{'value': '454 Genome Sequencer FLX [OBI:0000702]'}	sequencing	method		^([^\s-]{1,2}|[^\s-]+.+[^\s-]+)|(([^\s-]{1,2}|[^\s-]+.+[^\s-]+) \[[a-zA-Z]{2,}:[a-zA-Z0-9]\d+\])$	string		True		{'syntax': '^{text}|({termLabel} \\[{termID}\\])$', 'interpolated': True, 'partial_match': True}		
seq_quality_check	sequence quality check	MIXS:0000051		Indicate if the sequence has been called by automatic systems (none) or undergone a manual editing procedure (e.g. by inspecting the raw data or chromatograms). Applied only for sequences that are not submitted to SRA,ENA or DRA	{'value': 'none'}	sequencing	quality			SeqQualityCheckEnum	True				none or manually edited	
sop	relevant standard operating procedures	MIXS:0000090		Standard operating procedures used in assembly and/or annotation of genomes, metagenomes or environmental sequences	{'value': 'http://press.igsb.anl.gov/earthmicrobiome/protocols-and-standards/its/'}	sequencing	procedures	True		string	True		{PMID}|{DOI}|{URL}		reference to SOP	
source_mat_id	source material identifiers	MIXS:0000026		A unique identifier assigned to a material sample (as defined by http://rs.tdwg.org/dwc/terms/materialSampleID, and as opposed to a particular digital record of a material sample) used for extracting nucleic acids, and subsequent sequencing. The identifier can refer either to the original material collected or to any derived sub-samples. The INSDC qualifiers /specimen_voucher, /bio_material, or /culture_collection may or may not share the same value as the source_mat_id field. For instance, the /specimen_voucher qualifier and source_mat_id may both contain 'UAM:Herps:14' , referring to both the specimen voucher and sampled tissue with the same identifier. However, the /culture_collection qualifier may refer to a value from an initial culture (e.g. ATCC:11775) while source_mat_id would refer to an identifier from some derived culture from which the nucleic acids were extracted (e.g. xatc123 or ark:/2154/R2)	{'value': 'MPI012345'}	nucleic acid sequence source	identifier|material|source	True		string	True		{text}		for cultures of microorganisms: identifiers for two culture collections; for other material a unique arbitrary identifer	
subspecf_gen_lin	subspecific genetic lineage	MIXS:0000020		Information about the genetic distinctness of the sequenced organism below the subspecies level, e.g., serovar, serotype, biotype, ecotype, or any relevant genetic typing schemes like Group I plasmid. Subspecies should not be recorded in this term, but in the NCBI taxonomy. Supply both the lineage name and the lineage rank separated by a colon, e.g., biovar:abc123	{'value': 'serovar:Newport'}	nucleic acid sequence source	lineage			string	True		{rank name}:{text}		Genetic lineage below lowest rank of NCBI taxonomy, which is subspecies, e.g. serovar, biotype, ecotype, variety, cultivar	
target_gene	target gene	MIXS:0000044		Targeted gene or locus name for marker gene studies	{'value': '16S rRNA, 18S rRNA, nif, amoA, rpo'}	sequencing	target			string		True				
target_subfragment	target subfragment	MIXS:0000045		Name of subfragment of a gene or locus. Important to e.g. identify special regions on marker genes like V6 on 16S rRNA	{'value': 'V6, V9, ITS'}	sequencing	target			string	True					
temp	temperature	MIXS:0000113		Temperature of the sample at the time of sampling	{'value': '25 degree Celsius'}	environment	temperature		^[-+]?[0-9]*\.?[0-9]+(?:[eE][-+]?[0-9]+)?( *- *[-+]?[0-9]*\.?[0-9]+(?:[eE][-+]?[0-9]+)?)? *([^\s-]{1,2}|[^\s-]+.+[^\s-]+)$	string	True			{'syntax': '^{scientific_float}( *- *{scientific_float})? *{text}$', 'interpolated': True, 'partial_match': True}		degree Celsius
trophic_level	trophic level	MIXS:0000032		Trophic levels are the feeding position in a food chain. Microbes can be a range of producers (e.g. chemolithotroph)	{'value': 'heterotroph'}	nucleic acid sequence source	level			TrophicLevelEnum	True					
