name	title	slot_uri	comments	description	examples	in_subset	keywords	multivalued	pattern	range	recommended	required	string_serialization	structured_pattern	Expected_value	Preferred_unit
nitrate	nitrate	MIXS:0000425		Concentration of nitrate in the sample	{'value': '65 micromole per liter'}		nitrate		^[-+]?[0-9]*\.?[0-9]+(?:[eE][-+]?[0-9]+)?( *- *[-+]?[0-9]*\.?[0-9]+(?:[eE][-+]?[0-9]+)?)? *([^\s-]{1,2}|[^\s-]+.+[^\s-]+)$	string				{'syntax': '^{scientific_float}( *- *{scientific_float})? *{text}$', 'interpolated': True, 'partial_match': True}		micromole per liter, milligram per liter, parts per million
nitrite	nitrite	MIXS:0000426		Concentration of nitrite in the sample	{'value': '0.5 micromole per liter'}		nitrite		^[-+]?[0-9]*\.?[0-9]+(?:[eE][-+]?[0-9]+)?( *- *[-+]?[0-9]*\.?[0-9]+(?:[eE][-+]?[0-9]+)?)? *([^\s-]{1,2}|[^\s-]+.+[^\s-]+)$	string				{'syntax': '^{scientific_float}( *- *{scientific_float})? *{text}$', 'interpolated': True, 'partial_match': True}		micromole per liter, milligram per liter, parts per million
nitro	nitrogen	MIXS:0000504		Concentration of nitrogen (total)	{'value': '4.2 micromole per liter'}		nitrogen		^[-+]?[0-9]*\.?[0-9]+(?:[eE][-+]?[0-9]+)?( *- *[-+]?[0-9]*\.?[0-9]+(?:[eE][-+]?[0-9]+)?)? *([^\s-]{1,2}|[^\s-]+.+[^\s-]+)$	string				{'syntax': '^{scientific_float}( *- *{scientific_float})? *{text}$', 'interpolated': True, 'partial_match': True}		micromole per liter
nucl_acid_amp	nucleic acid amplification	MIXS:0000038		A link to a literature reference, electronic resource or a standard operating procedure (SOP), that describes the enzymatic amplification (PCR, TMA, NASBA) of specific nucleic acids	{'value': 'https://phylogenomics.me/protocols/16s-pcr-protocol/'}	sequencing			^^PMID:\d+$|^doi:10.\d{2,9}/.*$|^https?:\/\/(?:www\.)?[-a-zA-Z0-9@:%._\+~#=]{1,256}\.[a-zA-Z0-9()]{1,6}\b(?:[-a-zA-Z0-9()@:%_\+.~#?&\/=]*)$$	string	True			{'syntax': '^{PMID}|{DOI}|{URL}$', 'interpolated': True, 'partial_match': True}		
nucl_acid_ext	nucleic acid extraction	MIXS:0000037		A link to a literature reference, electronic resource or a standard operating procedure (SOP), that describes the material separation to recover the nucleic acid fraction from a sample	{'value': 'https://mobio.com/media/wysiwyg/pdfs/protocols/12888.pdf'}	sequencing			^^PMID:\d+$|^doi:10.\d{2,9}/.*$|^https?:\/\/(?:www\.)?[-a-zA-Z0-9@:%._\+~#=]{1,256}\.[a-zA-Z0-9()]{1,6}\b(?:[-a-zA-Z0-9()@:%_\+.~#?&\/=]*)$$	string	True			{'syntax': '^{PMID}|{DOI}|{URL}$', 'interpolated': True, 'partial_match': True}		
number_contig	number of contigs	MIXS:0000060		Total number of contigs in the cleaned/submitted assembly that makes up a given genome, SAG, MAG, or UViG	{'value': '40'}	sequencing	number			integer						
org_carb	organic carbon	MIXS:0000508		Concentration of organic carbon	{'value': '1.5 microgram per liter'}		carbon|organic		^[-+]?[0-9]*\.?[0-9]+(?:[eE][-+]?[0-9]+)?( *- *[-+]?[0-9]*\.?[0-9]+(?:[eE][-+]?[0-9]+)?)? *([^\s-]{1,2}|[^\s-]+.+[^\s-]+)$	string				{'syntax': '^{scientific_float}( *- *{scientific_float})? *{text}$', 'interpolated': True, 'partial_match': True}		
org_matter	organic matter	MIXS:0000204		Concentration of organic matter	{'value': '1.75 milligram per cubic meter'}		organic		^[-+]?[0-9]*\.?[0-9]+(?:[eE][-+]?[0-9]+)?( *- *[-+]?[0-9]*\.?[0-9]+(?:[eE][-+]?[0-9]+)?)? *([^\s-]{1,2}|[^\s-]+.+[^\s-]+)$	string				{'syntax': '^{scientific_float}( *- *{scientific_float})? *{text}$', 'interpolated': True, 'partial_match': True}		microgram per liter
org_nitro	organic nitrogen	MIXS:0000205		Concentration of organic nitrogen	{'value': '4 micromole per liter'}		nitrogen|organic		^[-+]?[0-9]*\.?[0-9]+(?:[eE][-+]?[0-9]+)?( *- *[-+]?[0-9]*\.?[0-9]+(?:[eE][-+]?[0-9]+)?)? *([^\s-]{1,2}|[^\s-]+.+[^\s-]+)$	string				{'syntax': '^{scientific_float}( *- *{scientific_float})? *{text}$', 'interpolated': True, 'partial_match': True}		
organism_count	organism count	MIXS:0000103		Total cell count of any organism (or group of organisms) per gram, volume or area of sample, should include name of organism followed by count. The method that was used for the enumeration (e.g. qPCR, atp, mpn, etc.) Should also be provided. (example: total prokaryotes; 3.5e7 cells per ml; qpcr)	{'value': 'total prokaryotes;3.5e7 cells per milliliter;qPCR'}		count|organism	True		string			{text};{float} {unit};[ATP|MPN|qPCR|other]		organism name;measurement value;enumeration	
oxy_stat_samp	oxygenation status of sample	MIXS:0000753		Oxygenation status of sample	{'value': 'aerobic'}		oxygen|sample|status			OxyStatSampEnum						
part_org_carb	particulate organic carbon	MIXS:0000515		Concentration of particulate organic carbon	{'value': '1.92 micromole per liter'}		carbon|organic|particle|particulate		^[-+]?[0-9]*\.?[0-9]+(?:[eE][-+]?[0-9]+)?( *- *[-+]?[0-9]*\.?[0-9]+(?:[eE][-+]?[0-9]+)?)? *([^\s-]{1,2}|[^\s-]+.+[^\s-]+)$	string				{'syntax': '^{scientific_float}( *- *{scientific_float})? *{text}$', 'interpolated': True, 'partial_match': True}		
perturbation	perturbation	MIXS:0000754		Type of perturbation, e.g. chemical administration, physical disturbance, etc., coupled with perturbation regimen including how many times the perturbation was repeated, how long each perturbation lasted, and the start and end time of the entire perturbation period; can include multiple perturbation types	{'value': 'antibiotic addition;R2/2018-05-11T14:30Z/2018-05-11T19:30Z/P1H30M'}		perturbation	True		string			{text};{Rn/start_time/end_time/duration}		perturbation type name;perturbation interval and duration	
petroleum_hydrocarb	petroleum hydrocarbon	MIXS:0000516		Concentration of petroleum hydrocarbon	{'value': '0.05 micromole per liter'}		hydrocarbon|petroleum		^[-+]?[0-9]*\.?[0-9]+(?:[eE][-+]?[0-9]+)?( *- *[-+]?[0-9]*\.?[0-9]+(?:[eE][-+]?[0-9]+)?)? *([^\s-]{1,2}|[^\s-]+.+[^\s-]+)$	string				{'syntax': '^{scientific_float}( *- *{scientific_float})? *{text}$', 'interpolated': True, 'partial_match': True}		micromole per liter
ph	pH	MIXS:0001001		Ph measurement of the sample, or liquid portion of sample, or aqueous phase of the fluid	{'value': '7.2'}		ph			float						
phaeopigments	phaeopigments	MIXS:0000180		Concentration of phaeopigments; can include multiple phaeopigments	{'value': '2.5 milligram per cubic meter'}			True		string			{text};{float} {unit}		phaeopigment name;measurement value	milligram per cubic meter
phosphate	phosphate	MIXS:0000505		Concentration of phosphate	{'value': '0.7 micromole per liter'}		phosphate		^[-+]?[0-9]*\.?[0-9]+(?:[eE][-+]?[0-9]+)?( *- *[-+]?[0-9]*\.?[0-9]+(?:[eE][-+]?[0-9]+)?)? *([^\s-]{1,2}|[^\s-]+.+[^\s-]+)$	string				{'syntax': '^{scientific_float}( *- *{scientific_float})? *{text}$', 'interpolated': True, 'partial_match': True}		micromole per liter
phosplipid_fatt_acid	phospholipid fatty acid	MIXS:0000181		Concentration of phospholipid fatty acids; can include multiple values	{'value': '2.98 milligram per liter'}			True		string			{text};{float} {unit}		phospholipid fatty acid name;measurement value	
pos_cont_type	positive control type	MIXS:0001322		The substance, mixture, product, or apparatus used to verify that a process which is part of an investigation delivers a true positive		investigation	type			string	True		{term} or {text}			
potassium	potassium	MIXS:0000430		Concentration of potassium in the sample	{'value': '463 milligram per liter'}				^[-+]?[0-9]*\.?[0-9]+(?:[eE][-+]?[0-9]+)?( *- *[-+]?[0-9]*\.?[0-9]+(?:[eE][-+]?[0-9]+)?)? *([^\s-]{1,2}|[^\s-]+.+[^\s-]+)$	string				{'syntax': '^{scientific_float}( *- *{scientific_float})? *{text}$', 'interpolated': True, 'partial_match': True}		milligram per liter, parts per million
pressure	pressure	MIXS:0000412		Pressure to which the sample is subject to, in atmospheres	{'value': '50 atmosphere'}		pressure		^[-+]?[0-9]*\.?[0-9]+(?:[eE][-+]?[0-9]+)?( *- *[-+]?[0-9]*\.?[0-9]+(?:[eE][-+]?[0-9]+)?)? *([^\s-]{1,2}|[^\s-]+.+[^\s-]+)$	string				{'syntax': '^{scientific_float}( *- *{scientific_float})? *{text}$', 'interpolated': True, 'partial_match': True}		atmosphere
project_name	project name	MIXS:0000092		Name of the project within which the sequencing was organized	{'value': 'Forest soil metagenome'}	investigation	project			string		True				
reassembly_bin	reassembly post binning	MIXS:0000079		Has an assembly been performed on a genome bin extracted from a metagenomic assembly?	{'value': 'no'}	sequencing	post			boolean						
redox_potential	redox potential	MIXS:0000182		Redox potential, measured relative to a hydrogen cell, indicating oxidation or reduction potential	{'value': '300 millivolt'}				^[-+]?[0-9]*\.?[0-9]+(?:[eE][-+]?[0-9]+)?( *- *[-+]?[0-9]*\.?[0-9]+(?:[eE][-+]?[0-9]+)?)? *([^\s-]{1,2}|[^\s-]+.+[^\s-]+)$	string				{'syntax': '^{scientific_float}( *- *{scientific_float})? *{text}$', 'interpolated': True, 'partial_match': True}		millivolt
ref_biomaterial	reference for biomaterial	MIXS:0000025		Primary publication if isolated before genome publication; otherwise, primary genome report	{'value': 'doi:10.1016/j.syapm.2018.01.009'}	nucleic acid sequence source			^^PMID:\d+$|^doi:10.\d{2,9}/.*$|^https?:\/\/(?:www\.)?[-a-zA-Z0-9@:%._\+~#=]{1,256}\.[a-zA-Z0-9()]{1,6}\b(?:[-a-zA-Z0-9()@:%_\+.~#?&\/=]*)$$	string				{'syntax': '^{PMID}|{DOI}|{URL}$', 'interpolated': True, 'partial_match': True}		
ref_db	reference database(s)	MIXS:0000062		List of database(s) used for ORF annotation, along with version number and reference to website or publication	{'value': 'pVOGs;5;http://dmk-brain.ecn.uiowa.edu/pVOGs/ Grazziotin et al. 2017 doi:10.1093/nar/gkw975'}	sequencing	database			string			{database};{version};{reference}		names, versions, and references of databases	
rel_to_oxygen	relationship to oxygen	MIXS:0000015		Is this organism an aerobe, anaerobe? Please note that aerobic and anaerobic are valid descriptors for microbial environments	{'value': 'aerobe'}	nucleic acid sequence source	oxygen|relationship			RelToOxygenEnum						
salinity	salinity	MIXS:0000183		The total concentration of all dissolved salts in a liquid or solid sample. While salinity can be measured by a complete chemical analysis, this method is difficult and time consuming. More often, it is instead derived from the conductivity measurement. This is known as practical salinity. These derivations compare the specific conductance of the sample to a salinity standard such as seawater	{'value': '25 practical salinity unit'}		salinity		^[-+]?[0-9]*\.?[0-9]+(?:[eE][-+]?[0-9]+)?( *- *[-+]?[0-9]*\.?[0-9]+(?:[eE][-+]?[0-9]+)?)? *([^\s-]{1,2}|[^\s-]+.+[^\s-]+)$	string				{'syntax': '^{scientific_float}( *- *{scientific_float})? *{text}$', 'interpolated': True, 'partial_match': True}		practical salinity unit, percentage
samp_collect_device	sample collection device	MIXS:0000002		The device used to collect an environmental sample. This field accepts terms listed under environmental sampling device (http://purl.obolibrary.org/obo/ENVO). This field also accepts terms listed under specimen collection device (http://purl.obolibrary.org/obo/GENEPIO_0002094)	{'value': 'swab, biopsy, niskin bottle, push core, drag swab [GENEPIO:0002713]'}	nucleic acid sequence source	device|sample			string	True		{termLabel} [{termID}]|{text}		device name	
samp_collect_method	sample collection method	MIXS:0001225		The method employed for collecting the sample	{'value': 'swabbing'}	nucleic acid sequence source	method|sample		^^PMID:\d+$|^doi:10.\d{2,9}/.*$|^https?:\/\/(?:www\.)?[-a-zA-Z0-9@:%._\+~#=]{1,256}\.[a-zA-Z0-9()]{1,6}\b(?:[-a-zA-Z0-9()@:%_\+.~#?&\/=]*)$|([^\s-]{1,2}|[^\s-]+.+[^\s-]+)$	string	True			{'syntax': '^{PMID}|{DOI}|{URL}|{text}$', 'interpolated': True, 'partial_match': True}		
samp_mat_process	sample material processing	MIXS:0000016		A brief description of any processing applied to the sample during or after retrieving the sample from environment, or a link to the relevant protocol(s) performed	{'value': 'filtering of seawater, storing samples in ethanol'}	nucleic acid sequence source	material|process|sample			string	True					
samp_name	sample name	MIXS:0001107		A local identifier or name that for the material sample used for extracting nucleic acids, and subsequent sequencing. It can refer either to the original material collected or to any derived sub-samples. It can have any format, but we suggest that you make it concise, unique and consistent within your lab, and as informative as possible. INSDC requires every sample name from a single Submitter to be unique. Use of a globally unique identifier for the field source_mat_id is recommended in addition to sample_name	{'value': 'ISDsoil1'}	investigation	sample			string		True				
samp_size	amount or size of sample collected	MIXS:0000001		The total amount or size (volume (ml), mass (g) or area (m2) ) of sample collected	{'value': '5 liter'}	nucleic acid sequence source	sample|size		^[-+]?[0-9]*\.?[0-9]+(?:[eE][-+]?[0-9]+)?( *- *[-+]?[0-9]*\.?[0-9]+(?:[eE][-+]?[0-9]+)?)? *([^\s-]{1,2}|[^\s-]+.+[^\s-]+)$	string	True			{'syntax': '^{scientific_float}( *- *{scientific_float})? *{text}$', 'interpolated': True, 'partial_match': True}		
samp_store_dur	sample storage duration	MIXS:0000116		Duration for which the sample was stored. Indicate the duration for which the sample was stored written in ISO 8601 format	{'value': 'P1Y6M'}		duration|period|sample|storage		^P(?:(?:\d+D|\d+M(?:\d+D)?|\d+Y(?:\d+M(?:\d+D)?)?)(?:T(?:\d+H(?:\d+M(?:\d+S)?)?|\d+M(?:\d+S)?|\d+S))?|T(?:\d+H(?:\d+M(?:\d+S)?)?|\d+M(?:\d+S)?|\d+S)|\d+W)$	string				{'syntax': '^{duration}$', 'interpolated': True, 'partial_match': True}		
samp_store_loc	sample storage location	MIXS:0000755		Location at which sample was stored, usually name of a specific freezer/room	{'value': 'Freezer no:5'}		location|sample|storage			string			{text}		location name	
samp_store_temp	sample storage temperature	MIXS:0000110		Temperature at which sample was stored, e.g. -80 degree Celsius	{'value': '-80 degree Celsius'}		sample|storage|temperature		^[-+]?[0-9]*\.?[0-9]+(?:[eE][-+]?[0-9]+)?( *- *[-+]?[0-9]*\.?[0-9]+(?:[eE][-+]?[0-9]+)?)? *([^\s-]{1,2}|[^\s-]+.+[^\s-]+)$	string				{'syntax': '^{scientific_float}( *- *{scientific_float})? *{text}$', 'interpolated': True, 'partial_match': True}		degree Celsius
samp_taxon_id	taxonomy ID of DNA sample	MIXS:0001320		NCBI taxon id of the sample.  Maybe be a single taxon or mixed taxa sample. Use 'synthetic metagenome  for mock community/positive controls, or 'blank sample' for negative controls	{'value': 'Gut Metagenome [NCBITaxon:749906]'}	investigation	dna|identifier|sample|taxon		^([^\s-]{1,2}|[^\s-]+.+[^\s-]+) \[NCBITaxon:\d+\]$	string		True		{'syntax': '^{text} \\[{NCBItaxon_id}\\]$', 'interpolated': True, 'partial_match': True}		
samp_vol_we_dna_ext	sample volume or weight for DNA extraction	MIXS:0000111		Volume (ml) or mass (g) of total collected sample processed for DNA extraction. Note: total sample collected should be entered under the term Sample Size (MIXS:0000001)	{'value': '1500 milliliter'}	nucleic acid sequence source	dna|sample|volume|weight		^[-+]?[0-9]*\.?[0-9]+(?:[eE][-+]?[0-9]+)?( *- *[-+]?[0-9]*\.?[0-9]+(?:[eE][-+]?[0-9]+)?)? *([^\s-]{1,2}|[^\s-]+.+[^\s-]+)$	string				{'syntax': '^{scientific_float}( *- *{scientific_float})? *{text}$', 'interpolated': True, 'partial_match': True}		milliliter, gram, milligram, square centimeter
seq_meth	sequencing method	MIXS:0000050		Sequencing machine used. Where possible the term should be taken from the OBI list of DNA sequencers (http://purl.obolibrary.org/obo/OBI_0400103)	{'value': '454 Genome Sequencer FLX [OBI:0000702]'}	sequencing	method		^([^\s-]{1,2}|[^\s-]+.+[^\s-]+)|(([^\s-]{1,2}|[^\s-]+.+[^\s-]+) \[[a-zA-Z]{2,}:[a-zA-Z0-9]\d+\])$	string		True		{'syntax': '^{text}|({termLabel} \\[{termID}\\])$', 'interpolated': True, 'partial_match': True}		
silicate	silicate	MIXS:0000184		Concentration of silicate	{'value': '0.05 micromole per liter'}				^[-+]?[0-9]*\.?[0-9]+(?:[eE][-+]?[0-9]+)?( *- *[-+]?[0-9]*\.?[0-9]+(?:[eE][-+]?[0-9]+)?)? *([^\s-]{1,2}|[^\s-]+.+[^\s-]+)$	string				{'syntax': '^{scientific_float}( *- *{scientific_float})? *{text}$', 'interpolated': True, 'partial_match': True}		micromole per liter
sim_search_meth	similarity search method	MIXS:0000063		Tool used to compare ORFs with database, along with version and cutoffs used	{'value': 'HMMER3;3.1b2;hmmsearch, cutoff of 50 on score'}	sequencing	method		^([^\s-]{1,2}|[^\s-]+.+[^\s-]+);([^\s-]{1,2}|[^\s-]+.+[^\s-]+);([^\s-]{1,2}|[^\s-]+.+[^\s-]+)$	string				{'syntax': '^{software};{version};{parameters}$', 'interpolated': True, 'partial_match': True}		
size_frac	size fraction selected	MIXS:0000017		Filtering pore size used in sample preparation	{'value': '0-0.22 micrometer'}	nucleic acid sequence source	fraction|size			string			{float}-{float} {unit}		filter size value range	
sodium	sodium	MIXS:0000428		Sodium concentration in the sample	{'value': '10.5 milligram per liter'}				^[-+]?[0-9]*\.?[0-9]+(?:[eE][-+]?[0-9]+)?( *- *[-+]?[0-9]*\.?[0-9]+(?:[eE][-+]?[0-9]+)?)? *([^\s-]{1,2}|[^\s-]+.+[^\s-]+)$	string				{'syntax': '^{scientific_float}( *- *{scientific_float})? *{text}$', 'interpolated': True, 'partial_match': True}		milligram per liter, parts per million
sop	relevant standard operating procedures	MIXS:0000090		Standard operating procedures used in assembly and/or annotation of genomes, metagenomes or environmental sequences	{'value': 'http://press.igsb.anl.gov/earthmicrobiome/protocols-and-standards/its/'}	sequencing	procedures	True		string	True		{PMID}|{DOI}|{URL}		reference to SOP	
source_mat_id	source material identifiers	MIXS:0000026		A unique identifier assigned to a material sample (as defined by http://rs.tdwg.org/dwc/terms/materialSampleID, and as opposed to a particular digital record of a material sample) used for extracting nucleic acids, and subsequent sequencing. The identifier can refer either to the original material collected or to any derived sub-samples. The INSDC qualifiers /specimen_voucher, /bio_material, or /culture_collection may or may not share the same value as the source_mat_id field. For instance, the /specimen_voucher qualifier and source_mat_id may both contain 'UAM:Herps:14' , referring to both the specimen voucher and sampled tissue with the same identifier. However, the /culture_collection qualifier may refer to a value from an initial culture (e.g. ATCC:11775) while source_mat_id would refer to an identifier from some derived culture from which the nucleic acids were extracted (e.g. xatc123 or ark:/2154/R2)	{'value': 'MPI012345'}	nucleic acid sequence source	identifier|material|source	True		string	True		{text}		for cultures of microorganisms: identifiers for two culture collections; for other material a unique arbitrary identifer	
sulfate	sulfate	MIXS:0000423		Concentration of sulfate in the sample	{'value': '5 micromole per liter'}		sulfate		^[-+]?[0-9]*\.?[0-9]+(?:[eE][-+]?[0-9]+)?( *- *[-+]?[0-9]*\.?[0-9]+(?:[eE][-+]?[0-9]+)?)? *([^\s-]{1,2}|[^\s-]+.+[^\s-]+)$	string				{'syntax': '^{scientific_float}( *- *{scientific_float})? *{text}$', 'interpolated': True, 'partial_match': True}		micromole per liter, milligram per liter, parts per million
sulfide	sulfide	MIXS:0000424		Concentration of sulfide in the sample	{'value': '2 micromole per liter'}		sulfide		^[-+]?[0-9]*\.?[0-9]+(?:[eE][-+]?[0-9]+)?( *- *[-+]?[0-9]*\.?[0-9]+(?:[eE][-+]?[0-9]+)?)? *([^\s-]{1,2}|[^\s-]+.+[^\s-]+)$	string				{'syntax': '^{scientific_float}( *- *{scientific_float})? *{text}$', 'interpolated': True, 'partial_match': True}		micromole per liter, milligram per liter, parts per million
tax_class	taxonomic classification	MIXS:0000064		Method used for taxonomic classification, along with reference database used, classification rank, and thresholds used to classify new genomes	{'value': 'vConTACT vContact2 (references from NCBI RefSeq v83, genus rank classification, default parameters)'}	sequencing	classification|taxon			string						
tax_ident	taxonomic identity marker	MIXS:0000053		The phylogenetic marker(s) used to assign an organism name to the SAG or MAG	{'value': 'other', 'description': 'was other <colon> rpoB gene'}	sequencing	identifier|marker|taxon			TaxIdentEnum		True				
temp	temperature	MIXS:0000113		Temperature of the sample at the time of sampling	{'value': '25 degree Celsius'}	environment	temperature		^[-+]?[0-9]*\.?[0-9]+(?:[eE][-+]?[0-9]+)?( *- *[-+]?[0-9]*\.?[0-9]+(?:[eE][-+]?[0-9]+)?)? *([^\s-]{1,2}|[^\s-]+.+[^\s-]+)$	string	True			{'syntax': '^{scientific_float}( *- *{scientific_float})? *{text}$', 'interpolated': True, 'partial_match': True}		degree Celsius
tot_carb	total carbon	MIXS:0000525		Total carbon content			carbon|total		^[-+]?[0-9]*\.?[0-9]+(?:[eE][-+]?[0-9]+)?( *- *[-+]?[0-9]*\.?[0-9]+(?:[eE][-+]?[0-9]+)?)? *([^\s-]{1,2}|[^\s-]+.+[^\s-]+)$	string				{'syntax': '^{scientific_float}( *- *{scientific_float})? *{text}$', 'interpolated': True, 'partial_match': True}		
tot_nitro_content	total nitrogen content	MIXS:0000530		Total nitrogen content of the sample	{'value': '35 milligrams Nitrogen per kilogram of soil'}		content|nitrogen|total		^[-+]?[0-9]*\.?[0-9]+(?:[eE][-+]?[0-9]+)?( *- *[-+]?[0-9]*\.?[0-9]+(?:[eE][-+]?[0-9]+)?)? *([^\s-]{1,2}|[^\s-]+.+[^\s-]+)$	string				{'syntax': '^{scientific_float}( *- *{scientific_float})? *{text}$', 'interpolated': True, 'partial_match': True}		
tot_org_carb	total organic carbon	MIXS:0000533		Total organic carbon content	{'value': '0.02'}		carbon|organic|total		^[-+]?[0-9]*\.?[0-9]+(?:[eE][-+]?[0-9]+)?( *- *[-+]?[0-9]*\.?[0-9]+(?:[eE][-+]?[0-9]+)?)? *([^\s-]{1,2}|[^\s-]+.+[^\s-]+)$	string				{'syntax': '^{scientific_float}( *- *{scientific_float})? *{text}$', 'interpolated': True, 'partial_match': True}		gram Carbon per kilogram sample material
trna_ext_software	tRNA extraction software	MIXS:0000068		Tools used for tRNA identification	{'value': 'infernal;v2;default parameters'}	sequencing	software		^([^\s-]{1,2}|[^\s-]+.+[^\s-]+);([^\s-]{1,2}|[^\s-]+.+[^\s-]+);([^\s-]{1,2}|[^\s-]+.+[^\s-]+)$	string				{'syntax': '^{software};{version};{parameters}$', 'interpolated': True, 'partial_match': True}		
trnas	number of standard tRNAs extracted	MIXS:0000067		The total number of tRNAs identified from the SAG or MAG	{'value': '18'}	sequencing	number			string			{integer}		value from 0-21	
turbidity	turbidity	MIXS:0000191		Measure of the amount of cloudiness or haziness in water caused by individual particles	{'value': '0.3 nephelometric turbidity units'}				^[-+]?[0-9]*\.?[0-9]+(?:[eE][-+]?[0-9]+)?( *- *[-+]?[0-9]*\.?[0-9]+(?:[eE][-+]?[0-9]+)?)? *([^\s-]{1,2}|[^\s-]+.+[^\s-]+)$	string				{'syntax': '^{scientific_float}( *- *{scientific_float})? *{text}$', 'interpolated': True, 'partial_match': True}		
water_content	water content	MIXS:0000185		Water content measurement			content|water		^[-+]?[0-9]*\.?[0-9]+(?:[eE][-+]?[0-9]+)?( *- *[-+]?[0-9]*\.?[0-9]+(?:[eE][-+]?[0-9]+)?)? *([^\s-]{1,2}|[^\s-]+.+[^\s-]+)$	string			{float} {unit}	{'syntax': '^{scientific_float}( *- *{scientific_float})? *{text}$', 'interpolated': True, 'partial_match': True}		gram per gram or cubic centimeter per cubic centimeter
x16s_recover	16S recovered	MIXS:0000065		Can a 16S gene be recovered from the submitted SAG or MAG?	{'value': 'yes'}	sequencing	recover			boolean						
x16s_recover_software	16S recovery software	MIXS:0000066		Tools used for 16S rRNA gene extraction	{'value': 'rambl;v2;default parameters'}	sequencing	recover|software		^([^\s-]{1,2}|[^\s-]+.+[^\s-]+);([^\s-]{1,2}|[^\s-]+.+[^\s-]+);([^\s-]{1,2}|[^\s-]+.+[^\s-]+)$	string				{'syntax': '^{software};{version};{parameters}$', 'interpolated': True, 'partial_match': True}		
