name	title	slot_uri	comments	description	examples	in_subset	keywords	multivalued	pattern	range	recommended	required	string_serialization	structured_pattern	Expected_value	Preferred_unit
adapters	adapters	MIXS:0000048		Adapters provide priming sequences for both amplification and sequencing of the sample-library fragments. Both adapters should be reported; in uppercase letters	{'value': 'AATGATACGGCGACCACCGAGATCTACACGCT;CAAGCAGAAGACGGCATACGAGAT'}	sequencing				string	True		{dna};{dna}		adapter A and B sequence	
alkalinity	alkalinity	MIXS:0000421		Alkalinity, the ability of a solution to neutralize acids to the equivalence point of carbonate or bicarbonate	{'value': '50 milligram per liter'}		alkalinity		^[-+]?[0-9]*\.?[0-9]+(?:[eE][-+]?[0-9]+)?( *- *[-+]?[0-9]*\.?[0-9]+(?:[eE][-+]?[0-9]+)?)? *([^\s-]{1,2}|[^\s-]+.+[^\s-]+)$	string				{'syntax': '^{scientific_float}( *- *{scientific_float})? *{text}$', 'interpolated': True, 'partial_match': True}		milliequivalent per liter, milligram per liter
alkyl_diethers	alkyl diethers	MIXS:0000490		Concentration of alkyl diethers	{'value': '0.005 mole per liter'}				^[-+]?[0-9]*\.?[0-9]+(?:[eE][-+]?[0-9]+)?( *- *[-+]?[0-9]*\.?[0-9]+(?:[eE][-+]?[0-9]+)?)? *([^\s-]{1,2}|[^\s-]+.+[^\s-]+)$	string				{'syntax': '^{scientific_float}( *- *{scientific_float})? *{text}$', 'interpolated': True, 'partial_match': True}		
alt	altitude	MIXS:0000094		Heights of objects such as airplanes, space shuttles, rockets, atmospheric balloons and heights of places such as atmospheric layers and clouds. It is used to measure the height of an object which is above the earth's surface. In this context, the altitude measurement is the vertical distance between the earth's surface above sea level and the sampled position in the air	{'value': '100 meter'}	environment			^[-+]?[0-9]*\.?[0-9]+(?:[eE][-+]?[0-9]+)?( *- *[-+]?[0-9]*\.?[0-9]+(?:[eE][-+]?[0-9]+)?)? *([^\s-]{1,2}|[^\s-]+.+[^\s-]+)$	string	True			{'syntax': '^{scientific_float}( *- *{scientific_float})? *{text}$', 'interpolated': True, 'partial_match': True}		meter
aminopept_act	aminopeptidase activity	MIXS:0000172		Measurement of aminopeptidase activity	{'value': '0.269 mole per liter per hour'}				^[-+]?[0-9]*\.?[0-9]+(?:[eE][-+]?[0-9]+)?( *- *[-+]?[0-9]*\.?[0-9]+(?:[eE][-+]?[0-9]+)?)? *([^\s-]{1,2}|[^\s-]+.+[^\s-]+)$	string				{'syntax': '^{scientific_float}( *- *{scientific_float})? *{text}$', 'interpolated': True, 'partial_match': True}		mole per liter per hour
ammonium	ammonium	MIXS:0000427		Concentration of ammonium in the sample	{'value': '1.5 milligram per liter'}				^[-+]?[0-9]*\.?[0-9]+(?:[eE][-+]?[0-9]+)?( *- *[-+]?[0-9]*\.?[0-9]+(?:[eE][-+]?[0-9]+)?)? *([^\s-]{1,2}|[^\s-]+.+[^\s-]+)$	string				{'syntax': '^{scientific_float}( *- *{scientific_float})? *{text}$', 'interpolated': True, 'partial_match': True}		micromole per liter, milligram per liter, parts per million
annot	annotation	MIXS:0000059		Tool used for annotation, or for cases where annotation was provided by a community jamboree or model organism database rather than by a specific submitter	{'value': 'prokka'}	sequencing				string			{text}		name of tool or pipeline used, or annotation source description	
assembly_name	assembly name	MIXS:0000057		Name/version of the assembly provided by the submitter that is used in the genome browsers and in the community	{'value': 'HuRef, JCVI_ISG_i3_1.0'}	sequencing				string	True		{text} {text}		name and version of assembly	
assembly_qual	assembly quality	MIXS:0000056		The assembly quality category is based on sets of criteria outlined for each assembly quality category. For MISAG/MIMAG; Finished: Single, validated, contiguous sequence per replicon without gaps or ambiguities with a consensus error rate equivalent to Q50 or better. High Quality Draft:Multiple fragments where gaps span repetitive regions. Presence of the large subunit (LSU) RNA, small subunit (SSU) and the presence of 5.8S rRNA or 5S rRNA depending on whether it is a eukaryotic or prokaryotic genome, respectively. Medium Quality Draft:Many fragments with little to no review of assembly other than reporting of standard assembly statistics. Low Quality Draft:Many fragments with little to no review of assembly other than reporting of standard assembly statistics. Assembly statistics include, but are not limited to total assembly size, number of contigs, contig N50/L50, and maximum contig length. For MIUVIG; Finished: Single, validated, contiguous sequence per replicon without gaps or ambiguities, with extensive manual review and editing to annotate putative gene functions and transcriptional units. High-quality draft genome: One or multiple fragments, totaling   90% of the expected genome or replicon sequence or predicted complete. Genome fragment(s): One or multiple fragments, totalling < 90% of the expected genome or replicon sequence, or for which no genome size could be estimated	{'value': 'High-quality draft genome'}	sequencing	quality			string		True	[Finished genome|High-quality draft genome|Medium-quality draft genome|Low-quality draft genome|Genome fragment(s)]		enumeration	
assembly_software	assembly software	MIXS:0000058		Tool(s) used for assembly, including version number and parameters	{'value': 'metaSPAdes;3.11.0;kmer set 21,33,55,77,99,121, default parameters otherwise'}	sequencing	software		^([^\s-]{1,2}|[^\s-]+.+[^\s-]+);([^\s-]{1,2}|[^\s-]+.+[^\s-]+);([^\s-]{1,2}|[^\s-]+.+[^\s-]+)$	string		True		{'syntax': '^{software};{version};{parameters}$', 'interpolated': True, 'partial_match': True}		
associated_resource	relevant electronic resources	MIXS:0000091		A related resource that is referenced, cited, or otherwise associated to the sequence	{'value': 'http://www.earthmicrobiome.org/'}	sequencing	resource	True		string	True		{PMID}|{DOI}|{URL}		reference to resource	
bacteria_carb_prod	bacterial carbon production	MIXS:0000173		Measurement of bacterial carbon production	{'value': '2.53 microgram per liter per hour'}		carbon|production		^[-+]?[0-9]*\.?[0-9]+(?:[eE][-+]?[0-9]+)?( *- *[-+]?[0-9]*\.?[0-9]+(?:[eE][-+]?[0-9]+)?)? *([^\s-]{1,2}|[^\s-]+.+[^\s-]+)$	string				{'syntax': '^{scientific_float}( *- *{scientific_float})? *{text}$', 'interpolated': True, 'partial_match': True}		
bin_param	binning parameters	MIXS:0000077		The parameters that have been applied during the extraction of genomes from metagenomic datasets	{'value': 'kmer', 'description': 'was coverage and kmer'}	sequencing	parameter			BinParamEnum		True				
bin_software	binning software	MIXS:0000078		Tool(s) used for the extraction of genomes from metagenomic datasets, where possible include a product ID (PID) of the tool(s) used	{'value': 'MetaCluster-TA (RRID:SCR_004599), MaxBin (biotools:maxbin)'}	sequencing	software			string		True	{software};{version}{PID}		names and versions of software(s) used	
biomass	biomass	MIXS:0000174		Amount of biomass; should include the name for the part of biomass measured, e.g. Microbial, total. Can include multiple measurements	{'value': 'total;20 gram'}		biomass	True		string			{text};{float} {unit}		biomass type;measurement value	ton, kilogram, gram
bishomohopanol	bishomohopanol	MIXS:0000175		Concentration of bishomohopanol	{'value': '14 microgram per liter'}				^[-+]?[0-9]*\.?[0-9]+(?:[eE][-+]?[0-9]+)?( *- *[-+]?[0-9]*\.?[0-9]+(?:[eE][-+]?[0-9]+)?)? *([^\s-]{1,2}|[^\s-]+.+[^\s-]+)$	string				{'syntax': '^{scientific_float}( *- *{scientific_float})? *{text}$', 'interpolated': True, 'partial_match': True}		microgram per liter, microgram per gram
bromide	bromide	MIXS:0000176		Concentration of bromide	{'value': '0.05 parts per million'}				^[-+]?[0-9]*\.?[0-9]+(?:[eE][-+]?[0-9]+)?( *- *[-+]?[0-9]*\.?[0-9]+(?:[eE][-+]?[0-9]+)?)? *([^\s-]{1,2}|[^\s-]+.+[^\s-]+)$	string				{'syntax': '^{scientific_float}( *- *{scientific_float})? *{text}$', 'interpolated': True, 'partial_match': True}		parts per million
calcium	calcium	MIXS:0000432		Concentration of calcium in the sample	{'value': '0.2 micromole per liter'}				^[-+]?[0-9]*\.?[0-9]+(?:[eE][-+]?[0-9]+)?( *- *[-+]?[0-9]*\.?[0-9]+(?:[eE][-+]?[0-9]+)?)? *([^\s-]{1,2}|[^\s-]+.+[^\s-]+)$	string				{'syntax': '^{scientific_float}( *- *{scientific_float})? *{text}$', 'interpolated': True, 'partial_match': True}		milligram per liter, micromole per liter, parts per million
carb_nitro_ratio	carbon/nitrogen ratio	MIXS:0000310		Ratio of amount or concentrations of carbon to nitrogen	{'value': '0.417361111'}		carbon|nitrogen|ratio			float			{float}:{float}		measurement value	
chem_administration	chemical administration	MIXS:0000751		List of chemical compounds administered to the host or site where sampling occurred, and when (e.g. Antibiotics, n fertilizer, air filter); can include multiple compounds. For chemical entities of biological interest ontology (chebi) (v 163), http://purl.bioontology.org/ontology/chebi	{'value': 'agar [CHEBI:2509];2018-05-11T20:00Z'}		administration	True		string			{termLabel} [{termID}];{timestamp}		CHEBI;timestamp	
chloride	chloride	MIXS:0000429		Concentration of chloride in the sample	{'value': '5000 milligram per liter'}				^[-+]?[0-9]*\.?[0-9]+(?:[eE][-+]?[0-9]+)?( *- *[-+]?[0-9]*\.?[0-9]+(?:[eE][-+]?[0-9]+)?)? *([^\s-]{1,2}|[^\s-]+.+[^\s-]+)$	string				{'syntax': '^{scientific_float}( *- *{scientific_float})? *{text}$', 'interpolated': True, 'partial_match': True}		milligram per liter, parts per million
chlorophyll	chlorophyll	MIXS:0000177		Concentration of chlorophyll	{'value': '5 milligram per cubic meter'}				^[-+]?[0-9]*\.?[0-9]+(?:[eE][-+]?[0-9]+)?( *- *[-+]?[0-9]*\.?[0-9]+(?:[eE][-+]?[0-9]+)?)? *([^\s-]{1,2}|[^\s-]+.+[^\s-]+)$	string				{'syntax': '^{scientific_float}( *- *{scientific_float})? *{text}$', 'interpolated': True, 'partial_match': True}		milligram per cubic meter, microgram per liter
collection_date	collection date	MIXS:0000011		The time of sampling, either as an instance (single point in time) or interval. In case no exact time is available, the date/time can be right truncated i.e. all of these are valid times: 2008-01-23T19:23:10+00:00; 2008-01-23T19:23:10; 2008-01-23; 2008-01; 2008; Except: 2008-01; 2008 all are ISO8601 compliant	{'value': '2013-03-25T12:42:31+01:00'}	environment	date			datetime		True				
compl_appr	completeness approach	MIXS:0000071		The approach used to determine the completeness of a given genomic assembly, which would typically make use of a set of conserved marker genes or a closely related reference genome. For UViG completeness, include reference genome or group used, and contig feature suggesting a complete genome	{'value': 'other', 'description': 'was other <colon> UViG length compared to the average length of reference genomes from the P22virus genus (NCBI RefSeq v83)'}	sequencing				ComplApprEnum					text	
compl_score	completeness score	MIXS:0000069		Completeness score is typically based on either the fraction of markers found as compared to a database or the percent of a genome found as compared to a closely related reference genome. High Quality Draft: >90%, Medium Quality Draft: >50%, and Low Quality Draft: < 50% should have the indicated completeness scores	{'value': 'med;60%'}	sequencing	score			string		True	[high|med|low];{percentage}		quality;percent completeness	
compl_software	completeness software	MIXS:0000070		Tools used for completion estimate, i.e. checkm, anvi'o, busco	{'value': 'checkm'}	sequencing	software			string		True	{software};{version}		names and versions of software(s) used	
contam_score	contamination score	MIXS:0000072		The contamination score is based on the fraction of single-copy genes that are observed more than once in a query genome. The following scores are acceptable for; High Quality Draft: < 5%, Medium Quality Draft: < 10%, Low Quality Draft: < 10%. Contamination must be below 5% for a SAG or MAG to be deposited into any of the public databases	{'value': '0.01'}	sequencing	score			float		True				
contam_screen_input	contamination screening input	MIXS:0000005		The type of sequence data used as input	{'value': 'contigs'}	sequencing				ContamScreenInputEnum						
contam_screen_param	contamination screening parameters	MIXS:0000073		Specific parameters used in the decontamination sofware, such as reference database, coverage, and kmers. Combinations of these parameters may also be used, i.e. kmer and coverage, or reference database and kmer	{'value': 'kmer'}	sequencing	parameter			string			[ref db|kmer|coverage|combination];{text|integer}		enumeration;value or name	
decontam_software	decontamination software	MIXS:0000074		Tool(s) used in contamination screening	"{'value': ""anvi'o""}"	sequencing	software			string			[checkm/refinem|anvi'o|prodege|bbtools:decontaminate.sh|acdc|combination]		enumeration	
depth	depth	MIXS:0000018		The vertical distance below local surface. For sediment or soil samples depth is measured from sediment or soil surface, respectively. Depth can be reported as an interval for subsurface samples	{'value': '10 meter'}	environment	depth		^[-+]?[0-9]*\.?[0-9]+(?:[eE][-+]?[0-9]+)?( *- *[-+]?[0-9]*\.?[0-9]+(?:[eE][-+]?[0-9]+)?)? *([^\s-]{1,2}|[^\s-]+.+[^\s-]+)$	string	True			{'syntax': '^{scientific_float}( *- *{scientific_float})? *{text}$', 'interpolated': True, 'partial_match': True}		meter
diether_lipids	diether lipids	MIXS:0000178		Concentration of diether lipids; can include multiple types of diether lipids	{'value': '0.2 nanogram per liter'}			True		string			{text};{float} {unit}		diether lipid name;measurement value	nanogram per liter
diss_carb_dioxide	dissolved carbon dioxide	MIXS:0000436		Concentration of dissolved carbon dioxide in the sample or liquid portion of the sample	{'value': '5 milligram per liter'}		carbon|dissolved		^[-+]?[0-9]*\.?[0-9]+(?:[eE][-+]?[0-9]+)?( *- *[-+]?[0-9]*\.?[0-9]+(?:[eE][-+]?[0-9]+)?)? *([^\s-]{1,2}|[^\s-]+.+[^\s-]+)$	string				{'syntax': '^{scientific_float}( *- *{scientific_float})? *{text}$', 'interpolated': True, 'partial_match': True}		micromole per liter, milligram per liter
diss_hydrogen	dissolved hydrogen	MIXS:0000179		Concentration of dissolved hydrogen	{'value': '0.3 micromole per liter'}		dissolved		^[-+]?[0-9]*\.?[0-9]+(?:[eE][-+]?[0-9]+)?( *- *[-+]?[0-9]*\.?[0-9]+(?:[eE][-+]?[0-9]+)?)? *([^\s-]{1,2}|[^\s-]+.+[^\s-]+)$	string				{'syntax': '^{scientific_float}( *- *{scientific_float})? *{text}$', 'interpolated': True, 'partial_match': True}		micromole per liter
diss_inorg_carb	dissolved inorganic carbon	MIXS:0000434		Dissolved inorganic carbon concentration in the sample, typically measured after filtering the sample using a 0.45 micrometer filter	{'value': '2059 micromole per kilogram'}		carbon|dissolved|inorganic		^[-+]?[0-9]*\.?[0-9]+(?:[eE][-+]?[0-9]+)?( *- *[-+]?[0-9]*\.?[0-9]+(?:[eE][-+]?[0-9]+)?)? *([^\s-]{1,2}|[^\s-]+.+[^\s-]+)$	string				{'syntax': '^{scientific_float}( *- *{scientific_float})? *{text}$', 'interpolated': True, 'partial_match': True}		microgram per liter, milligram per liter, parts per million
diss_org_carb	dissolved organic carbon	MIXS:0000433		Concentration of dissolved organic carbon in the sample, liquid portion of the sample, or aqueous phase of the fluid	{'value': '197 micromole per liter'}		carbon|dissolved|organic		^[-+]?[0-9]*\.?[0-9]+(?:[eE][-+]?[0-9]+)?( *- *[-+]?[0-9]*\.?[0-9]+(?:[eE][-+]?[0-9]+)?)? *([^\s-]{1,2}|[^\s-]+.+[^\s-]+)$	string				{'syntax': '^{scientific_float}( *- *{scientific_float})? *{text}$', 'interpolated': True, 'partial_match': True}		micromole per liter, milligram per liter
diss_org_nitro	dissolved organic nitrogen	MIXS:0000162		Dissolved organic nitrogen concentration measured as; total dissolved nitrogen - NH4 - NO3 - NO2	{'value': '0.05 micromole per liter'}		dissolved|nitrogen|organic		^[-+]?[0-9]*\.?[0-9]+(?:[eE][-+]?[0-9]+)?( *- *[-+]?[0-9]*\.?[0-9]+(?:[eE][-+]?[0-9]+)?)? *([^\s-]{1,2}|[^\s-]+.+[^\s-]+)$	string				{'syntax': '^{scientific_float}( *- *{scientific_float})? *{text}$', 'interpolated': True, 'partial_match': True}		
diss_oxygen	dissolved oxygen	MIXS:0000119		Concentration of dissolved oxygen	{'value': '175 micromole per kilogram'}		dissolved|oxygen		^[-+]?[0-9]*\.?[0-9]+(?:[eE][-+]?[0-9]+)?( *- *[-+]?[0-9]*\.?[0-9]+(?:[eE][-+]?[0-9]+)?)? *([^\s-]{1,2}|[^\s-]+.+[^\s-]+)$	string				{'syntax': '^{scientific_float}( *- *{scientific_float})? *{text}$', 'interpolated': True, 'partial_match': True}		micromole per kilogram, milligram per liter
elev	elevation	MIXS:0000093		Elevation of the sampling site is its height above a fixed reference point, most commonly the mean sea level. Elevation is mainly used when referring to points on the earth's surface, while altitude is used for points above the surface, such as an aircraft in flight or a spacecraft in orbit	{'value': '100 meter'}	environment	elevation		^[-+]?[0-9]*\.?[0-9]+(?:[eE][-+]?[0-9]+)?( *- *[-+]?[0-9]*\.?[0-9]+(?:[eE][-+]?[0-9]+)?)? *([^\s-]{1,2}|[^\s-]+.+[^\s-]+)$	string	True			{'syntax': '^{scientific_float}( *- *{scientific_float})? *{text}$', 'interpolated': True, 'partial_match': True}		meter
env_broad_scale	broad-scale environmental context	MIXS:0000012		Report the major environmental system the sample or specimen came from. The system(s) identified should have a coarse spatial grain, to provide the general environmental context of where the sampling was done (e.g. in the desert or a rainforest). We recommend using subclasses of EnvO s biome class:  http://purl.obolibrary.org/obo/ENVO_00000428. EnvO documentation about how to use the field: https://github.com/EnvironmentOntology/envo/wiki/Using-ENVO-with-MIxS	{'value': 'rangeland biome [ENVO:01000247]'}	environment	context|environmental		^([^\s-]{1,2}|[^\s-]+.+[^\s-]+) \[[a-zA-Z]{2,}:[a-zA-Z0-9]\d+\]$	string		True		{'syntax': '^{termLabel} \\[{termID}\\]$', 'interpolated': True, 'partial_match': True}		
env_local_scale	local environmental context	MIXS:0000013		Report the entity or entities which are in the sample or specimen s local vicinity and which you believe have significant causal influences on your sample or specimen. We recommend using EnvO terms which are of smaller spatial grain than your entry for env_broad_scale. Terms, such as anatomical sites, from other OBO Library ontologies which interoperate with EnvO (e.g. UBERON) are accepted in this field. EnvO documentation about how to use the field: https://github.com/EnvironmentOntology/envo/wiki/Using-ENVO-with-MIxS	{'value': 'hillside [ENVO:01000333]'}	environment	context|environmental			string		True	{termLabel} [{termID}]		Environmental entities having causal influences upon the entity at time of sampling	
env_medium	environmental medium	MIXS:0000014		Report the environmental material(s) immediately surrounding the sample or specimen at the time of sampling. We recommend using subclasses of 'environmental material' (http://purl.obolibrary.org/obo/ENVO_00010483). EnvO documentation about how to use the field: https://github.com/EnvironmentOntology/envo/wiki/Using-ENVO-with-MIxS . Terms from other OBO ontologies are permissible as long as they reference mass/volume nouns (e.g. air, water, blood) and not discrete, countable entities (e.g. a tree, a leaf, a table top)	{'value': 'bluegrass field soil [ENVO:00005789]'}	environment	environmental		^([^\s-]{1,2}|[^\s-]+.+[^\s-]+) \[[a-zA-Z]{2,}:[a-zA-Z0-9]\d+\]$	string		True		{'syntax': '^{termLabel} \\[{termID}\\]$', 'interpolated': True, 'partial_match': True}		
experimental_factor	experimental factor	MIXS:0000008		Variable aspects of an experiment design that can be used to describe an experiment, or set of experiments, in an increasingly detailed manner. This field accepts ontology terms from Experimental Factor Ontology (EFO) and/or Ontology for Biomedical Investigations (OBI)	{'value': 'time series design [EFO:0001779]'}	investigation	experimental|factor	True	^\S+.*\S+ \[[a-zA-Z]{2,}:\d+\]$	string	True		{termLabel} [{termID}]|{text}		text or EFO and/or OBI	
feat_pred	feature prediction	MIXS:0000061		Method used to predict UViGs features such as ORFs, integration site, etc	{'value': 'Prodigal;2.6.3;default parameters'}	sequencing	feature|predict		^([^\s-]{1,2}|[^\s-]+.+[^\s-]+);([^\s-]{1,2}|[^\s-]+.+[^\s-]+);([^\s-]{1,2}|[^\s-]+.+[^\s-]+)$	string				{'syntax': '^{software};{version};{parameters}$', 'interpolated': True, 'partial_match': True}		
geo_loc_name	geographic location (country and/or sea,region)	MIXS:0000010		The geographical origin of the sample as defined by the country or sea name followed by specific region name. Country or sea names should be chosen from the INSDC country list (http://insdc.org/country.html), or the GAZ ontology (http://purl.bioontology.org/ontology/GAZ)	{'value': 'USA: Maryland, Bethesda'}	environment	geographic|location		^([^\s-]{1,2}|[^\s-]+.+[^\s-]+): ([^\s-]{1,2}|[^\s-]+.+[^\s-]+), ([^\s-]{1,2}|[^\s-]+.+[^\s-]+)$	string		True		{'syntax': '^{text}: {text}, {text}$', 'interpolated': True, 'partial_match': True}		
glucosidase_act	glucosidase activity	MIXS:0000137		Measurement of glucosidase activity	{'value': '5 mol per liter per hour'}				^[-+]?[0-9]*\.?[0-9]+(?:[eE][-+]?[0-9]+)?( *- *[-+]?[0-9]*\.?[0-9]+(?:[eE][-+]?[0-9]+)?)? *([^\s-]{1,2}|[^\s-]+.+[^\s-]+)$	string				{'syntax': '^{scientific_float}( *- *{scientific_float})? *{text}$', 'interpolated': True, 'partial_match': True}		mol per liter per hour
lat_lon	geographic location (latitude and longitude)	MIXS:0000009		The geographical origin of the sample as defined by latitude and longitude. The values should be reported in decimal degrees and in WGS84 system	{'value': '50.586825 6.408977'}	environment	geographic|location		^(-?((?:[0-8]?[0-9](?:\.\d{0,8})?)|90)) -?[0-9]+(?:\.[0-9]{0,8})?$|^-?(1[0-7]{1,2})$	string		True	{float} {float}	{'syntax': '^{lat} {lon}$', 'interpolated': True, 'partial_match': True}	decimal degrees,  limit to 8 decimal points	
lib_layout	library layout	MIXS:0000041		Specify whether to expect single, paired, or other configuration of reads	{'value': 'paired'}	sequencing	library			LibLayoutEnum	True					
lib_reads_seqd	library reads sequenced	MIXS:0000040		Total number of clones sequenced from the library	{'value': '20'}	sequencing	library			integer	True					
lib_screen	library screening strategy	MIXS:0000043		Specific enrichment or screening methods applied before and/or after creating libraries	{'value': 'enriched, screened, normalized'}	sequencing	library			string	True		{text}		screening strategy name	
lib_size	library size	MIXS:0000039		Total number of clones in the library prepared for the project	{'value': '50'}	sequencing	library|size			integer	True					
lib_vector	library vector	MIXS:0000042		Cloning vector type(s) used in construction of libraries	{'value': 'Bacteriophage P1'}	sequencing	library			string	True		{text}		vector	
mag_cov_software	MAG coverage software	MIXS:0000080		Tool(s) used to determine the genome coverage if coverage is used as a binning parameter in the extraction of genomes from metagenomic datasets	{'value': 'bbmap'}	sequencing	software			MagCovSoftwareEnum						
magnesium	magnesium	MIXS:0000431		Concentration of magnesium in the sample	{'value': '52.8 micromole per kilogram'}				^[-+]?[0-9]*\.?[0-9]+(?:[eE][-+]?[0-9]+)?( *- *[-+]?[0-9]*\.?[0-9]+(?:[eE][-+]?[0-9]+)?)? *([^\s-]{1,2}|[^\s-]+.+[^\s-]+)$	string				{'syntax': '^{scientific_float}( *- *{scientific_float})? *{text}$', 'interpolated': True, 'partial_match': True}		mole per liter, milligram per liter, parts per million, micromole per kilogram
mean_frict_vel	mean friction velocity	MIXS:0000498		Measurement of mean friction velocity	{'value': '0.5 meter per second'}		mean|velocity		^[-+]?[0-9]*\.?[0-9]+(?:[eE][-+]?[0-9]+)?( *- *[-+]?[0-9]*\.?[0-9]+(?:[eE][-+]?[0-9]+)?)? *([^\s-]{1,2}|[^\s-]+.+[^\s-]+)$	string				{'syntax': '^{scientific_float}( *- *{scientific_float})? *{text}$', 'interpolated': True, 'partial_match': True}		meter per second
mean_peak_frict_vel	mean peak friction velocity	MIXS:0000502		Measurement of mean peak friction velocity	{'value': '1 meter per second'}		mean|peak|velocity		^[-+]?[0-9]*\.?[0-9]+(?:[eE][-+]?[0-9]+)?( *- *[-+]?[0-9]*\.?[0-9]+(?:[eE][-+]?[0-9]+)?)? *([^\s-]{1,2}|[^\s-]+.+[^\s-]+)$	string				{'syntax': '^{scientific_float}( *- *{scientific_float})? *{text}$', 'interpolated': True, 'partial_match': True}		meter per second
methane	methane	MIXS:0000101		Methane (gas) amount or concentration at the time of sampling	{'value': '0.15 micromole per liter'}				^[-+]?[0-9]*\.?[0-9]+(?:[eE][-+]?[0-9]+)?( *- *[-+]?[0-9]*\.?[0-9]+(?:[eE][-+]?[0-9]+)?)? *([^\s-]{1,2}|[^\s-]+.+[^\s-]+)$	string				{'syntax': '^{scientific_float}( *- *{scientific_float})? *{text}$', 'interpolated': True, 'partial_match': True}		micromole per liter, parts per billion, parts per million
mid	multiplex identifiers	MIXS:0000047		Molecular barcodes, called Multiplex Identifiers (MIDs), that are used to specifically tag unique samples in a sequencing run. Sequence should be reported in uppercase letters	{'value': 'GTGAATAT'}	sequencing	identifier		^[ACGTRKSYMWBHDVN]+$	string	True			{'syntax': '^{ambiguous_nucleotides}$', 'interpolated': True, 'partial_match': True}		
misc_param	miscellaneous parameter	MIXS:0000752		Any other measurement performed or parameter collected, that is not listed here	{'value': 'Bicarbonate ion concentration;2075 micromole per kilogram'}		parameter	True		string			{text};{float} {unit}		parameter name;measurement value	
n_alkanes	n-alkanes	MIXS:0000503		Concentration of n-alkanes; can include multiple n-alkanes	{'value': 'n-hexadecane;100 milligram per liter'}			True		string			{text};{float} {unit}		n-alkane name;measurement value	
neg_cont_type	negative control type	MIXS:0001321		The substance or equipment used as a negative control in an investigation		investigation	type			NegContTypeEnum	True				enumeration or text	
